A1: BW 61 Mülheim - 3. Mannschaft | B1: BW 61 Mülheim - 3. Mannschaft
A2: Saison 2011/2012 in der Bezirksklasse 2 Tabelle vom 5. Spieltag Bestenliste vom 5. Spieltag 5. Ligenspieltag ( 23.10.11 ) 4. Ligenspieltag ( 16.10.11 ) 3. Ligenspieltag ( 02.10.11 ) spielfrei 2. Ligenspieltag ( 18.09.11 ) 1. Ligenspieltag ( 11.09.11 ) | B2: Spielplan und Ergebnisse Bezirksliga 2 2011/2012 Alle Spielberichte gibt es wie immer unter www.w-k-v.de Hinrunde Rückrunde

A1: Platz | B1: Mannschaft | C1: Spiele | D1: Punkte | E1: Heim | F1: Ausw. | G1: +/- | H1: EWP | I1: Holz | J1: Ø Heim | K1: Ø ausw. | L1: Ø Heim | M1: Ø ausw.
A2: 1 | B2: Sk Kamp-Lintfort 4 | C2: 4 | D2: =E2+F2 -> 12 | E2: 6 | F2: 6 | G2: 6 | H2: 192 | I2: 18667 | J2: 4826 | K2: 4507.5 | L2: 804.33333333333337 | M2: 751.25
A3: 2 | B3: Sk Dinslaken 3 | C3: 5 | D3: =E3+F3 -> 9 | E3: 5 | F3: 4 | G3: 0 | H3: 214 | I3: 22920 | J3: 4823.666666666667 | K3: 4224.5 | L3: 803.94444444444446 | M3: 704.08333333333337
A4: 3 | B4: BFG 1920 Wesel 2 | C4: 4 | D4: =E4+F4 -> 8 | E4: 7 | F4: 1 | G4: 1 | H4: 179 | I4: 17451 | J4: 4490 | K4: 4235.5 | L4: 748.33333333333337 | M4: 705.91666666666663
A5: 4 | B5: BW 61 Mülheim 3 | C5: 4 | D5: =E5+F5 -> 6 | E5: 5 | F5: 1 | G5: 0 | H5: 151 | I5: 17389 | J5: 4367.5 | K5: 4327 | L5: 727.91666666666663 | M5: 721.16666666666663
A6: 5 | B6: SKG 31 Essen | C6: 5 | D6: =E6+F6 -> 5 | E6: 2 | F6: 3 | G6: -4 | H6: 179 | I6: 21500 | J6: 4389.333333333333 | K6: 4166 | L6: 731.55555555555554 | M6: 694.33333333333337
A7: 6 | B7: SK 66/99 Solingen 2 | C7: 4 | D7: =E7+F7 -> 3 | E7: 2 | F7: 1 | G7: 0 | H7: 125 | I7: 16799 | J7: 4440 | K7: 4119.666666666667 | L7: 740 | M7: 686.6111111111112
A8: 7 | B8: KSC Harmonie Duisburg 2 | C8: 4 | D8: =E8+F8 -> 2 | E8: 2 | F8: 0 | G8: -4 | H8: 130 | I8: 17294 | J8: 4221.5 | K8: 4425.5 | L8: 703.58333333333337 | M8: 737.58333333333337

A1: Pl. | B1: Spieler | C1: Mannschaft | D1: S. | E1: EWP | F1: Ø | G1: Holz | H1: Ø | I1: Ø H. | J1: Ø A. | K1: Max
A2: 1 | B2: Maternowski, Dariusz | C2: KSG 31 Essen 2 | D2: 5 | E2: 54 | F2: 10.8 | G2: 3812 | H2: 762.4 | I2: 765.0 | J2: 758.5 | K2: 793
A3: 2 | B3: Rienäcker, Uwe | C3: SK Dinslaken 3 | D3: 5 | E3: 52 | F3: 10.4 | G3: 3830 | H3: 766.0 | I3: 776.7 | J3: 750.0 | K3: 793
A4: 3 | B4: Neuschl, Hans-Josef | C4: SK Kamp-Lintfort 4 | D4: 4 | E4: 40 | F4: 10.0 | G4: 3233 | H4: 808.3 | I4: 829.5 | J4: 787.0 | K4: 837
A5: 4 | B5: Zimmermann, Kim | C5: BW 61 Mülheim 3 | D5: 4 | E5: 40 | F5: 10.0 | G5: 3077 | H5: 769.3 | I5: 765.0 | J5: 773.5 | K5: 798
A6: 5 | B6: Neuschl, Michael | C6: SK Kamp-Lintfort 4 | D6: 4 | E6: 37 | F6: 9.3 | G6: 3132 | H6: 783.0 | I6: 809.5 | J6: 756.5 | K6: 813
A7: 6 | B7: Uland, Hilmar | C7: BFG 1920 Wesel 2 | D7: 4 | E7: 35 | F7: 8.8 | G7: 2972 | H7: 743.0 | I7: 771.5 | J7: 714.5 | K7: 810
A8: 7 | B8: Otremba, Maik | C8: SK Dinslaken 3 | D8: 4 | E8: 32 | F8: 8.0 | G8: 2986 | H8: 746.5 | I8: 753.7 | J8: 725.0 | K8: 791
A9: 8 | B9: Moschüring, Ernst | C9: BFG 1920 Wesel 2 | D9: 4 | E9: 30 | F9: 7.5 | G9: 2938 | H9: 734.5 | I9: 761.5 | J9: 707.5 | K9: 772
A10: 9 | B10: Schmellenkamp, Wolfgang | C10: BFG 1920 Wesel 2 | D10: 4 | E10: 29 | F10: 7.3 | G10: 2890 | H10: 722.5 | I10: 729.0 | J10: 716.0 | K10: 741
A11: 10 | B11: Günther, Bernd | C11: SK Kamp-Lintfort 4 | D11: 3 | E11: 28 | F11: 9.3 | G11: 2367 | H11: 789.0 | I11: 803.5 | J11: 760.0 | K11: 808
A12: 11 | B12: König, Dietmar | C12: BFG 1920 Wesel 2 | D12: 3 | E12: 28 | F12: 9.3 | G12: 2287 | H12: 762.3 | I12: 777.5 | J12: 732.0 | K12: 812
A13: 12 | B13: Dahlmann, Carsten | C13: BFG 1920 Wesel 2 | D13: 3 | E13: 27 | F13: 9.0 | G13: 2190 | H13: 730.0 | I13: 736.0 | J13: 727.0 | K13: 736
A14: 13 | B14: Buchholz, Rainer | C14: SK Kamp-Lintfort 4 | D14: 4 | E14: 27 | F14: 6.8 | G14: 3052 | H14: 763.0 | I14: 789.0 | J14: 737.0 | K14: 829
A15: 14 | B15: Jonigkeit, Wolfgang | C15: KSG 31 Essen 2 | D15: 3 | E15: 26 | F15: 8.7 | G15: 2253 | H15: 751.0 | I15: 779.5 | J15: 694.0 | K15: 801
A16: 15 | B16: Martini, Dirk | C16: KSC Harmonie Duisburg 2 | D16: 4 | E16: 25 | F16: 6.3 | G16: 2920 | H16: 730.0 | I16: 718.0 | J16: 742.0 | K16: 744
A17: 16 | B17: Grans, Heinz-Gerd | C17: SK Dinslaken 3 | D17: 5 | E17: 25 | F17: 5.0 | G17: 3599 | H17: 719.8 | I17: 715.7 | J17: 726.0 | K17: 759
A18: 17 | B18: Kusiek, Manfred | C18: SK 66/99 Solingen 2 | D18: 3 | E18: 24 | F18: 8.0 | G18: 2230 | H18: 743.3 | J18: 743.3 | K18: 751
A19: 18 | B19: Eichenhofer, Nils | C19: SK Kamp-Lintfort 4 | D19: 4 | E19: 24 | F19: 6.0 | G19: 3029 | H19: 757.3 | I19: 784.5 | J19: 730.0 | K19: 788
A20: 19 | B20: Bellendorf, Olaf | C20: KSG 31 Essen 2 | D20: 4 | E20: 24 | F20: 6.0 | G20: 2812 | H20: 703.0 | I20: 719.0 | J20: 687.0 | K20: 729
A21: 20 | B21: Schröter, Wolfgang | C21: SK Dinslaken 3 | D21: 3 | E21: 23 | F21: 7.7 | G21: 2240 | H21: 746.7 | I21: 788.0 | J21: 726.0 | K21: 788
A22: 21 | B22: Blankenheim, Peter | C22: KSC Harmonie Duisburg 2 | D22: 4 | E22: 23 | F22: 5.8 | G22: 2904 | H22: 726.0 | I22: 688.5 | J22: 763.5 | K22: 782
A23: 22 | B23: Dießner, Peter | C23: KSC Harmonie Duisburg 2 | D23: 4 | E23: 23 | F23: 5.8 | G23: 2872 | H23: 718.0 | I23: 708.5 | J23: 727.5 | K23: 764
A24: 23 | B24: Schlossnikl, Ernst | C24: KSG 31 Essen 2 | D24: 5 | E24: 21 | F24: 4.2 | G24: 3516 | H24: 703.2 | I24: 701.0 | J24: 706.5 | K24: 722
A25: 24 | B25: Dessi, Bruno | C25: SK Kamp-Lintfort 4 | D25: 3 | E25: 20 | F25: 6.7 | G25: 2267 | H25: 755.7 | I25: 776.0 | J25: 745.5 | K25: 776
A26: 25 | B26: Ciemniak, Heinz | C26: SK Dinslaken 3 | D26: 3 | E26: 19 | F26: 6.3 | G26: 2212 | H26: 737.3 | I26: 769.5 | J26: 673.0 | K26: 770
A27: 26 | B27: Gietzen, Holger | C27: BW 61 Mülheim 3 | D27: 3 | E27: 18 | F27: 6.0 | G27: 2162 | H27: 720.7 | I27: 729.0 | J27: 704.0 | K27: 740
A28: 27 | B28: Dorrenbach, Michael | C28: KSC Harmonie Duisburg 2 | D28: 2 | E28: 17 | F28: 8.5 | G28: 1458 | H28: 729.0 | I28: 729.0 | K28: 750
A29: 28 | B29: Jacobs, Leonhard | C29: BW 61 Mülheim 3 | D29: 2 | E29: 17 | F29: 8.5 | G29: 1458 | H29: 729.0 | I29: 729.0 | K29: 733
A30: 29 | B30: Deing, Hendrik | C30: BFG 1920 Wesel 2 | D30: 4 | E30: 17 | F30: 4.3 | G30: 2726 | H30: 681.5 | I30: 700.5 | J30: 662.5 | K30: 704
A31: 30 | B31: Pieckardt, Friedrich | C31: SK 66/99 Solingen 2 | D31: 2 | E31: 15 | F31: 7.5 | G31: 1500 | H31: 750.0 | I31: 776.0 | J31: 724.0 | K31: 776
A32: 31 | B32: Grolmuss, Johann | C32: SK Dinslaken 3 | D32: 3 | E32: 15 | F32: 5.0 | G32: 2209 | H32: 736.3 | I32: 745.5 | J32: 718.0 | K32: 760
A33: 32 | B33: Neumann, Frank | C33: KSC Harmonie Duisburg 2 | D33: 2 | E33: 14 | F33: 7.0 | G33: 1536 | H33: 768.0 | J33: 768.0 | K33: 774
A34: 33 | B34: Keßler, Detlef | C34: SK 66/99 Solingen 2 | D34: 2 | E34: 14 | F34: 7.0 | G34: 1420 | H34: 710.0 | I34: 749.0 | J34: 671.0 | K34: 749
A35: 34 | B35: Warbruck, Edgar | C35: SK 66/99 Solingen 2 | D35: 3 | E35: 14 | F35: 4.7 | G35: 2078 | H35: 692.7 | I35: 731.0 | J35: 673.5 | K35: 731
A36: 35 | B36: Würg, Rolf | C36: KSC Harmonie Duisburg 2 | D36: 4 | E36: 14 | F36: 3.5 | G36: 2807 | H36: 701.8 | I36: 696.0 | J36: 707.5 | K36: 734
A37: 36 | B37: Brode, Siegfried | C37: SK Dinslaken 3 | D37: 1 | E37: 12 | F37: 12.0 | G37: 803 | H37: 803.0 | J37: 803.0 | K37: 803
A38: 37 | B38: Peters, Tim | C38: SK Kamp-Lintfort 4 | D38: 1 | E38: 12 | F38: 12.0 | G38: 844 | H38: 844.0 | I38: 844.0 | K38: 844
A39: 38 | B39: Sommer, Roland | C39: KSG 31 Essen 2 | D39: 1 | E39: 12 | F39: 12.0 | G39: 818 | H39: 818.0 | I39: 818.0 | K39: 818
A40: 39 | B40: Strack, Hans-Peter | C40: BW 61 Mülheim 3 | D40: 1 | E40: 12 | F40: 12.0 | G40: 778 | H40: 778.0 | I40: 778.0 | K40: 778
A41: 40 | B41: Boleshazi, Alfonz | C41: SK 66/99 Solingen 2 | D41: 2 | E41: 12 | F41: 6.0 | G41: 1446 | H41: 723.0 | J41: 723.0 | K41: 751
A42: 41 | B42: Rothe, Helmut | C42: BW 61 Mülheim 3 | D42: 3 | E42: 12 | F42: 4.0 | G42: 2107 | H42: 702.3 | I42: 686.0 | J42: 710.5 | K42: 741
A43: 42 | B43: Kaufmann, Josef | C43: SK 66/99 Solingen 2 | D43: 1 | E43: 11 | F43: 11.0 | G43: 810 | H43: 810.0 | J43: 810.0 | K43: 810
A44: 43 | B44: Sicking, Ewald | C44: BW 61 Mülheim 3 | D44: 1 | E44: 11 | F44: 11.0 | G44: 794 | H44: 794.0 | J44: 794.0 | K44: 794
A45: 44 | B45: Dudler, Bernhard | C45: SK Dinslaken 3 | D45: 1 | E45: 11 | F45: 11.0 | G45: 809 | H45: 809.0 | I45: 809.0 | K45: 809
A46: 45 | B46: Erwied, Jochen | C46: BFG 1920 Wesel 2 | D46: 1 | E46: 11 | F46: 11.0 | G46: 764 | H46: 764.0 | I46: 764.0 | K46: 764
A47: 46 | B47: Bott, Helmut | C47: BW 61 Mülheim 3 | D47: 2 | E47: 11 | F47: 5.5 | G47: 1459 | H47: 729.5 | I47: 718.0 | J47: 741.0 | K47: 741
A48: 47 | B48: Kranz, Egon | C48: KSG 31 Essen 2 | D48: 3 | E48: 11 | F48: 3.7 | G48: 2095 | H48: 698.3 | I48: 693.0 | J48: 709.0 | K48: 709
A49: 48 | B49: Warzanski, Michael | C49: SK Dinslaken 3 | D49: 1 | E49: 10 | F49: 10.0 | G49: 770 | H49: 770.0 | I49: 770.0 | K49: 770
A50: 49 | B50: Berger, Klaus | C50: KSG 31 Essen 2 | D50: 2 | E50: 10 | F50: 5.0 | G50: 1411 | H50: 705.5 | I50: 719.0 | J50: 692.0 | K50: 719
A51: 50 | B51: Brosz, Thomas | C51: KSG 31 Essen 2 | D51: 1 | E51: 9 | F51: 9.0 | G51: 768 | H51: 768.0 | I51: 768.0 | K51: 768
A52: 51 | B52: Jankovic, Ilija | C52: SK Dinslaken 3 | D52: 1 | E52: 9 | F52: 9.0 | G52: 765 | H52: 765.0 | I52: 765.0 | K52: 765
A53: 52 | B53: Dziura, Torben | C53: BW 61 Mülheim 3 | D53: 3 | E53: 9 | F53: 3.0 | G53: 2112 | H53: 704.0 | I53: 677.0 | J53: 717.5 | K53: 757
A54: 53 | B54: Haber, Herbert | C54: SK 66/99 Solingen 2 | D54: 3 | E54: 9 | F54: 3.0 | G54: 1991 | H54: 663.7 | I54: 715.0 | J54: 638.0 | K54: 715
A55: 54 | B55: Peters, Horst | C55: SK 66/99 Solingen 2 | D55: 1 | E55: 8 | F55: 8.0 | G55: 739 | H55: 739.0 | I55: 739.0 | K55: 739
A56: 55 | B56: Dentgen, Andre | C56: BW 61 Mülheim 3 | D56: 2 | E56: 8 | F56: 4.0 | G56: 1416 | H56: 708.0 | I56: 680.0 | J56: 736.0 | K56: 736
A57: 56 | B57: Brötz, Peter | C57: KSG 31 Essen 2 | D57: 5 | E57: 8 | F57: 1.6 | G57: 3351 | H57: 670.2 | I57: 694.0 | J57: 634.5 | K57: 700
A58: 57 | B58: Armonys, Günther | C58: KSC Harmonie Duisburg 2 | D58: 1 | E58: 7 | F58: 7.0 | G58: 718 | H58: 718.0 | I58: 718.0 | K58: 718
A59: 58 | B59: Ambrosius, Peter | C59: KSC Harmonie Duisburg 2 | D59: 3 | E59: 7 | F59: 2.3 | G59: 2079 | H59: 693.0 | I59: 645.0 | J59: 717.0 | K59: 718
A60: 59 | B60: Kissing, Dirk | C60: SK 66/99 Solingen 2 | D60: 1 | E60: 6 | F60: 6.0 | G60: 741 | H60: 741.0 | J60: 741.0 | K60: 741
A61: 60 | B61: Farkas, Anton | C61: SK 66/99 Solingen 2 | D61: 1 | E61: 5 | F61: 5.0 | G61: 730 | H61: 730.0 | I61: 730.0 | K61: 730
A62: 61 | B62: Fusek, Bernd | C62: SK Kamp-Lintfort 4 | D62: 1 | E62: 4 | F62: 4.0 | G62: 743 | H62: 743.0 | J62: 743.0 | K62: 743
A63: 62 | B63: Köhler, Ludwig | C63: SK Dinslaken 3 | D63: 1 | E63: 4 | F63: 4.0 | G63: 727 | H63: 727.0 | J63: 727.0 | K63: 727
A64: 63 | B64: Jonigkeit, Walter | C64: KSG 31 Essen 2 | D64: 1 | E64: 4 | F64: 4.0 | G64: 664 | H64: 664.0 | J64: 664.0 | K64: 664
A65: 64 | B65: Haber, Fredi | C65: SK 66/99 Solingen 2 | D65: 2 | E65: 3 | F65: 1.5 | G65: 1347 | H65: 673.5 | J65: 673.5 | K65: 678
A66: 65 | B66: Müller, Werner | C66: BFG 1920 Wesel 2 | D66: 1 | E66: 2 | F66: 2.0 | G66: 684 | H66: 684.0 | J66: 684.0 | K66: 684
A67: 66 | B67: Oberstraß, Gerhard | C67: SK 66/99 Solingen 2 | D67: 1 | E67: 2 | F67: 2.0 | G67: 578 | H67: 578.0 | J67: 578.0 | K67: 578
A68: 67 | B68: Dentgen, Ralf | C68: BW 61 Mülheim 3 | D68: 2 | E68: 2 | F68: 1.0 | G68: 1355 | H68: 677.5 | J68: 677.5 | K68: 694
A69: 68 | B69: Orchowski, Dieter | C69: SK Dinslaken 3 | D69: 2 | E69: 2 | F69: 1.0 | G69: 1070 | H69: 535.0 | I69: 671.0 | J69: 399.0 | K69: 671
A70: 69 | B70: Leibeling, Lothar | C70: SK 66/99 Solingen 2 | D70: 1 | E70: 1 | F70: 1.0 | G70: 657 | H70: 657.0 | J70: 657.0 | K70: 657
A71: 70 | B71: Müller, Joachim | C71: SK 66/99 Solingen 2 | D71: 1 | E71: 1 | F71: 1.0 | G71: 532 | H71: 532.0 | J71: 532.0 | K71: 532

A1: Blau-Weiß 61 Mülheim 3 | D1: BFG 1920 Wesel 2
A2: Rothe, Helmut | B2: 686 | C2: 6 | D2: Keßler, Detlef | E2: 671 | F2: 5
A3: Zimmermann, Kim | B3: 772 | C3: 11 | D3: Habert, Herbert | E3: 587 | F3: 3
A4: Strack, Hans-Peter | B4: 778 | C4: 12 | D4: Kusiek, Manfred | E4: 751 | F4: 10
A5: Jacobs, Leonhard | B5: 725 | C5: 8 | D5: Warbruck, Edgar | E5: 662 | F5: 4
A6: Gietzen, Holger | B6: 740 | C6: 9 | D6: Oberstraß, Gerhard | E6: 578 | F6: 2
A7: Bott, Helmut | B7: 718 | C7: 7 | D7: Müller, Joachim | E7: 532 | F7: 1
A8: Einzelwertungspunkte (EWP) | C8: 53 | D8: 25
A9: Punkte | C9: 3 | D9: 0
A10: Holzzahl | C10: 4399 | D10: 3781

A1: SK Kamp-Lintfort 4 | D1: Blau-Weiß 61 Mülheim 3
A2: Dessi, Bruno | B2: 776 | C2: 7 | D2: Dziura, Torben | E2: 757 | F2: 6
A3: Günther, Bernd | B3: 808 | C3: 9 | D3: Zimmermann, Kim | E3: 749 | F3: 5
A4: Eichenhof, Nils | B4: 788 | C4: 8 | D4: Rothe, Helmut | E4: 741 | F4: 3
A5: Buchholz, Rainer | B5: 829 | C5: 12 | D5: Gietzen, Holger | E5: 704 | F5: 2
A6: Neuschl, Hans-Josef | B6: 828 | C6: 11 | D6: Bott, Helmut | E6: 741 | F6: 4
A7: Neuschl, Michael | B7: 813 | C7: 10 | D7: Dentgen, Ralf | E7: 694 | F7: 1
A8: Einzelwertungspunkte (EWP) | C8: 57 | D8: 21
A9: Punkte | C9: 3 | D9: 0
A10: Holzzahl | C10: 4842 | D10: 4386

A1: Blau-Weiß 61 Mülheim 3 | D1: BFG 1920 Wesel 2
A2: Dziura, Torben | B2: 677 | C2: 1 | D2: Uland, Hilmar | E2: 686 | F2: 3
A3: Zimmermann, Kim | B3: 778 | C3: 12 | D3: Schmellenkamp, Wolfgang | E3: 691 | F3: 4
A4: Dentgen, Andre | B4: 680 | C4: 2 | D4: Deing, Hendrik | E4: 695 | F4: 5
A5: Jacobs, Leonhard | B5: 733 | C5: 9 | D5: König, Dietmar | E5: 732 | F5: 8
A6: Gietzen, Holger | B6: 718 | C6: 7 | D6: Moschüring, Ernst | E6: 712 | F6: 6
A7: Sicking, Ewald | B7: 750 | C7: 11 | D7: Dahlmann, Carsten | E7: 736 | F7: 10
A8: Einzelwertungspunkte (EWP) | C8: 42 | D8: 36
A9: Punkte | C9: 2 | D9: 1
A10: Holzzahl | C10: 4336 | D10: 4252

A1: SK Dinslaken 3 | D1: Blau-Weiß 61 Mülheim 3
A2: Grans, Heinz-Gerd | B2: 685 | C2: 4 | D2: Dziura, Torben | E2: 678 | F2: 2
A3: Schröter, Wolfgang | B3: 788 | C3: 10 | D3: Sicking, Ewald | E3: 794 | F3: 11
A4: Jankovic, Ilija | B4: 765 | C4: 9 | D4: Zimmermann, Kim | E4: 798 | F4: 12
A5: Rienäcker, Uwe | B5: 761 | C5: 8 | D5: Rothe, Helmut | E5: 680 | F5: 3
A6: Grolmuss, Johann | B6: 760 | C6: 7 | D6: Dentgen, Andre | E6: 736 | F6: 6
A7: Otremba, Maik | B7: 717 | C7: 5 | D7: Dentgen, Ralf | E7: 661 | F7: 1
A8: Einzelwertungspunkte (EWP) | C8: 43 | D8: 35
A9: Punkte | C9: 2 | D9: 1
A10: Holzzahl | C10: 4476 | D10: 4347

A1: Datum | B1: Spieltag | C1: Nr. | D1: Uhrzeit | E1: Heim | G1: Gast | H1: Punkte | I1: ZW | J1: Holz
A2: 11.09.2011 | B2: 1 | C2: 1 | E2: BFG 1920 Wesel 2 | F2: - | G2: spielfrei
C3: 2 | D3: 10:00 | E3: SK Dinslaken 3 | F3: - | G3: BW 61 Mülheim 3 | H3: 2 : 1 | I3: 43:35 | J3: 4476:4347
C4: 3 | D4: 13:00 | E4: KSG 31 Essen 2 | F4: - | G4: SK 66/99 Solingen 2 | H4: 2 : 1 | I4: 44:34 | J4: 4540:4428
C5: 4 | D5: 10:00 | E5: SK Kamp-Lintfort 4 | F5: - | G5: KSC Harmonie Duisburg 2 | H5: 3 : 0 | I5: 53:25 | J5: 4810:4516
A6: 18.09.2011 | B6: 2 | C6: 5 | D6: 12:00 | E6: KSC Harmonie Duisburg 2 | F6: - | G6: KSG 31 Essen 2 | H6: 0 : 3 | I6: 37:41 | J6: 4168:4181
C7: 6 | E7: spielfrei | F7: - | G7: SK Kamp-Lintfort 4
C8: 7 | D8: 10:00 | E8: BW 61 Mülheim 3 | F8: - | G8: BFG 1920 Wesel 2 | H8: 2 : 1 | I8: 42:36 | J8: 4336:4252
C9: 8 | D9: 10:00 | E9: SK 66/99 Solingen 2 | F9: - | G9: SK Dinslaken 3 | H9: 2 : 1 | I9: 42:36 | J9: 4440:4142
A10: 02.10.2011 | B10: 3 | C10: 9 | D10: 13:00 | E10: KSG 31 Essen 2 | F10: - | G10: SK Kamp-Lintfort 4 | H10: 0 : 3 | I10: 33:45 | J10: 4340:4456
C11: 10 | D11: 13:00 | E11: BFG 1920 Wesel 2 | F11: - | G11: SK 66/99 Solingen 2 | H11: 3 : 0 | I11: 54:24 | J11: 4500:4150
C12: 11 | D12: 10:00 | E12: SK Dinslaken 3 | F12: - | G12: KSC Harmonie Duisburg 2 | H12: 3 : 0 | I12: 50:28 | J12: 4553:4335
C13: 12 | E13: spielfrei | F13: - | G13: BW 61 Mülheim 3
A14: 16.10.2011 | B14: 4 | C14: 13 | E14: SK 66/99 Solingen 2 | F14: - | G14: spielfrei
C15: 14 | D15: 10:00 | E15: SK Kamp-Lintfort 4 | F15: - | G15: BW 61 Mülheim 3
C16: 15 | D16: 13:00 | E16: KSG 31 Essen 2 | F16: - | G16: SK Dinslaken 3
C17: 26 | D17: 12:00 | E17: KSC Harmonie Duisburg 2 | F17: - | G17: BFG 1920 Wesel 2
A18: 23.10.2011 | B18: 5 | C18: 17 | D18: 10:00 | E18: SK Dinslaken 3 | F18: - | G18: SK Kamp-Lintfort 4
C19: 18 | E19: spielfrei | F19: - | G19: KSC Harmonie Duisburg 2
C20: 19 | D20: 10:00 | E20: BW 61 Mülheim 3 | F20: - | G20: SK 66/99 Solingen 2
C21: 20 | D21: 13:00 | E21: BFG 1920 Wesel 2 | F21: - | G21: KSG 31 Essen 2
A22: 06.11.2011 | B22: 6 | C22: 21 | D22: 12:00 | E22: KSC Harmonie Duisburg 2 | F22: - | G22: BW 61 Mülheim 3
C23: 22 | D23: 10:00 | E23: SK Dinslaken 3 | F23: - | G23: BFG 1920 Wesel 2
C24: 23 | E24: KSG 31 Essen 2 | F24: - | G24: spielfrei
C25: 24 | D25: 10:00 | E25: SK Kamp-Lintfort 4 | F25: - | G25: SK 66/99 Solingen 2
A26: 13.11.2011 | B26: 7 | C26: 25 | D26: 10:00 | E26: SK 66/99 Solingen 2 | F26: - | G26: KSC Harmonie Duisburg 2
C27: 26 | D27: 10:00 | E27: BW 61 Mülheim 3 | F27: - | G27: KSG 31 Essen 2
C28: 27 | D28: 13:00 | E28: BFG 1920 Wesel 2 | F28: - | G28: SK Kamp-Lintfort 4
C29: 28 | E29: spielfrei | F29: - | G29: SK Dinslaken 3

A1: Datum | B1: Spieltag | C1: Nr. | D1: Uhrzeit | E1: Heim | G1: Gast | H1: Punkte | I1: ZW | J1: Holz
A2: 27.11.2011 | B2: 8 | C2: 29 | E2: spielfrei | F2: - | G2: BFG 1920 Wesel 2
C3: 30 | D3: 10:00 | E3: BW 61 Mülheim 3 | F3: - | G3: SK Dinslaken 3
C4: 31 | D4: 10:00 | E4: SK 66/99 Solingen 2 | F4: - | G4: KSG 31 Essen 2
C5: 32 | D5: 12:00 | E5: KSC Harmonie Duisburg 2 | F5: - | G5: SK Kamp-Lintfort 4
A6: 11.12.2011 | B6: 9 | C6: 33 | D6: 13:00 | E6: KSG 31 Essen 2 | F6: - | G6: KSC Harmonie Duisburg 2
C7: 34 | E7: SK Kamp-Lintfort 4 | F7: - | G7: spielfrei
C8: 35 | D8: 13:00 | E8: BFG 1920 Wesel 2 | F8: - | G8: BW 61 Mülheim 3
C9: 36 | D9: 10:00 | E9: SK Dinslaken 3 | F9: - | G9: SK 66/99 Solingen 2
A10: 15.01.2012 | B10: 10 | C10: 37 | D10: 10:00 | E10: SK Kamp-Lintfort 4 | F10: - | G10: KSG 31 Essen 2
C11: 38 | D11: 13:00 | E11: SK 66/99 Solingen 2 | F11: - | G11: BFG 1920 Wesel 2
C12: 39 | D12: 12:00 | E12: KSC Harmonie Duisburg 2 | F12: - | G12: SK Dinslaken 3
C13: 40 | E13: BW 61 Mülheim 3 | F13: - | G13: spielfrei
A14: 12.02.2012 | B14: 11 | C14: 41 | E14: spielfrei | F14: - | G14: SK 66/99 Solingen 2
C15: 42 | D15: 10:00 | E15: BW 61 Mülheim 3 | F15: - | G15: SK Kamp-Lintfort 4
C16: 43 | D16: 10:00 | E16: SK Dinslaken 3 | F16: - | G16: KSG 31 Essen 2
C17: 44 | D17: 13:00 | E17: BFG 1920 Wesel 2 | F17: - | G17: KSC Harmonie Duisburg 2
A18: 26.02.2012 | B18: 12 | C18: 45 | D18: 10:00 | E18: SK Kamp-Lintfort 4 | F18: - | G18: SK Dinslaken 3
C19: 46 | E19: KSC Harmonie Duisburg 2 | F19: - | G19: spielfrei
C20: 47 | D20: 13:00 | E20: SK 66/99 Solingen 2 | F20: - | G20: BW 61 Mülheim 3
C21: 48 | D21: 13:00 | E21: KSG 31 Essen 2 | F21: - | G21: BFG 1920 Wesel 2
A22: 04.03.2012 | B22: 13 | C22: 49 | D22: 10:00 | E22: BW 61 Mülheim 3 | F22: - | G22: KSC Harmonie Duisburg 2
C23: 50 | D23: 13:00 | E23: BFG 1920 Wesel 2 | F23: - | G23: SK Dinslaken 3
C24: 51 | E24: spielfrei | F24: - | G24: KSG 31 Essen 2
C25: 52 | D25: 10:00 | E25: SK 66/99 Solingen 2 | F25: - | G25: SK Kamp-Lintfort 4
A26: 25.03.2012 | B26: 14 | C26: 53 | D26: 12:00 | E26: KSC Harmonie Duisburg 2 | F26: - | G26: SK 66/99 Solingen 2
C27: 54 | D27: 13:00 | E27: KSG 31 Essen 2 | F27: - | G27: BW 61 Mülheim 3
C28: 55 | D28: 10:00 | E28: SK Kamp-Lintfort 4 | F28: - | G28: BFG 1920 Wesel 2
C29: 56 | E29: SK Dinslaken 3 | F29: - | G29: spielfrei