A1: RW 59 Mülheim - 1. Mannschaft | B1: RW 59 Mülheim - 1. Mannschaft
A2: Saison 2011/2012 in der Niederrheinliga Mannschaftstabelle nach dem 6. Spieltag Spielerbestenliste nach dem 6. Spieltag 6 Spieltag vom 20.11.11 5 Spieltag vom 06.11.11 4 Spieltag nachgeholt am 04.11.11 3 Spieltag vom 09.10.11 2. Spieltag vom 025.09.11 spielfrei 1. Spieltag vom 11.09.11 | B2: Spielplan und Ergebnisse Bezirksliga 1 2011/2012 Alle Spielberichte gibt es wie immer unter www.w-k-v.de Hinrunde Rückrunde

A1: Platz | B1: Mannschaft | C1: Spiele | D1: Punkte | E1: Heim | F1: Ausw. | G1: +/- | H1: EWP | I1: Holz | J1: Ø Heim | K1: Ø ausw. | L1: Ø Heim | M1: Ø ausw.
A2: 1 | B2: RW 59 Mülheim | C2: 5 | D2: =E2+F2 -> 14 | E2: 8 | F2: 6 | G2: 5 | H2: 199 | I2: 23289 | J2: 4705 | K2: 4587 | L2: 784.16666666666663 | M2: 764.5
A3: 2 | B3: SKV Rees | C3: 5 | D3: =E3+F3 -> 10 | E3: 6 | F3: 4 | G3: 4 | H3: 210 | I3: 22333 | J3: 4495 | K3: 4424 | L3: 749.16666666666663 | M3: 737.33333333333337
A4: 3 | B4: SK Kleve | C4: 5 | D4: =E4+F4 -> 7 | E4: 4 | F4: 3 | G4: -2 | H4: 183 | I4: 21715 | J4: 4432 | K4: 4209.5 | L4: 738.66666666666663 | M4: 701.58333333333337
A5: 4 | B5: DSKC Heilingenhaus | C5: 4 | D5: =E5+F5 -> 3 | E5: 2 | F5: 1 | G5: -3 | H5: 139 | I5: 17318 | J5: 4236.5 | K5: 4422.5 | L5: 706.08333333333337 | M5: 737.08333333333337
A6: 5 | B6: RSV Samo Remscheid 2 | C6: 5 | D6: =E6+F6 -> 2 | E6: 0 | F6: 2 | G6: -1 | H6: 158 | I6: 19704 | J6: 4093 | K6: 3902.75 | L6: 682.16666666666663 | M6: 650.45833333333337

A1: Pl. | B1: Spieler | C1: Mannschaft | D1: S. | E1: EWP | F1: Ø | G1: Holz | H1: Ø | I1: Ø H. | J1: Ø A. | K1: Max
A2: 1 | B2: Thissen, Silke | C2: SK Kleve | D2: 5 | E2: 59 | F2: 11.8 | G2: 4206 | H2: 841.2 | I2: 845.7 | J2: 834.5 | K2: 870
A3: 2 | B3: Neumann, Lisa | C3: SKV Rees | D3: 5 | E3: 56 | F3: 11.2 | G3: 3935 | H3: 787.0 | I3: 786.0 | J3: 788.5 | K3: 821
A4: 3 | B4: Henkel, Marion | C4: RW 59 Mülheim | D4: 5 | E4: 54 | F4: 10.8 | G4: 4090 | H4: 818.0 | I4: 838.7 | J4: 787.0 | K4: 884
A5: 4 | B5: Panneck, Tanja | C5: RW 59 Mülheim | D5: 5 | E5: 50 | F5: 10.0 | G5: 3959 | H5: 791.8 | I5: 784.7 | J5: 802.5 | K5: 810
A6: 5 | B6: Wilkes, Birgit | C6: SK Kleve | D6: 5 | E6: 50 | F6: 10.0 | G6: 4006 | H6: 801.2 | I6: 820.7 | J6: 772.0 | K6: 851
A7: 6 | B7: Ziemke, Carmen | C7: RSV Samo Remscheid 2 | D7: 5 | E7: 46 | F7: 9.2 | G7: 3793 | H7: 758.6 | I7: 758.0 | J7: 758.8 | K7: 775
A8: 7 | B8: Schröter, Birgit | C8: RW 59 Mülheim | D8: 5 | E8: 44 | F8: 8.8 | G8: 3936 | H8: 787.2 | I8: 809.3 | J8: 754.0 | K8: 832
A9: 8 | B9: Unterberg, Jasmin | C9: DSKC Heiligenhaus | D9: 4 | E9: 39 | F9: 9.8 | G9: 3067 | H9: 766.8 | I9: 768.5 | J9: 765.0 | K9: 786
A10: 9 | B10: Brunner, Beate | C10: SKV Rees | D10: 4 | E10: 37 | F10: 9.3 | G10: 3106 | H10: 776.5 | I10: 787.0 | J10: 745.0 | K10: 803
A11: 10 | B11: Henkel, Isabel | C11: RW 59 Mülheim | D11: 5 | E11: 37 | F11: 7.4 | G11: 3824 | H11: 764.8 | I11: 777.3 | J11: 746.0 | K11: 789
A12: 11 | B12: Ziemke, Sabine | C12: RSV Samo Remscheid 2 | D12: 5 | E12: 37 | F12: 7.4 | G12: 3631 | H12: 726.2 | I12: 734.0 | J12: 724.3 | K12: 774
A13: 12 | B13: Czeke, Gundel | C13: SKV Rees | D13: 5 | E13: 36 | F13: 7.2 | G13: 3759 | H13: 751.8 | I13: 741.7 | J13: 767.0 | K13: 797
A14: 13 | B14: Dziura, Simona | C14: RW 59 Mülheim | D14: 5 | E14: 33 | F14: 6.6 | G14: 3788 | H14: 757.6 | I14: 761.3 | J14: 752.0 | K14: 772
A15: 14 | B15: Ziemke, Sarah | C15: RSV Samo Remscheid 2 | D15: 5 | E15: 31 | F15: 6.2 | G15: 3441 | H15: 688.2 | I15: 692.0 | J15: 687.3 | K15: 750
A16: 15 | B16: Henkel, Ivonne | C16: RW 59 Mülheim | D16: 5 | E16: 28 | F16: 5.6 | G16: 3692 | H16: 738.4 | I16: 733.7 | J16: 745.5 | K16: 772
A17: 16 | B17: Markett, Gabriele | C17: SKV Rees | D17: 5 | E17: 26 | F17: 5.2 | G17: 3637 | H17: 727.4 | I17: 733.0 | J17: 719.0 | K17: 743
A18: 17 | B18: Görtz, Stephanie | C18: SK Kleve | D18: 5 | E18: 25 | F18: 5.0 | G18: 3593 | H18: 718.6 | I18: 737.3 | J18: 690.5 | K18: 751
A19: 18 | B19: Spannekrebs, Petra | C19: SKV Rees | D19: 5 | E19: 24 | F19: 4.8 | G19: 3554 | H19: 710.8 | I19: 715.0 | J19: 704.5 | K19: 745
A20: 19 | B20: Schmitt, Gabi | C20: SK Kleve | D20: 5 | E20: 23 | F20: 4.6 | G20: 3500 | H20: 700.0 | I20: 721.3 | J20: 668.0 | K20: 746
A21: 20 | B21: Nölle, Sandra | C21: DSKC Heiligenhaus | D21: 4 | E21: 22 | F21: 5.5 | G21: 2862 | H21: 715.5 | I21: 703.0 | J21: 728.0 | K21: 728
A22: 21 | B22: Tönnissen, Melanie | C22: SKV Rees | D22: 4 | E22: 22 | F22: 5.5 | G22: 2900 | H22: 725.0 | I22: 732.3 | J22: 703.0 | K22: 743
A23: 22 | B23: Nölle, Domenique | C23: DSKC Heiligenhaus | D23: 2 | E23: 21 | F23: 10.5 | G23: 1527 | H23: 763.5 | I23: 759.0 | J23: 768.0 | K23: 768
A24: 23 | B24: Reintjes, Ingeborg | C24: SK Kleve | D24: 5 | E24: 19 | F24: 3.8 | G24: 3349 | H24: 669.8 | I24: 675.7 | J24: 661.0 | K24: 720
A25: 24 | B25: Sowinski, Fabienne | C25: RSV Samo Remscheid 2 | D25: 5 | E25: 17 | F25: 3.4 | G25: 3328 | H25: 665.6 | I25: 665.0 | J25: 665.8 | K25: 703
A26: 25 | B26: Benedens, Dana | C26: DSKC Heiligenhaus | D26: 4 | E26: 16 | F26: 4.0 | G26: 2841 | H26: 710.3 | I26: 682.5 | J26: 738.0 | K26: 756
A27: 26 | B27: Haagmann, Gabriele | C27: DSKC Heiligenhaus | D27: 4 | E27: 16 | F27: 4.0 | G27: 2809 | H27: 702.3 | I27: 685.5 | J27: 719.0 | K27: 734
A28: 27 | B28: Haagmann, Sonja | C28: DSKC Heiligenhaus | D28: 4 | E28: 15 | F28: 3.8 | G28: 2797 | H28: 699.3 | I28: 674.0 | J28: 724.5 | K28: 767
A29: 28 | B29: Schnepf, Kathrin | C29: RSV Samo Remscheid 2 | D29: 1 | E29: 10 | F29: 10.0 | G29: 755 | H29: 755.0 | J29: 755.0 | K29: 755
A30: 29 | B30: Richter, Jennifer | C30: DSKC Heiligenhaus | D30: 2 | E30: 10 | F30: 5.0 | G30: 1415 | H30: 707.5 | I30: 687.0 | J30: 728.0 | K30: 728
A31: 30 | B31: Kaldenhoven, Christel | C31: SKV Rees | D31: 2 | E31: 9 | F31: 4.5 | G31: 1442 | H31: 721.0 | J31: 721.0 | K31: 723
A32: 31 | B32: Waldorf, Daniela | C32: SK Kleve | D32: 5 | E32: 7 | F32: 1.4 | G32: 3061 | H32: 612.2 | I32: 631.3 | J32: 583.5 | K32: 653
A33: 32 | B33: Schorn, Nicole | C33: RSV Samo Remscheid 2 | D33: 3 | E33: 6 | F33: 2.0 | G33: 1593 | H33: 531.0 | J33: 531.0 | K33: 630
A34: 33 | B34: Rudolph, Stefanie | C34: RSV Samo Remscheid 2 | D34: 2 | E34: 4 | F34: 2.0 | G34: 1235 | H34: 617.5 | I34: 664.0 | J34: 571.0 | K34: 664
A35: 34 | B35: Hansen, Alexandra | C35: RSV Samo Remscheid 2 | D35: 3 | E35: 4 | F35: 1.3 | G35: 1232 | H35: 410.7 | I35: 580.0 | J35: 326.0 | K35: 620
A36: 35 | B36: Stadler, Kerstin | C36: RSV Samo Remscheid 2 | D36: 1 | E36: 3 | F36: 3.0 | G36: 696 | H36: 696.0 | J36: 696.0 | K36: 696

A1: SKV Rees | D1: RW 59 Mülheim 1
A2: Markett, Gabriele | B2: 743 | C2: 4 | D2: Dziura, Simona | E2: 747 | F2: 6
A3: Czeke, Gundel | B3: 733 | C3: 3 | D3: Henkel, Isabel | E3: 752 | F3: 7
A4: Tönnissen, Melanie | B4: 718 | C4: 2 | D4: Henkel, Ivonne | E4: 758 | F4: 8
A5: Spannekrebs, Petra | B5: 688 | C5: 1 | D5: Henkel, Marion | E5: 780 | F5: 10
A6: Neumann, Lisa | B6: 812 | C6: 12 | D6: Panneck, Tanja | E6: 795 | F6: 11
A7: Brunner, Beate | B7: 767 | C7: 9 | D7: Schröter, Birgit | E7: 745 | F7: 5
A8: Einzelwertungspunkte (EWP) | C8: =SUM(C2:C7) -> 31 | D8: =SUM(F2:F7) -> 47
A9: Punkte | C9: 0 | D9: 3
A10: Holzzahl | C10: =SUM(B2:B7) -> 4461 | D10: =SUM(E2:E7) -> 4577

A1: Sk Kleve | D1: RW 59 Mülheim 1
A2: Wilkes, Birgit | B2: 789 | C2: 9 | D2: Dziura, Simona | E2: 757 | F2: 7
A3: Schmitt, Gabi | B3: 746 | C3: 6 | D3: Henkel, Isabel | E3: 740 | F3: 5
A4: Waldorf, Daniela | B4: 634 | C4: 2 | D4: Henkel, Ivonne | E4: 733 | F4: 4
A5: Reintjes, Ingeborg | B5: 605 | C5: 1 | D5: Henkel, Marion | E5: 794 | F5: 10
A6: Görtz, Stephanie | B6: 724 | C6: 3 | D6: Panneck, Tanja | E6: 810 | F6: 11
A7: Thissen, Silke | B7: 832 | C7: 12 | D7: Schröter, Birgit | E7: 763 | F7: 8
A8: Einzelwertungspunkte (EWP) | C8: =SUM(C2:C7) ->  | D8: =SUM(F2:F7) -> 45
A9: Punkte | D9: 3
A10: Holzzahl | C10: =SUM(B2:B7) ->  | D10: =SUM(E2:E7) -> 4597

A1: RW 59 Mülheim 1 | D1: SK Kleve
A2: Dziura, Simona | B2: 762 | C2: 8 | D2: Benedens, Dana | E2: 720 | F2: 3
A3: Henkel, Isabel | B3: 771 | C3: 9 | D3: Haagmann, Gabriele | E3: 704 | F3: 2
A4: Henkel, Ivonne | B4: 731 | C4: 6 | D4: Haagmann, Sonja | E4: 682 | F4: 1
A5: Henkel, Marion | B5: 884 | C5: 12 | D5: Nölle, Sandra | E5: 728 | F5: 5
A6: Panneck, Tanja | B6: 786 | C6: 10 | D6: Unterberg, Jasmin | E6: 750 | F6: 7
A7: Schröter, Birgit | B7: 804 | C7: 11 | D7: Richter, Jennifer | E7: 728 | F7: 4
A8: Einzelwertungspunkte (EWP) | C8: =SUM(C2:C7) -> 56 | D8: =SUM(F2:F7) -> 22
A9: Punkte | C9: 3 | D9: 0
A10: Holzzahl | C10: =SUM(B2:B7) -> 4738 | D10: =SUM(E2:E7) -> 4312

A1: RW 59 Mülheim 1 | D1: SKV Rees
A2: Dziura, Simona | B2: 750 | C2: 6 | D2: Ziemke, Carmen | E2: 753 | F2: 7
A3: Henkel, Isabel | B3: 772 | C3: 9 | D3: Ziemke, Sarah | E3: 662 | F3: 4
A4: Henkel, Ivonne | B4: 698 | C4: 5 | D4: Ziemke, Sabine | E4: 774 | F4: 10
A5: Henkel, Marion | B5: 816 | C5: 11 | D5: Sowinski, Fabienne | E5: 637 | F5: 3
A6: Panneck, Tanja | B6: 764 | C6: 8 | D6: Hansen, Alexandra | E6: 32 | F6: 1
A7: Schröter, Birgit | B7: 832 | C7: 12 | D7: Schorn, Nicole | E7: 347 | F7: 2
A8: Einzelwertungspunkte (EWP) | C8: =SUM(C2:C7) -> 51 | D8: =SUM(F2:F7) -> 27
A9: Punkte | C9: 3 | D9: 0
A10: Holzzahl | C10: =SUM(B2:B7) -> 4632 | D10: =SUM(E2:E7) -> 3205

A1: RW 59 Mülheim 1 | D1: SKV Rees
A2: Dziura, Simona | B2: 772 | C2: 6 | D2: Czeke, Gundel | E2: 797 | F2: 9
A3: Henkel, Isabel | B3: 789 | C3: 7 | D3: Spannekrebs, Petra | E3: 664 | F3: 1
A4: Henkel, Ivonne | B4: 772 | C4: 5 | D4: Markett, Gabriele | E4: 733 | F4: 3
A5: Henkel, Marion | B5: 816 | C5: 11 | D5: Brunner, Beate | E5: 745 | F5: 4
A6: Panneck, Tanja | B6: 804 | C6: 10 | D6: Neumann, Lisa | E6: 821 | F6: 12
A7: Schröter, Birgit | B7: 792 | C7: 8 | D7: Kaldenhoven, Christel | E7: 723 | F7: 2
A8: Einzelwertungspunkte (EWP) | C8: 47 | D8: 31
A9: Punkte | C9: 2 | D9: 1
A10: Holzzahl | C10: 4745 | D10: 4483

A1: Datum | B1: Spieltag | C1: Nr. | D1: Uhrzeit | E1: Gastgeber | G1: Gast | H1: Punkte | I1: ZW | J1: Holz
A2: 11.09.2011 | B2: 1 | C2: 1 | D2: 09:00 | E2: RSV Samo Remscheid 2 | F2: - | G2: SK Kleve | H2: 0 : 3 | I2: 34:44 | J2: 4093 : 4324
C3: 2 | D3: 13:00 | E3: DSKC Heiligenhaus | F3: - | G3: DSK Neuss | H3: 3 : 0 | I3: 52:26 | J3: 4304 : 3259
C4: 3 | D4: 13:00 | E4: RW 59 Mülheim | F4: - | G4: SKV Rees | H4: 2 : 1 | I4: 47:31 | J4: 4745 : 4483
A5: 25.09.2011 | B5: 2 | C5: 4 | D5: 10:00 | E5: DSK Neuss zurückgezogen | F5: - | G5: RW 59 Mülheim
C6: 5 | D6: 10:00 | E6: SKV Rees | F6: - | G6: RSV Samo Remscheid 2 | H6: 3 : 0 | I6: 55 : 23 | J6: 4473 : 4533
C7: 6 | D7: 10:00 | E7: SK Kleve | F7: - | G7: DSKC Heiligenhaus | H7: 2 : 1 | I7: 35 : 43 | J7: 4558 : 4533
A8: 09.10.2011 | B8: 3 | C8: 7 | D8: 10:00 | E8: DSKC Heiligenhaus | F8: - | G8: SKV Rees | H8: 0 : 3 | I8: 34 : 44 | J8: 4266 : 4365
C9: 8 | D9: 10:00 | E9: SK Kleve | F9: - | G9: spielfrei
C10: 9 | D10: 10:00 | E10: RW 59 Mülheim | F10: - | G10: RSV Samo Remscheid 2 | H10: 3 : 0 | I10: 51 : 27 | J10: 4632 : 3205
A11: 23.10.2011 | B11: 4 | C11: 10 | D11: 12:00 | E11: RSV Samo Remscheid 2 | F11: - | G11: spielfrei
C12: 11 | D12: 10:00 | E12: RW 59 Mülheim | F12: - | G12: DSKC Heiligenhaus | H12: 3 : 0 | I12: 56 : 22 | J12: 4738 : 4312
C13: 12 | D13: 10:00 | E13: SKV Rees | F13: - | G13: SK Kleve | H13: 3 : 0 | I13: 49 : 29 | J13: 4551 : 4095
A14: 06.11.2011 | B14: 5 | C14: 13 | D14: 10:00 | E14: SK Kleve | F14: - | G14: RW 59 Mülheim | H14: 0 : 3 | I14: 33 : 45 | J14: 4330 : 4597
C15: 14 | D15: 10:00 | E15: spielfrei | F15: - | G15: SKV Rees
C16: 15 | D16: 13:00 | E16: DSKC Heiligenhaus | F16: - | G16: RSV Samo Remscheid 2 | H16: 2 : 1 | I16: 40 : 38 | J16: 4207 : 4202

A1: Datum | B1: Spieltag | C1: Nr. | D1: Uhrzeit | E1: Gastgeber | G1: Gast | H1: Punkte | I1: ZW | J1: Holz
A2: 20.11.2011 | B2: 1 | C2: 1 | D2: 10:00 | E2: SK Kleve | F2: - | G2: RSV Samo Remscheid 2
C3: 2 | D3: 10:00 | E3: spielfrei | F3: - | G3: DSKC Heiligenhaus
C4: 3 | D4: 10:00 | E4: SKV Rees | F4: - | G4: RW 59 Mülheim
A5: 04.12.2011 | B5: 2 | C5: 4 | D5: 10:00 | E5: RW 59 Mülheim | F5: - | G5: spielfrei
C6: 5 | D6: 10:00 | E6: RSV Samo Remscheid 2 | F6: - | G6: SKV Rees
C7: 6 | D7: 10:00 | E7: DSKC Heiligenhaus | F7: - | G7: SK Kleve
A8: 15.01.2012 | B8: 3 | C8: 7 | D8: 13:00 | E8: SKV Rees | F8: - | G8: DSKC Heiligenhaus
C9: 8 | D9: 12:00 | E9: spielfrei | F9: - | G9: SK Kleve
C10: 9 | D10: 12:00 | E10: RSV Samo Remscheid 2 | F10: - | G10: RW 59 Mülheim
A11: 12.02.2012 | B11: 4 | C11: 10 | D11: 13:00 | E11: spielfrei | F11: - | G11: RSV Samo Remscheid 2
C12: 11 | D12: 13:00 | E12: DSKC Heiligenhaus | F12: - | G12: RW 59 Mülheim
C13: 12 | D13: 10:00 | E13: SK Kleve | F13: - | G13: SKV Rees
A14: 04.03.2012 | B14: 5 | C14: 13 | D14: 10:00 | E14: RW 59 Mülheim | F14: - | G14: SK Kleve
C15: 14 | D15: 10:00 | E15: SKV Rees | F15: - | G15: spielfrei
C16: 15 | D16: 12:00 | E16: RSV Samo Remscheid 2 | F16: - | G16: DSKC Heiligenhaus