A1: BW 61 Mülheim - 2. Mannschaft
A2: Saison 2011/2012 in der Bezirksliga 1 Tabelle vom 7. Spieltag Bestenliste vom 7. Spieltag 7. Ligenspieltag ( 23.10.11 ) 6. Ligenspieltag ( 23.10.11 ) 5. Ligenspieltag ( 23.10.11 ) 4. Ligenspieltag ( 16.10.11 ) 10:00 Uhr 3. Ligenspieltag (02.10.11) 2. Ligenspieltag (18.09.11) 1. Ligenspieltag (11.09.11) | B2: Spielplan und Ergebnisse Bezirksliga 1 2011/2012 Alle Spielberichte gibt es wie immer unter www.w-k-v.de Hinrunde Rückrunde

A1: Platz | B1: Mannschaft | C1: Spiele | D1: Punkte | E1: Heim | F1: Ausw. | G1: +/- | H1: EWP | I1: Holz | J1: Ø Heim | K1: Ø ausw. | L1: Ø Heim | M1: Ø ausw.
A2: 1 | B2: SK Heilingenhaus 3 | C2: 7 | D2: =E2+F2 -> 15 | E2: 11 | F2: 4 | G2: 3 | H2: 303 | I2: 32112 | J2: 4678 | K2: 4466.666666666667 | L2: 779.66666666666663 | M2: 744.44444444444446
A3: 2 | B3: BW 61 Mülheim 2 | C3: 7 | D3: =E3+F3 -> 15 | E3: 9 | F3: 6 | G3: 3 | H3: 299 | I3: 33053 | J3: 4824.25 | K3: 4585.333333333333 | L3: 804.04166666666663 | M3: 764.22222222222217
A4: 3 | B4: SK Kamp-Lintfort 3 | C4: 7 | D4: =E4+F4 -> 13 | E4: 11 | F4: 2 | G4: 1 | H4: 303 | I4: 33613 | J4: 5052.25 | K4: 4468 | L4: 842.04166666666663 | M4: 744.66666666666663
A5: 4 | B5: KSC Harmonie Duisburg | C5: 7 | D5: =E5+F5 -> 10 | E5: 6 | F5: 4 | G5: 1 | H5: 284 | I5: 32290 | J5: 4635.666666666667 | K5: 4595.75 | L5: 772.6111111111112 | M5: 765.95833333333337
A6: 5 | B6: SK Dinslaken 2 | C6: 7 | D6: =E6+F6 -> 10 | E6: 9 | F6: 1 | G6: -2 | H6: 272 | I6: 31799 | J6: 4671 | K6: 4371.666666666667 | L6: 778.5 | M6: 728.6111111111112
A7: 6 | B7: SKC Kapellen | C7: 6 | D7: =E7+F7 -> 7 | E7: 5 | F7: 2 | G7: -2 | H7: 220 | I7: 25407 | J7: 4190.333333333333 | K7: 4278.666666666667 | L7: 698.3888888888888 | M7: 713.1111111111112
A8: 7 | B8: SK Düsseldorf 3 | C8: 6 | D8: =E8+F8 -> 7 | E8: 4 | F8: 3 | G8: 1 | H8: 213 | I8: 27718 | J8: 4807.5 | K8: 4525.75 | L8: 801.25 | M8: 754.29166666666663
A9: 8 | B9: SK 54/50 Essen-Borbeck | C9: 7 | D9: =E9+F9 -> 4 | E9: 2 | F9: 2 | G9: -5 | H9: 213 | I9: 31393 | J9: 4455.666666666667 | K9: 4506.5 | L9: 742.6111111111112 | M9: 751.08333333333337

A1: Pl. | B1: Spieler | C1: Mannschaft | D1: S. | E1: EWP | F1: Ø | G1: Holz | H1: Ø | I1: Ø H. | J1: Ø A. | K1: Max
A2: 1 | B2: Ries, Bernd | C2: BW 61 Mülheim 2 | D2: 7 | E2: 77 | F2: 11.0 | G2: 5890 | H2: 841.4 | I2: 851.0 | J2: 828.7 | K2: 883
A3: 2 | B3: Dahlhaus, Ralf | C3: KSC Harmonie Duisburg 1 | D3: 7 | E3: 70 | F3: 10.0 | G3: 5612 | H3: 801.7 | I3: 796.7 | J3: 805.5 | K3: 859
A4: 3 | B4: Küppers, Frank | C4: SKC Kapellen 1 | D4: 6 | E4: 66 | F4: 11.0 | G4: 4664 | H4: 777.3 | I4: 743.3 | J4: 811.3 | K4: 838
A5: 4 | B5: Bosch, Andreas | C5: SK Kamp-Lintfort 3 | D5: 7 | E5: 61 | F5: 8.7 | G5: 5697 | H5: 813.9 | I5: 855.5 | J5: 758.3 | K5: 877
A6: 5 | B6: Reeb, Wilfried | C6: SK Kamp-Lintfort 3 | D6: 7 | E6: 60 | F6: 8.6 | G6: 5713 | H6: 816.1 | I6: 857.0 | J6: 761.7 | K6: 886
A7: 6 | B7: Klasen, Thomas | C7: BW 61 Mülheim 2 | D7: 5 | E7: 58 | F7: 11.6 | G7: 4256 | H7: 851.2 | I7: 866.0 | J7: 829.0 | K7: 880
A8: 7 | B8: Tepper, Carsten | C8: KSC Harmonie Duisburg 1 | D8: 7 | E8: 56 | F8: 8.0 | G8: 5490 | H8: 784.3 | I8: 806.7 | J8: 767.5 | K8: 818
A9: 8 | B9: Zillikens, Rolf | C9: SKC Kapellen 1 | D9: 6 | E9: 55 | F9: 9.2 | G9: 4508 | H9: 751.3 | I9: 729.0 | J9: 773.7 | K9: 792
A10: 9 | B10: Votel, Lars | C10: SK Kamp-Lintfort 3 | D10: 6 | E10: 52 | F10: 8.7 | G10: 4905 | H10: 817.5 | I10: 853.3 | J10: 746.0 | K10: 871
A11: 10 | B11: Schulz, Bernd | C11: KSC Harmonie Duisburg 1 | D11: 7 | E11: 47 | F11: 6.7 | G11: 5406 | H11: 772.3 | I11: 772.3 | J11: 772.3 | K11: 837
A12: 11 | B12: Jaschke, Roland | C12: KSC Harmonie Duisburg 1 | D12: 7 | E12: 47 | F12: 6.7 | G12: 5372 | H12: 767.4 | I12: 767.3 | J12: 767.5 | K12: 821
A13: 12 | B13: Benedens, Tim | C13: SK Heiligenhaus 3 | D13: 7 | E13: 46 | F13: 6.6 | G13: 5272 | H13: 753.1 | I13: 755.3 | J13: 750.3 | K13: 781
A14: 13 | B14: Dudler, Bernhard | C14: SK Dinslaken 2 | D14: 5 | E14: 45 | F14: 9.0 | G14: 3920 | H14: 784.0 | I14: 794.5 | J14: 777.0 | K14: 834
A15: 14 | B15: Blaschke, Roland | C15: SK 54/59 Essen-Borbeck 1 | D15: 7 | E15: 44 | F15: 6.3 | G15: 5358 | H15: 765.4 | I15: 758.3 | J15: 770.8 | K15: 791
A16: 15 | B16: Strack, Hans-Peter | C16: BW 61 Mülheim 2 | D16: 7 | E16: 43 | F16: 6.1 | G16: 5486 | H16: 783.7 | I16: 804.0 | J16: 756.7 | K16: 840
A17: 16 | B17: Werbonat, Pascal | C17: SK Dinslaken 2 | D17: 7 | E17: 43 | F17: 6.1 | G17: 5326 | H17: 760.9 | I17: 770.3 | J17: 748.3 | K17: 799
A18: 17 | B18: Vogt, Harald | C18: SK Dinslaken 2 | D18: 6 | E18: 42 | F18: 7.0 | G18: 4683 | H18: 780.5 | I18: 805.0 | J18: 756.0 | K18: 869
A19: 18 | B19: Peters, Tim | C19: SK Kamp-Lintfort 3 | D19: 4 | E19: 41 | F19: 10.3 | G19: 3453 | H19: 863.3 | I19: 887.0 | J19: 792.0 | K19: 901
A20: 19 | B20: Schröter, Stefan | C20: SK Dinslaken 2 | D20: 5 | E20: 41 | F20: 8.2 | G20: 4061 | H20: 812.2 | I20: 787.3 | J20: 849.5 | K20: 868
A21: 20 | B21: Dorrenbach, Dietmar | C21: KSC Harmonie Duisburg 1 | D21: 7 | E21: 41 | F21: 5.9 | G21: 5349 | H21: 764.1 | I21: 766.3 | J21: 762.5 | K21: 812
A22: 21 | B22: Haagmann, Sven | C22: SK Heiligenhaus 3 | D22: 4 | E22: 40 | F22: 10.0 | G22: 3163 | H22: 790.8 | I22: 793.5 | J22: 788.0 | K22: 798
A23: 22 | B23: Elsner, Christian | C23: SK 54/59 Essen-Borbeck 1 | D23: 6 | E23: 38 | F23: 6.3 | G23: 4593 | H23: 765.5 | I23: 772.5 | J23: 762.0 | K23: 800
A24: 23 | B24: Schumann, Uwe | C24: SK Kamp-Lintfort 3 | D24: 6 | E24: 38 | F24: 6.3 | G24: 4753 | H24: 792.2 | I24: 825.0 | J24: 759.3 | K24: 864
A25: 24 | B25: Kubb, Benjamin | C25: SK Düsseldorf 3 | D25: 5 | E25: 37 | F25: 7.4 | G25: 3937 | H25: 787.4 | I25: 811.0 | J25: 781.5 | K25: 853
A26: 25 | B26: Panneck, Roland | C26: SK Düsseldorf 3 | D26: 5 | E26: 37 | F26: 7.4 | G26: 3935 | H26: 787.0 | I26: 840.5 | J26: 751.3 | K26: 842
A27: 26 | B27: Maslo, Michael | C27: SK 54/59 Essen-Borbeck 1 | D27: 7 | E27: 35 | F27: 5.0 | G27: 5254 | H27: 750.6 | I27: 744.0 | J27: 755.5 | K27: 817
A28: 27 | B28: Jankovic, Ilija | C28: SK Dinslaken 2 | D28: 6 | E28: 34 | F28: 5.7 | G28: 4573 | H28: 762.2 | I28: 786.7 | J28: 737.7 | K28: 809
A29: 28 | B29: Benner, Ralf | C29: SK 54/59 Essen-Borbeck 1 | D29: 7 | E29: 34 | F29: 4.9 | G29: 5213 | H29: 744.7 | I29: 762.0 | J29: 731.8 | K29: 783
A30: 29 | B30: Schubert, Harry | C30: SK Kamp-Lintfort 3 | D30: 7 | E30: 33 | F30: 4.7 | G30: 5413 | H30: 773.3 | I30: 816.0 | J30: 716.3 | K30: 848
A31: 30 | B31: van Bellen, Frank | C31: SK Heiligenhaus 3 | D31: 5 | E31: 32 | F31: 6.4 | G31: 3772 | H31: 754.4 | I31: 790.0 | J31: 730.7 | K31: 813
A32: 31 | B32: Blum, Stefan | C32: BW 61 Mülheim 2 | D32: 6 | E32: 30 | F32: 5.0 | G32: 4588 | H32: 764.7 | I32: 760.5 | J32: 773.0 | K32: 780
A33: 32 | B33: Panneck, Marcel | C33: BW 61 Mülheim 2 | D33: 7 | E33: 30 | F33: 4.3 | G33: 5229 | H33: 747.0 | I33: 755.3 | J33: 736.0 | K33: 784
A34: 33 | B34: Meriste, Sebastian | C34: SK Heiligenhaus 3 | D34: 3 | E34: 29 | F34: 9.7 | G34: 2385 | H34: 795.0 | I34: 795.0 | K34: 821
A35: 34 | B35: Urban, Dirk | C35: SKC Kapellen 1 | D35: 6 | E35: 29 | F35: 4.8 | G35: 3882 | H35: 647.0 | I35: 679.7 | J35: 614.3 | K35: 784
A36: 35 | B36: Flegel, Michael | C36: SK 54/59 Essen-Borbeck 1 | D36: 7 | E36: 29 | F36: 4.1 | G36: 5171 | H36: 738.7 | I36: 723.7 | J36: 750.0 | K36: 802
A37: 36 | B37: Radtke, Oliver | C37: SKC Kapellen 1 | D37: 6 | E37: 27 | F37: 4.5 | G37: 4067 | H37: 677.8 | I37: 689.0 | J37: 666.7 | K37: 706
A38: 37 | B38: Kemper, Sven | C38: SK Heiligenhaus 3 | D38: 3 | E38: 26 | F38: 8.7 | G38: 2337 | H38: 779.0 | J38: 779.0 | K38: 811
A39: 38 | B39: Patten, Siegfried | C39: SK Düsseldorf 3 | D39: 4 | E39: 25 | F39: 6.3 | G39: 3100 | H39: 775.0 | I39: 795.0 | J39: 768.3 | K39: 795
A40: 39 | B40: Romanidis, Christos | C40: SK Heiligenhaus 3 | D40: 2 | E40: 24 | F40: 12.0 | G40: 1667 | H40: 833.5 | I40: 833.5 | K40: 847
A41: 40 | B41: Mehler, Felix | C41: SK Heiligenhaus 3 | D41: 3 | E41: 23 | F41: 7.7 | G41: 2315 | H41: 771.7 | I41: 796.0 | J41: 723.0 | K41: 797
A42: 41 | B42: Arians, Lothar | C42: SK Düsseldorf 3 | D42: 6 | E42: 23 | F42: 3.8 | G42: 4490 | H42: 748.3 | I42: 762.5 | J42: 741.3 | K42: 788
A43: 42 | B43: Bruckschen, Hans-Bernd | C43: SKC Kapellen 1 | D43: 6 | E43: 23 | F43: 3.8 | G43: 4179 | H43: 696.5 | I43: 681.0 | J43: 712.0 | K43: 735
A44: 43 | B44: Ciemniak, Heinz | C44: SK Dinslaken 2 | D44: 4 | E44: 21 | F44: 5.3 | G44: 2905 | H44: 726.3 | I44: 786.0 | J44: 666.5 | K44: 799
A45: 44 | B45: Fedkenhauer, Christoph | C45: SK Heiligenhaus 3 | D45: 5 | E45: 21 | F45: 4.2 | G45: 3644 | H45: 728.8 | I45: 769.5 | J45: 701.7 | K45: 793
A46: 45 | B46: Fries, Dieter | C46: SK Düsseldorf 3 | D46: 5 | E46: 20 | F46: 4.0 | G46: 3709 | H46: 741.8 | I46: 808.0 | J46: 725.3 | K46: 808
A47: 46 | B47: Kriegel, Jörg | C47: SK 54/59 Essen-Borbeck 1 | D47: 6 | E47: 20 | F47: 3.3 | G47: 4287 | H47: 714.5 | I47: 703.7 | J47: 725.3 | K47: 757
A48: 47 | B48: Komoß, Lothar | C48: SK Düsseldorf 3 | D48: 2 | E48: 19 | F48: 9.5 | G48: 1688 | H48: 844.0 | I48: 833.0 | J48: 855.0 | K48: 855
A49: 48 | B49: Springer, Patrick | C49: BW 61 Mülheim 2 | D49: 2 | E49: 19 | F49: 9.5 | G49: 1629 | H49: 814.5 | I49: 802.0 | J49: 827.0 | K49: 827
A50: 49 | B50: Pock, Manfred | C50: SK Heiligenhaus 3 | D50: 2 | E50: 17 | F50: 8.5 | G50: 1585 | H50: 792.5 | I50: 815.0 | J50: 770.0 | K50: 815
A51: 50 | B51: Schröter, Wolfgang | C51: SK Dinslaken 2 | D51: 2 | E51: 16 | F51: 8.0 | G51: 1549 | H51: 774.5 | I51: 774.5 | K51: 796
A52: 51 | B52: Niedrich, Harald | C52: SK Heiligenhaus 3 | D52: 3 | E52: 16 | F52: 5.3 | G52: 2211 | H52: 737.0 | I52: 765.0 | J52: 723.0 | K52: 768
A53: 52 | B53: Neumann, Frank | C53: KSC Harmonie Duisburg 1 | D53: 4 | E53: 15 | F53: 3.8 | G53: 2882 | H53: 720.5 | I53: 726.3 | J53: 703.0 | K53: 749
A54: 53 | B54: Fusek, Bernd | C54: SK Kamp-Lintfort 3 | D54: 4 | E54: 15 | F54: 3.8 | G54: 2933 | H54: 733.3 | I54: 773.0 | J54: 693.5 | K54: 790
A55: 54 | B55: Ebert, Heinz-Willi | C55: SK 54/59 Essen-Borbeck 1 | D55: 2 | E55: 13 | F55: 6.5 | G55: 1517 | H55: 758.5 | I55: 747.0 | J55: 770.0 | K55: 770
A56: 55 | B56: Kamprad, Thomas | C56: SK Düsseldorf 3 | D56: 1 | E56: 12 | F56: 12.0 | G56: 883 | H56: 883.0 | I56: 883.0 | K56: 883
A57: 56 | B57: Hennings, Jann | C57: BW 61 Mülheim 2 | D57: 1 | E57: 12 | F57: 12.0 | G57: 844 | H57: 844.0 | I57: 844.0 | K57: 844
A58: 57 | B58: Schiffner, Marvin | C58: SK Dinslaken 2 | D58: 1 | E58: 12 | F58: 12.0 | G58: 811 | H58: 811.0 | I58: 811.0 | K58: 811
A59: 58 | B59: Kamps, Manfred | C59: SK Düsseldorf 3 | D59: 2 | E59: 11 | F59: 5.5 | G59: 1496 | H59: 748.0 | J59: 748.0 | K59: 777
A60: 59 | B60: Holler, Kevin | C60: SK Heiligenhaus 3 | D60: 2 | E60: 11 | F60: 5.5 | G60: 1502 | H60: 751.0 | I60: 751.0 | K60: 755
A61: 60 | B61: Warzanski, Michael | C61: SK Dinslaken 2 | D61: 3 | E61: 11 | F61: 3.7 | G61: 1796 | H61: 598.7 | I61: 770.0 | J61: 513.0 | K61: 770
A62: 61 | B62: Nowak, Alexander | C62: SK Düsseldorf 3 | D62: 1 | E62: 10 | F62: 10.0 | G62: 837 | H62: 837.0 | I62: 837.0 | K62: 837
A63: 62 | B63: Gietmann, Udo | C63: BW 61 Mülheim 2 | D63: 1 | E63: 10 | F63: 10.0 | G63: 832 | H63: 832.0 | I63: 832.0 | K63: 832
A64: 63 | B64: Zismann, Ralf | C64: SK Heiligenhaus 3 | D64: 1 | E64: 10 | F64: 10.0 | G64: 787 | H64: 787.0 | I64: 787.0 | K64: 787
A65: 64 | B65: Kremer, Christoph | C65: SK Düsseldorf 3 | D65: 1 | E65: 9 | F65: 9.0 | G65: 804 | H65: 804.0 | J65: 804.0 | K65: 804
A66: 65 | B66: Schmitz, Jörg | C66: SKC Kapellen 1 | D66: 1 | E66: 7 | F66: 7.0 | G66: 696 | H66: 696.0 | I66: 696.0 | K66: 696
A67: 66 | B67: Martini, Dirk | C67: KSC Harmonie Duisburg 1 | D67: 2 | E67: 7 | F67: 3.5 | G67: 1433 | H67: 716.5 | J67: 716.5 | K67: 746
A68: 67 | B68: Zimmermann, Kim | C68: BW 61 Mülheim 2 | D68: 1 | E68: 6 | F68: 6.0 | G68: 779 | H68: 779.0 | I68: 779.0 | K68: 779
A69: 68 | B69: Kleinke, Reinhardt | C69: BW 61 Mülheim 2 | D69: 1 | E69: 6 | F69: 6.0 | G69: 759 | H69: 759.0 | I69: 759.0 | K69: 759
A70: 69 | B70: Reichel, Bernhard | C70: SKC Kapellen 1 | D70: 2 | E70: 6 | F70: 3.0 | G70: 1375 | H70: 687.5 | I70: 667.0 | J70: 708.0 | K70: 708
A71: 70 | B71: Winter, Thomas | C71: SKC Kapellen 1 | D71: 3 | E71: 6 | F71: 2.0 | G71: 2036 | H71: 678.7 | I71: 642.0 | J71: 697.0 | K71: 724
A72: 71 | B72: Panneck, Marius | C72: SK Düsseldorf 3 | D72: 1 | E72: 5 | F72: 5.0 | G72: 762 | H72: 762.0 | J72: 762.0 | K72: 762
A73: 72 | B73: Falkenhauer, Kevin | C73: SK Heiligenhaus 3 | D73: 1 | E73: 5 | F73: 5.0 | G73: 749 | H73: 749.0 | I73: 749.0 | K73: 749
A74: 73 | B74: Bott, Helmut | C74: BW 61 Mülheim 2 | D74: 2 | E74: 5 | F74: 2.5 | G74: 1405 | H74: 702.5 | J74: 702.5 | K74: 712
A75: 74 | B75: Rienäcker, Uwe | C75: SK Dinslaken 2 | D75: 1 | E75: 4 | F75: 4.0 | G75: 741 | H75: 741.0 | I75: 741.0 | K75: 741
A76: 75 | B76: Günther, Bernd | C76: SK Kamp-Lintfort 3 | D76: 1 | E76: 3 | F76: 3.0 | G76: 746 | H76: 746.0 | J76: 746.0 | K76: 746
A77: 76 | B77: Durke, Michael | C77: SK Düsseldorf 3 | D77: 1 | E77: 3 | F77: 3.0 | G77: 740 | H77: 740.0 | I77: 740.0 | K77: 740
A78: 77 | B78: Mitscha, Tobias | C78: SK Heiligenhaus 3 | D78: 1 | E78: 3 | F78: 3.0 | G78: 723 | H78: 723.0 | I78: 723.0 | K78: 723
A79: 78 | B79: Dentgen, Andre | C79: BW 61 Mülheim 2 | D79: 1 | E79: 2 | F79: 2.0 | G79: 687 | H79: 687.0 | J79: 687.0 | K79: 687
A80: 79 | B80: Schadowski, Kurt | C80: SK Dinslaken 2 | D80: 1 | E80: 2 | F80: 2.0 | G80: 722 | H80: 722.0 | I80: 722.0 | K80: 722
A81: 80 | B81: Dorrenbach, Michael | C81: KSC Harmonie Duisburg 1 | D81: 1 | E81: 1 | F81: 1.0 | G81: 746 | H81: 746.0 | J81: 746.0 | K81: 746
A82: 81 | B82: Dziura, Torben | C82: BW 61 Mülheim 2 | D82: 1 | E82: 1 | F82: 1.0 | G82: 669 | H82: 669.0 | J82: 669.0 | K82: 669
A83: 82 | B83: Reichard, Jörg | C83: SK Düsseldorf 3 | D83: 1 | E83: 1 | F83: 1.0 | G83: 635 | H83: 635.0 | J83: 635.0 | K83: 635
A84: 83 | B84: Otremba, Maik | C84: SK Dinslaken 2 | D84: 1 | E84: 1 | F84: 1.0 | G84: 712 | H84: 712.0 | I84: 712.0 | K84: 712
A85: 84 | B85: Steinmann, Michael | C85: SK Düsseldorf 3 | D85: 1 | E85: 1 | F85: 1.0 | G85: 702 | H85: 702.0 | I85: 702.0 | K85: 702

A1: SK Heilingenhaus 3 | D1: Blau-Weiß 61 Mülheim 2
A2: Falkenhauer, Kevin | B2: 749 | C2: 5 | D2: Bott, Helmut | E2: 693 | F2: 3
A3: Hock, Manfred | B3: 815 | C3: 11 | D3: Strack, Hans-Peter | E3: 760 | F3: 6
A4: Mehler, Felixl | B4: 795 | C4: 9 | D4: Dentgen, Andre | E4: 687 | F4: 2
A5: Benedens, Tim | B5: 762 | C5: 7 | D5: Dziura, Torben | E5: 669 | F5: 1
A6: Meriste, Sebastian | B6: 821 | C6: 12 | D6: Ries, Bernd | E6: 809 | F6: 10
A7: Fedkenhauer, Christoph | B7: 746 | C7: 14 | D7: Panneck, Marcel | E7: 769 | F7: 8
A8: Einzelwertungspunkte (EWP) | C8: 48 | D8: 30
A9: Punkte | C9: 3 | D9: 0
A10: Holzzahl | C10: 4688 | D10: 4387

A1: Blau-Weiß 61 Mülheim 2 | D1: SK Dinslaken 2
A2: Gietmann, Udo | B2: 832 | C2: 10 | D2: Dudler, Bernhard | E2: 793 | F2: 7
A3: Blum, Stefan | B3: 750 | C3: 3 | D3: Vogt, Harald | E3: 798 | F3: 8
A4: Panneck, Marcel | B4: 773 | C4: 5 | D4: Warzanski, Michael | E4: 338 | F4: 1
A5: Strack, Hans-Peter | B5: 789 | C5: 6 | D5: Werbonat, Pascal | E5: 744 | F5: 2
A6: Klasen, Thomas | B6: 880 | C6: 12 | D6: Jankovic, Ilija | E6: 755 | F6: 4
A7: Ries, Bernd | B7: 842 | C7: 11 | D7: Schröter, Stefan | E7: 831 | F7: 9
A8: Einzelwertungspunkte (EWP) | C8: 47 | D8: 31
A9: Punkte | C9: 2 | D9: 1
A10: Holzzahl | C10: 4866 | D10: 4309

A1: Blau-Weiß 61 Mülheim 2 | D1: SK Düsseldorf 3
A2: Blum, Stefan | B2: 773 | C2: 5 | D2: Kremer, Christoph | E2: 804 | F2: 9
A3: Panneck, Marcel | B3: 686 | C3: 1 | D3: Panneck, Roland | E3: 712 | F3: 2
A4: Strack, Hans-Peter | B4: 840 | C4: 10 | D4: Arians, Lothar | E4: 788 | F4: 7
A5: Klasen, Thomas | B5: 866 | C5: 11 | D5: Kamps, Manfred | E5: 719 | F5: 3
A6: Ries, Bernd | B6: 883 | C6: 12 | D6: Fries, Dieter | E6: 745 | F6: 4
A7: Zimmermann, Kim | B7: 779 | C7: 6 | D7: Kubb, Benjamin | E7: 793 | F7: 8
A8: Einzelwertungspunkte (EWP) | C8: 45 | D8: 33
A9: Punkte | C9: 2 | D9: 1
A10: Holzzahl | C10: 4827 | D10: 4561

A1: KSC Harmonie Duisburg 1 | D1: Blau-Weiß 61 Mülheim 2
A2: Dorrenbach, Dietmar | B2: 754 | C2: 7 | D2: Strack, Hans-Peter | E2: 739 | F2: 4
A3: Tepper, Carsten | B3: 804 | C3: 10 | D3: Klasen, Thomas | E3: 816 | F3: 11
A4: Neumann, Frank | B4: 749 | C4: 6 | D4: Bott, Helmut | E4: 712 | F4: 2
A5: Jaschke, Roland | B5: 746 | C5: 5 | D5: Blum, Stefan | E5: 766 | F5: 9
A6: Dahlhaus, Ralf | B6: 763 | C6: 8 | D6: Ries, Bernd | E6: 858 | F6: 12
A7: Schulz, Bernd | B7: 734 | C7: 3 | D7: Panneck, Marcel | E7: 708 | F7: 1
A8: Einzelwertungspunkte (EWP) | C8: 39 | D8: 39
A9: Punkte | C9: 0 | D9: 3
A10: Holzzahl | C10: 4550 | D10: 4599

A1: Blau-Weiß 61 Mülheim 2 | D1: SKC Kapellen
A2: Blum, Stefan | B2: 756 | C2: 5 | D2: Küppers, Frank | E2: 838 | F2: 10
A3: Strack, Hans-Peter | B3: 806 | C3: 9 | D3: Zillikens, Rolf | E3: 792 | F3: 8
A4: Kleinke, Reinhardt | B4: 759 | C4: 6 | D4: Bruckschen, Hans-Bernd | E4: 719 | F4: 4
A5: Klasen, Thomas | B5: 852 | C5: 12 | D5: Urban, Dirk | E5: 688 | F5: 2
A6: Ries, Bernd | B6: 847 | C6: 11 | D6: Winter, Thomas | E6: 670 | F6: 1
A7: Panneck, Marcel | B7: 778 | C7: 7 | D7: Radtke, Oliver | E7: 692 | F7: 3
A8: Einzelwertungspunkte (EWP) | C8: 50 | D8: 28
A9: Punkte | C9: 3 | D9: 0
A10: Holzzahl | C10: 4798 | D10: 4399

A1: Datum | B1: Spieltag | C1: Nr. | D1: Uhrzeit | E1: Heim | G1: Gast | H1: Punkte | I1: ZW | J1: Holz
A2: 11.09.2011 | B2: 1 | C2: 1 | D2: 10:00 | E2: SK Heiligenhaus 3 | F2: - | G2: SK Kamp-Lintfort 3 | H2: 3 : 0 | I2: 49:30 | J2: 4749:4530
C3: 2 | D3: 13:00 | E3: SK Dinslaken 2 | F3: - | G3: SK 54/59 Essen-Borbeck | H3: 3 : 0 | I3: 54:24 | J3: 4678:4433
C4: 3 | D4: 10:00 | E4: BW 61 Mülheim 2 | F4: - | G4: SKC Kapellen | H4: 3 : 0 | I4: 50:28 | J4: 4798:4399
C5: 4 | D5: 10:00 | E5: SK Düsseldorf 3 | F5: - | G5: KSC Harmonie Duisburg | H5: 3 : 0 | I5: 49:29 | J5: 4954:4763
A6: 18.09.2011 | B6: 2 | C6: 5 | D6: 09:00 | E6: KSC Harmonie Duisburg | F6: - | G6: BW 61 Mülheim 2 | H6: 0 : 3 | I6: 39:39 | J6: 4550:4599
C7: 6 | D7: 10:00 | E7: SK Kamp-Lintfort 3 | F7: - | G7: SK Düsseldorf 3 | H7: 2 : 1 | I7: 47:31 | J7: 4993:4772
C8: 7 | D8: 10:00 | E8: SK 54/59 Essen-Borbeck | F8: - | G8: SK Heiligenhaus 3 | H8: 0 : 3 | I8: 28:50 | J8: 4371:4552
C9: 8 | D9: 11:00 | E9: SKC Kapellen | F9: - | G9: SK Dinslaken 2 | H9: 3 : 0 | I9: 51:27 | J9: 4250:3991
A10: 02.10.2011 | B10: 3 | C10: 9 | D10: 10:00 | E10: BW 61 Mülheim 2 | F10: - | G10: SK Düsseldorf 3 | H10: 2 : 1 | I10: 45:33 | J10: 4827:4561
C11: 10 | D11: 10:00 | E11: SK Heiligenhaus 3 | F11: - | G11: SKC Kapellen | H11: 2 : 1 | I11: 46:32 | J11: 4616:4075
C12: 11 | D12: 13:00 | E12: SK Dinslaken 2 | F12: - | G12: KSC Harmonie Duisburg | H12: 2 : 1 | I12: 42:36 | J12: 4671:4615
C13: 12 | D13: 10:00 | E13: SK Kamp-Lintfort 3 | F13: - | G13: SK 54/59 Essen-Borbeck | H13: 3 : 0 | I13: 57:21 | J13: 5095:4542
A14: 16.10.2011 | B14: 4 | C14: 13 | D14: 11:00 | E14: SKC Kapellen | F14: - | G14: SK Kamp-Lintfort 3
C15: 14 | D15: 09:00 | E15: SK Düsseldorf 3 | F15: - | G15: SK 54/59 Essen-Borbeck
C16: 15 | D16: 10:00 | E16: BW 61 Mülheim 2 | F16: - | G16: SK Dinslaken 2
C17: 26 | D17: 09:00 | E17: KSC Harmonie Duisburg | F17: - | G17: SK Heiligenhaus 3
A18: 23.10.2011 | B18: 5 | C18: 17 | D18: 13:00 | E18: SK Dinslaken 2 | F18: - | G18: SK Düsseldorf 3
C19: 18 | D19: 13:00 | E19: SK Kamp-Lintfort 3 | F19: - | G19: KSC Harmonie Duisburg
C20: 19 | D20: 10:00 | E20: SK 54/59 Essen-Borbeck | F20: - | G20: SKC Kapellen
C21: 20 | D21: 13:00 | E21: SK Heiligenhaus 3 | F21: - | G21: BW 61 Mülheim 2
A22: 06.11.2011 | B22: 6 | C22: 21 | D22: 09:00 | E22: KSC Harmonie Duisburg | F22: - | G22: SK 54/59 Essen-Borbeck
C23: 22 | D23: 13:00 | E23: SK Dinslaken 2 | F23: - | G23: SK Heiligenhaus 3
C24: 23 | D24: 10:00 | E24: BW 61 Mülheim 2 | F24: - | G24: SK Kamp-Lintfort 3
C25: 24 | D25: 09:00 | E25: SK Düsseldorf 3 | F25: - | G25: SKC Kapellen
A26: 13.11.2011 | B26: 7 | C26: 25 | D26: 11:00 | E26: SKC Kapellen | F26: - | G26: KSC Harmonie Duisburg
C27: 26 | D27: 10:00 | E27: SK 54/59 Essen-Borbeck | F27: - | G27: BW 61 Mülheim 2
C28: 27 | D28: 10:00 | E28: SK Heiligenhaus 3 | F28: - | G28: SK Düsseldorf 3
C29: 28 | D29: 16:00 | E29: SK Kamp-Lintfort 3 | F29: - | G29: SK Dinslaken 2

A1: Datum | B1: Spieltag | C1: Nr. | D1: Uhrzeit | E1: Heim | G1: Gast | H1: Punkte | I1: ZW | J1: Holz
A2: 27.11.2011 | B2: 8 | C2: 29 | D2: 10:00 | E2: SK Kamp-Lintfort 3 | F2: - | G2: SK Heiligenhaus 3
C3: 30 | D3: 10:00 | E3: SK 54/59 Essen-Borbeck | F3: - | G3: SK Dinslaken 2
C4: 31 | D4: 11:00 | E4: SKC Kapellen | F4: - | G4: BW 61 Mülheim 2
C5: 32 | D5: 09:00 | E5: KSC Harmonie Duisburg | F5: - | G5: SK Düsseldorf 3
A6: 11.12.2011 | B6: 9 | C6: 33 | D6: 10:00 | E6: BW 61 Mülheim 2 | F6: - | G6: KSC Harmonie Duisburg
C7: 34 | D7: 10:00 | E7: SK Düsseldorf 3 | F7: - | G7: SK Kamp-Lintfort 3
C8: 35 | D8: 13:00 | E8: SK Heiligenhaus 3 | F8: - | G8: SK 54/59 Essen-Borbeck
C9: 36 | D9: 11:00 | E9: SK Dinslaken 2 | F9: - | G9: SKC Kapellen
A10: 15.01.2012 | B10: 10 | C10: 37 | D10: 10:00 | E10: SK Düsseldorf 3 | F10: - | G10: BW 61 Mülheim 2
C11: 38 | D11: 11:00 | E11: SKC Kapellen | F11: - | G11: SK Heiligenhaus 3
C12: 39 | D12: 09:00 | E12: KSC Harmonie Duisburg | F12: - | G12: SK Dinslaken 2
C13: 40 | D13: 10:00 | E13: SK 54/59 Essen-Borbeck | F13: - | G13: SK Kamp-Lintfort 3
A14: 12.02.2012 | B14: 11 | C14: 41 | D14: 11:00 | E14: SK Kamp-Lintfort 3 | F14: - | G14: SKC Kapellen
C15: 42 | D15: 09:00 | E15: SK 54/59 Essen-Borbeck | F15: - | G15: SK Düsseldorf 3
C16: 43 | D16: 10:00 | E16: SK Dinslaken 2 | F16: - | G16: BW 61 Mülheim 2
C17: 44 | D17: 09:00 | E17: SK Heiligenhaus 3 | F17: - | G17: KSC Harmonie Duisburg
A18: 26.02.2012 | B18: 12 | C18: 45 | D18: 09:00 | E18: SK Düsseldorf 3 | F18: - | G18: SK Dinslaken 2
C19: 46 | D19: 09:00 | E19: KSC Harmonie Duisburg | F19: - | G19: SK Kamp-Lintfort 3
C20: 47 | D20: 11:00 | E20: SKC Kapellen | F20: - | G20: SK 54/59 Essen-Borbeck
C21: 48 | D21: 10:00 | E21: BW 61 Mülheim 2 | F21: - | G21: SK Heiligenhaus 3
A22: 04.03.2012 | B22: 13 | C22: 49 | D22: 10:00 | E22: SK 54/59 Essen-Borbeck | F22: - | G22: KSC Harmonie Duisburg
C23: 50 | D23: 10:00 | E23: SK Heiligenhaus 3 | F23: - | G23: SK Dinslaken 2
C24: 51 | D24: 10:00 | E24: SK Kamp-Lintfort 3 | F24: - | G24: BW 61 Mülheim 2
C25: 52 | D25: 11:00 | E25: SKC Kapellen | F25: - | G25: SK Düsseldorf 3
A26: 25.03.2012 | B26: 14 | C26: 53 | D26: 09:00 | E26: KSC Harmonie Duisburg | F26: - | G26: SKC Kapellen
C27: 54 | D27: 10:00 | E27: BW 61 Mülheim 2 | F27: - | G27: SK 54/59 Essen-Borbeck
C28: 55 | D28: 09:00 | E28: SK Düsseldorf 3 | F28: - | G28: SK Heiligenhaus 3
C29: 56 | D29: 13:00 | E29: SK Dinslaken 2 | F29: - | G29: SK Kamp-Lintfort 3