D1: Kamp-Lintfort | F1: Heiligenhaus | H1: Korschenbroich | J1: Gesamt
A3: Platz | B3: Name | C3: Verein | D3: Holz | E3: Punkte | F3: Holz | G3: Punkte | H3: Holz | I3: Punkte | J3: Holz | K3: Punkte
A4: 1. | B4: Markett, Stephanie | C4: Rees | D4: 718 | E4: 17 | F4: 739 | G4: 20 | H4: 695 | I4: 20 | J4: =D4+F4+H4 -> 2152 | K4: =G4+E4+I4 -> 57
A5: 2. | B5: Henkel, Isabel | C5: Mülheim | D5: 748 | E5: 20 | F5: 720 | G5: 19 | H5: 626 | I5: 18 | J5: =D5+F5+H5 -> 2094 | K5: =G5+E5+I5 -> 57
A6: 3. | B6: Ziemke, Carmen | C6: Remscheid | D6: 716 | E6: 16 | F6: 712 | G6: 18 | H6: 614 | I6: 17 | J6: =D6+F6+H6 -> 2042 | K6: =G6+E6+I6 -> 51
A7: 4. | B7: Henkel, Ivonne | C7: Mülheim | D7: 724 | E7: 18 | F7: 701 | G7: 17 | H7: 600 | I7: 16 | J7: =D7+F7+H7 -> 2025 | K7: =G7+E7+I7 -> 51
A8: 5. | B8: Sowinski, Fabienne | C8: Düsseldorf | D8: 655 | E8: 15 | F8: 630 | G8: 16 | H8: 568 | I8: 15 | J8: =D8+F8+H8 -> 1853 | K8: =G8+E8+I8 -> 46
A9: 6. | B9: Ziemke, Sarah | C9: Remscheid | D9: 583 | E9: 14 | F9: 564 | G9: 15 | H9: 508 | I9: 12 | J9: =D9+F9+H9 -> 1655 | K9: =G9+E9+I9 -> 41
A10: 7. | B10: Hensing, Deborah | C10: Essen | D10: 527 | E10: 13 | F10: 552 | G10: 14 | H10: 513 | I10: 13 | J10: =D10+F10+H10 -> 1592 | K10: =G10+E10+I10 -> 40
A11: 8. | B11: Glas, Nina | C11: Korschenbroich | D11: 428 | E11: 12 | F11: 506 | G11: 13 | H11: 545 | I11: 14 | J11: =D11+F11+H11 -> 1479 | K11: =G11+E11+I11 -> 39
A12: 9. | B12: Neumann, Lisa | C12: Rees | D12: 727 | E12: 19 | F12: 0 | G12: 0 | H12: 676 | I12: 19 | J12: =D12+F12+H12 -> 1403 | K12: =G12+E12+I12 -> 38
A13: 10. | B13: Tenckhoff, Lisa | C13: Düsseldorf | D13: 353 | E13: 11 | F13: 358 | G13: 12 | H13: 349 | I13: 11 | J13: =D13+F13+H13 -> 1060 | K13: =G13+E13+I13 -> 34

D1: Kamp-Lintfort | F1: Düsseldorf | H1: Essen | J1: Gesamt
A3: Platz | B3: Name | C3: Verein | D3: Holz | E3: Punkte | F3: Holz | G3: Punkte | H3: Holz | I3: Punkte | J3: Holz | K3: Punkte
A4: 1. | B4: Panneck, Marcel | C4: VNK | D4: 632 | E4: 30 | F4: 659 | G4: 28 | H4: 627 | I4: 30 | J4: 1918 | K4: 88
A5: 2. | B5: Panneck, Marvin | C5: VNK | D5: 598 | E5: 29 | F5: 672 | G5: 29 | H5: 625 | I5: 29 | J5: 1895 | K5: 87
A6: 3. | B6: Dziura, Torben | C6: VNK | D6: 587 | E6: 26 | F6: 630 | G6: 25 | H6: 616 | I6: 28 | J6: 1833 | K6: 79
A7: 4. | B7: Fedkenhauer, Christoph | C7: Heiligenhaus | D7: 566 | E7: 24 | F7: 635 | G7: 27 | H7: 576 | I7: 25 | J7: 1777 | K7: 76
A8: 5. | B8: Bolz, Alexander | C8: VNK | D8: 500 | E8: 20 | F8: 678 | G8: 30 | H8: 582 | I8: 26 | J8: 1760 | K8: 76
A9: 6. | B9: Mitscha, Tobias | C9: Heiligenhaus | D9: 594 | E9: 28 | F9: 578 | G9: 20 | H9: 591 | I9: 27 | J9: 1763 | K9: 75
A10: 7. | B10: Eichenhofer, Nils | C10: VNK | D10: 588 | E10: 27 | F10: 597 | G10: 23 | H10: 559 | I10: 24 | J10: 1744 | K10: 74
A11: 8. | B11: Keßmeier, Jonas | C11: Mönchengladbach | D11: 560 | E11: 23 | F11: 633 | G11: 26 | H11: 545 | I11: 23 | J11: 1738 | K11: 72
A12: 9. | B12: Coenen, Leon | C12: VNK | D12: 579 | E12: 25 | F12: 590 | G12: 21 | H12: 538 | I12: 22 | J12: 1707 | K12: 68
A13: 10. | B13: Hülsken, Andre | C13: Rees | D13: 549 | E13: 22 | F13: 592 | G13: 22 | H13: 512 | I13: 20 | J13: 1653 | K13: 64
A14: 11. | B14: Pütz, Rene | C14: Heiligenhaus | D14: 491 | E14: 19 | F14: 598 | G14: 24 | H14: 484 | I14: 19 | J14: 1573 | K14: 62
A15: 12. | B15: Hothow, Marcel | C15: Wesel | D15: 471 | E15: 18 | F15: 483 | G15: 19 | H15: 517 | I15: 21 | J15: 1471 | K15: 58
A16: 13. | B16: Flore, Marius | C16: Heiligenhaus | D16: 522 | E16: 21 | F16: 446 | G16: 18 | H16: 474 | I16: 18 | J16: 1442 | K16: 57
A17: 14. | B17: Holzum, Niklas | C17: Rees | D17: 376 | E17: 16 | F17: 414 | G17: 17 | H17: 360 | I17: 15 | J17: 1150 | K17: 48
A18: 15. | B18: Schill, Leon | C18: Rees | D18: 344 | E18: 15 | F18: 400 | G18: 15 | H18: 367 | I18: 16 | J18: 1111 | K18: 46
A19: 16. | B19: Buck, Fabian | C19: Heiligenhaus | D19: 321 | E19: 14 | F19: 348 | G19: 14 | H19: 333 | I19: 17 | J19: 1002 | K19: 45
A20: 17. | B20: Jaschinski, Timo | C20: VNK | D20: 273 | E20: 12 | F20: 406 | G20: 15 | H20: 308 | I20: 13 | J20: 987 | K20: 40
A21: 18. | B21: van Marwyk, Torsten | C21: Rees | D21: 250 | E21: 11 | F21: 280 | G21: 12 | H21: 283 | I21: 12 | J21: 813 | K21: 35
A22: 19. | B22: Lodewick, Christoph | C22: Rees | D22: 306 | E22: 13 | F22: 348 | G22: 14 | H22: 0 | I22: 0 | J22: 654 | K22: 27
A23: 20. | B23: Greguletz, Oliver | C23: VNK | D23: 434 | E23: 17 | F23: 0 | G23: 0 | H23: 0 | I23: 0 | J23: 434 | K23: 17