A1: Leider sind die Informationen im Moment nicht auf dem aktuellsten Stand. Bitte unterstüzt uns indem Ihr Eure Eindrücke des neuen Designs(hier klicken) an den webmaster sendet.

A1: 1. Bundesliga Herren | B1: Sonnstag 26.11.11 | C1: SK Münstermaifeld | D1: / | E1: BW 61 Mülheim 1 | F1: 3 : 0 ( 48 : 30 ) 5041 : 4899
A2: 11. Spieltag
A3: Mannschaftstabelle nach dem 11.Spiel

A1: Platz | B1: Mannschaft | C1: Spiele | D1: Punkte | E1: Heim | F1: Ausw. | G1: +/- | H1: EWP | I1: Holz | J1: Ø Heim | K1: Ø ausw. | L1: Ø Heim | M1: Ø ausw.
A2: 1 | B2: KSV Riol | C2: 11 | D2: =E2+F2 -> 23 | E2: 11 | F2: 12 | G2: 11 | H2: 434 | I2: 56874 | J2: 5200.75 | K2: 5153 | L2: 866.79166666666663 | M2: 858.83333333333337
A3: 2 | B3: SK Heilingenhaus | C3: 11 | D3: =E3+F3 -> 22 | E3: 16 | F3: 6 | G3: 4 | H3: 472 | I3: 56907 | J3: 5250.166666666667 | K3: 5081.2 | L3: 875.02777777777783 | M3: 846.86666666666667
A4: 3 | B4: Ninepin 09 Isalohn | C4: 11 | D4: =E4+F4 -> 22 | E4: 17 | F4: 5 | G4: 4 | H4: 450 | I4: 56130 | J4: 5104.833333333333 | K4: 5100.2 | L4: 850.80555555555554 | M4: 850.0333333333333
A5: 3 | B5: KF Obertal | C5: 11 | D5: =E5+F5 -> 20 | E5: 12 | F5: 8 | G5: 8 | H5: 469 | I5: 58836 | J5: 5696.25 | K5: 5150.1428571428569 | L5: 949.375 | M5: 858.35714285714278
A6: 4 | B6: SK Münstermaifeld | C6: 11 | D6: =E6+F6 -> 17 | E6: 16 | F6: 1 | G6: -4 | H6: 452 | I6: 55875 | J6: 5186.8571428571431 | K6: 4891.75 | L6: 864.47619047619048 | M6: 815.29166666666663
A7: 5 | B7: SKG 67 Paffrath | C7: 11 | D7: =E7+F7 -> 16 | E7: 16 | F7: 0 | G7: -2 | H7: 438 | I7: 56670 | J7: 5320.333333333333 | K7: 4949.6 | L7: 886.72222222222217 | M7: 824.93333333333339
A8: 6 | B8: KSG Tecklenburger Land | C8: 11 | D8: =E8+F8 -> 16 | E8: 15 | F8: 1 | G8: -2 | H8: 422 | I8: 55664 | J8: 5245 | K8: 4838.8 | L8: 874.16666666666663 | M8: 806.4666666666667
A9: 7 | B9: KSF Chemie Holten-Duisburg | C9: 11 | D9: =E9+F9 -> 15 | E9: 14 | F9: 1 | G9: -3 | H9: 381 | I9: 55377 | J9: 5114.5 | K9: 4938 | L9: 852.41666666666663 | M9: 823
A10: 8 | B10: BW 61 Mülheim | C10: 11 | D10: =E10+F10 -> 8 | E10: 7 | F10: 1 | G10: -7 | H10: 367 | I10: 55005 | J10: 5084.6 | K10: 4930.333333333333 | L10: 847.43333333333339 | M10: 821.72222222222217
A11: 10 | B11: KSG BG 99 Neuhof | C11: 11 | D11: =E11+F11 -> 6 | E11: 6 | F11: 0 | G11: -9 | H11: 327 | I11: 54657 | J11: 5180.6 | K11: 4792.333333333333 | L11: 863.43333333333339 | M11: 798.72222222222217

A1: Niederrhein-Liga Damen | B1: Sonnstag 20.11.11 | C1: SKV Rees | D1: / | E1: RW 59 Mülheim 1 | F1: 0 : 3 ( 31: 47 ) 4461: 4577
A2: 6. Spieltag
A3: Mannschaftstabelle nach dem 6. Spieltag

A1: Platz | B1: Mannschaft | C1: Spiele | D1: Punkte | E1: Heim | F1: Ausw. | G1: +/- | H1: EWP | I1: Holz | J1: Ø Heim | K1: Ø ausw. | L1: Ø Heim | M1: Ø ausw.
A2: 1 | B2: RW 59 Mülheim | C2: 5 | D2: =E2+F2 -> 14 | E2: 8 | F2: 6 | G2: 5 | H2: 199 | I2: 23289 | J2: 4705 | K2: 4587 | L2: 784.16666666666663 | M2: 764.5
A3: 2 | B3: SKV Rees | C3: 5 | D3: =E3+F3 -> 10 | E3: 6 | F3: 4 | G3: 4 | H3: 210 | I3: 22333 | J3: 4495 | K3: 4424 | L3: 749.16666666666663 | M3: 737.33333333333337
A4: 3 | B4: SK Kleve | C4: 5 | D4: =E4+F4 -> 7 | E4: 4 | F4: 3 | G4: -2 | H4: 183 | I4: 21715 | J4: 4432 | K4: 4209.5 | L4: 738.66666666666663 | M4: 701.58333333333337
A5: 4 | B5: DSKC Heilingenhaus | C5: 4 | D5: =E5+F5 -> 3 | E5: 2 | F5: 1 | G5: -3 | H5: 139 | I5: 17318 | J5: 4236.5 | K5: 4422.5 | L5: 706.08333333333337 | M5: 737.08333333333337
A6: 5 | B6: RSV Samo Remscheid 2 | C6: 5 | D6: =E6+F6 -> 2 | E6: 0 | F6: 2 | G6: -1 | H6: 158 | I6: 19704 | J6: 4093 | K6: 3902.75 | L6: 682.16666666666663 | M6: 650.45833333333337

A1: BezirksLiga 1 Damen | B1: Sonnstag 20.11.11 | C1: RW 59 Mülheim 2 | D1: / | E1: spielfrei
A2: 7. Spieltag
A3: Mannschaftstabelle nach dem 7. Spieltag

A1: Platz | B1: Mannschaft | C1: Spiele | D1: Punkte | E1: Heim | F1: Ausw. | G1: +/- | H1: EWP | I1: Holz | J1: Ø Heim | K1: Ø ausw. | L1: Ø Heim | M1: Ø ausw.
A2: 1 | B2: ESV BW Rhgd. Düsseldorf | C2: 6 | D2: =E2+F2 -> 17 | E2: 11 | F2: 6 | G2: 5 | H2: 276 | I2: 24739 | J2: 4174 | K2: 4021.5 | L2: 695.66666666666663 | M2: 670.25
A3: 2 | B3: Düsseldorf 2010 | C3: 5 | D3: =E3+F3 -> 11 | E3: 6 | F3: 5 | G3: 2 | H3: 238 | I3: 23807 | J3: 3966 | K3: 5954.5 | L3: 661 | M3: 992.41666666666663
A4: 3 | B4: FSKC Wesel | C4: 6 | D4: =E4+F4 -> 11 | E4: 4 | F4: 7 | G4: 2 | H4: 232 | I4: 23742 | J4: 3871.6666666666665 | K4: 4042.3333333333335 | L4: 645.27777777777771 | M4: 673.72222222222229
A5: 4 | B5: RW 59 Mülheim 2 | C5: 6 | D5: =E5+F5 -> 10 | E5: 5 | F5: 5 | G5: 4 | H5: 248 | I5: 22703 | J5: 3956.5 | K5: 3697.5 | L5: 659.41666666666663 | M5: 616.25
A6: 5 | B6: Montan 66 Duisburg | C6: 6 | D6: =E6+F6 -> 9 | E6: 7 | F6: 2 | G6: -3 | H6: 251 | I6: 23146 | J6: 3905.5 | K6: 3762 | L6: 650.91666666666663 | M6: 627
A7: 6 | B7: SK Kamp-Lintfort 2 | C7: 6 | D7: =E7+F7 -> 3 | E7: 0 | F7: 3 | G7: -3 | H7: 200 | I7: 21152 | J7: 3877.5 | K7: 3349.25 | L7: 646.25 | M7: 558.20833333333337
A8: 7 | B8: SK 54/50 Essen-Borbeck | C8: 5 | D8: =E8+F8 -> 2 | E8: 2 | F8: 0 | G8: -7 | H8: 187 | I8: 16801 | J8: 5133.5 | K8: 2178 | L8: 855.58333333333337 | M8: 363

A1: BezirksLiga 1 Herren | B1: Sonnstag 27.11.11 | C1: SKC Kapellen 1 | D1: / | E1: BW 61 Mülheim 2 | F1: 0 : 3
A2: 8. Spieltag
A3: Mannschaftstabelle nach dem 8. Spieltag

A1: Platz | B1: Mannschaft | C1: Spiele | D1: Punkte | E1: Heim | F1: Ausw. | G1: +/- | H1: EWP | I1: Holz | J1: Ø Heim | K1: Ø ausw. | L1: Ø Heim | M1: Ø ausw.
A2: 1 | B2: BW 61 Mülheim 2 | C2: 8 | D2: =E2+F2 -> 18 | E2: 9 | F2: 9 | G2: 6 | H2: 352 | I2: 37480 | J2: 4824.25 | K2: 4545.75 | L2: 804.04166666666663 | M2: 757.625
A3: 2 | B3: SK Kamp-Lintfort 3 | C3: 8 | D3: =E3+F3 -> 16 | E3: 14 | F3: 2 | G3: 1 | H3: 357 | I3: 38594 | J3: 5038 | K3: 4468 | L3: 839.66666666666663 | M3: 744.66666666666663
A4: 3 | B4: SK Heilingenhaus 3 | C4: 8 | D4: =E4+F4 -> 15 | E4: 11 | F4: 4 | G4: 3 | H4: 327 | I4: 36495 | J4: 4678 | K4: 4445.75 | L4: 779.66666666666663 | M4: 740.95833333333337
A5: 4 | B5: SK Dinslaken 2 | C5: 8 | D5: =E5+F5 -> 13 | E5: 9 | F5: 4 | G5: 1 | H5: 313 | I5: 36333 | J5: 4671 | K5: 4412.25 | L5: 778.5 | M5: 735.375
A6: 5 | B6: KSC Harmonie Duisburg | C6: 7 | D6: =E6+F6 -> 10 | E6: 6 | F6: 4 | G6: 1 | H6: 284 | I6: 32290 | J6: 4635.666666666667 | K6: 4595.75 | L6: 772.6111111111112 | M6: 765.95833333333337
A7: 6 | B7: SKC Kapellen | C7: 7 | D7: =E7+F7 -> 7 | E7: 5 | F7: 2 | G7: -5 | H7: 245 | I7: 29595 | J7: 4189.75 | K7: 4278.666666666667 | L7: 698.29166666666663 | M7: 713.1111111111112
A8: 7 | B8: SK Düsseldorf 3 | C8: 6 | D8: =E8+F8 -> 7 | E8: 4 | F8: 3 | G8: 1 | H8: 213 | I8: 27718 | J8: 4807.5 | K8: 4525.75 | L8: 801.25 | M8: 754.29166666666663
A9: 8 | B9: SK 54/50 Essen-Borbeck | C9: 8 | D9: =E9+F9 -> 4 | E9: 2 | F9: 2 | G9: -8 | H9: 250 | I9: 35840 | J9: 4453.5 | K9: 4506.5 | L9: 742.25 | M9: 751.08333333333337

A1: BezirksKlasse 1 Herren | B1: Sonnstag 27.11.11 | C1: KSC 71 Saarn | D1: / | E1: SK Dinslaken 4 | F1: 3 : 0
A2: 8. Spieltag
A3: Mannschaftstabelle nach dem 8. Spieltag

A1: Platz | B1: Mannschaft | C1: Spiele | D1: Punkte | E1: Heim | F1: Ausw. | G1: +/- | H1: EWP | I1: Holz | J1: Ø Heim | K1: Ø ausw. | L1: Ø Heim | M1: Ø ausw.
A2: 1 | B2: KSC Hrmonie 64 Walsum | C2: 8 | D2: =E2+F2 -> 21 | E2: 11 | F2: 10 | G2: 9 | H2: 365 | I2: 36398 | J2: 4610.75 | K2: 4488.75 | L2: 768.45833333333337 | M2: 748.125
A3: 2 | B3: SKV Rees 2 | C3: 8 | D3: =E3+F3 -> 17 | E3: 13 | F3: 4 | G3: 2 | H3: 359 | I3: 35626 | J3: 4522.4 | K3: 4338 | L3: 753.73333333333323 | M3: 723
A4: 3 | B4: KSF 32 Duisburg | C4: 8 | D4: =E4+F4 -> 16 | E4: 10 | F4: 6 | G4: 4 | H4: 358 | I4: 34539 | J4: 4350.25 | K4: 4284.5 | L4: 725.04166666666663 | M4: 714.08333333333337
A5: 4 | B5: KSC 71 Saarn | C5: 8 | D5: =E5+F5 -> 14 | E5: 7 | F5: 7 | G5: 2 | H5: 331 | I5: 34826 | J5: 4420.25 | K5: 4286.25 | L5: 736.70833333333337 | M5: 714.375
A6: 5 | B6: SK Kleve | C6: 8 | D6: =E6+F6 -> 12 | E6: 3 | F6: 9 | G6: 3 | H6: 321 | I6: 35265 | J6: 4519.333333333333 | K6: 4341.4 | L6: 753.22222222222217 | M6: 723.56666666666661
A7: 6 | B7: ESV Oberhausen | C7: 8 | D7: =E7+F7 -> 12 | E7: 9 | F7: 3 | G7: 0 | H7: 313 | I7: 34198 | J7: 4188.5 | K7: 4361 | L7: 698.08333333333337 | M7: 726.83333333333337
A8: 7 | B8: SK Kamp-Lintfort 5 | C8: 8 | D8: =E8+F8 -> 3 | E8: 2 | F8: 1 | G8: -9 | H8: 236 | I8: 32345 | J8: 4233.5 | K8: 3852.75 | L8: 705.58333333333337 | M8: 642.125
A9: 8 | B9: Sk Dinslaken 4 | C9: 8 | D9: =E9+F9 -> 1 | E9: 0 | F9: 1 | G9: -11 | H9: 230 | I9: 30694 | J9: 4034.5 | K9: 3639 | L9: 672.41666666666663 | M9: 606.5

A1: BezirksKlasse 2 Herren | B1: Sonnstag 27.11.11 | C1: BW 61 Mülheim 3 | D1: / | E1: SK Dinslaken 3 | F1: 3 : 0
A2: 8. Spieltag
A3: Mannschaftstabelle nach dem 8. Spieltag

A1: Platz | B1: Mannschaft | C1: Spiele | D1: Punkte | E1: Heim | F1: Ausw. | G1: +/- | H1: EWP | I1: Holz | J1: Ø Heim | K1: Ø ausw. | L1: Ø Heim | M1: Ø ausw.
A2: 1 | B2: Sk Kamp-Lintfort 4 | C2: 7 | D2: =E2+F2 -> 19 | E2: 9 | F2: 10 | G2: 10 | H2: 321 | I2: 32308 | J2: 4849.333333333333 | K2: 4440 | L2: 808.22222222222217 | M2: 740
A3: 2 | B3: BW 61 Mülheim 3 | C3: 7 | D3: =E3+F3 -> 15 | E3: 11 | F3: 4 | G3: 3 | H3: 294 | I3: 30304 | J3: 4352.25 | K3: 4298.333333333333 | L3: 725.375 | M3: 716.3888888888888
A4: 3 | B4: Sk Dinslaken 3 | C4: 7 | D4: =E4+F4 -> 11 | E4: 7 | F4: 4 | G4: -1 | H4: 279 | I4: 31546 | J4: 4743.25 | K4: 4191 | L4: 790.54166666666663 | M4: 698.5
A5: 4 | B5: BFG 1920 Wesel 2 | C5: 6 | D5: =E5+F5 -> 11 | E5: 9 | F5: 2 | G5: 1 | H5: 260 | I5: 26452 | J5: 4494.333333333333 | K5: 4323 | L5: 749.05555555555554 | M5: 720.5
A6: 5 | B6: SK 66/99 Solingen 2 | C6: 7 | D6: =E6+F6 -> 9 | E6: 8 | F6: 1 | G6: 0 | H6: 251 | I6: 30417 | J6: 4498.333333333333 | K6: 4230.5 | L6: 749.72222222222217 | M6: 705.08333333333337
A7: 6 | B7: SKG 31 Essen | C7: 7 | D7: =E7+F7 -> 5 | E7: 2 | F7: 3 | G7: -4 | H7: 233 | I7: 29913 | J7: 4389.333333333333 | K7: 4186.25 | L7: 731.55555555555554 | M7: 697.70833333333337
A8: 7 | B8: KSC Harmonie Duisburg 2 | C8: 7 | D8: =E8+F8 -> 2 | E8: 2 | F8: 0 | G8: -10 | H8: 234 | I8: 30133 | J8: 4241.25 | K8: 4389.333333333333 | L8: 706.875 | M8: 731.55555555555554

A1: KreisLiga 2 Herren | B1: Sonnstag 13.11.11 | C1: SK 54/59 Essen-Borbeck 2 | D1: / | E1: BW 61 Mülheim 4 | F1: 0 : 3 ( 16 : 20 ) 2257 : 2761
A2: 8. Spieltag
A3: Mannschaftstabelle nach dem 8. Spieltag

A1: Platz | B1: Mannschaft | C1: Spiele | D1: Punkte | E1: Heim | F1: Ausw. | G1: +/- | H1: EWP | I1: Holz | J1: Ø Heim | K1: Ø ausw. | L1: Ø Heim | M1: Ø ausw.
A2: 1 | B2: BW 61 Mülheim 2 | C2: 8 | D2: =E2+F2 -> 18 | E2: 9 | F2: 9 | G2: 6 | H2: 352 | I2: 37480 | J2: 4824.25 | K2: 4545.75 | L2: 804.04166666666663 | M2: 757.625
A3: 2 | B3: SK Kamp-Lintfort 3 | C3: 8 | D3: =E3+F3 -> 16 | E3: 14 | F3: 2 | G3: 1 | H3: 357 | I3: 38594 | J3: 5038 | K3: 4468 | L3: 839.66666666666663 | M3: 744.66666666666663
A4: 3 | B4: SK Heilingenhaus 3 | C4: 8 | D4: =E4+F4 -> 15 | E4: 11 | F4: 4 | G4: 3 | H4: 327 | I4: 36495 | J4: 4678 | K4: 4445.75 | L4: 779.66666666666663 | M4: 740.95833333333337
A5: 4 | B5: SK Dinslaken 2 | C5: 8 | D5: =E5+F5 -> 13 | E5: 9 | F5: 4 | G5: 1 | H5: 313 | I5: 36333 | J5: 4671 | K5: 4412.25 | L5: 778.5 | M5: 735.375
A6: 5 | B6: KSC Harmonie Duisburg | C6: 7 | D6: =E6+F6 -> 10 | E6: 6 | F6: 4 | G6: 1 | H6: 284 | I6: 32290 | J6: 4635.666666666667 | K6: 4595.75 | L6: 772.6111111111112 | M6: 765.95833333333337
A7: 6 | B7: SKC Kapellen | C7: 7 | D7: =E7+F7 -> 7 | E7: 5 | F7: 2 | G7: -5 | H7: 245 | I7: 29595 | J7: 4189.75 | K7: 4278.666666666667 | L7: 698.29166666666663 | M7: 713.1111111111112
A8: 7 | B8: SK Düsseldorf 3 | C8: 6 | D8: =E8+F8 -> 7 | E8: 4 | F8: 3 | G8: 1 | H8: 213 | I8: 27718 | J8: 4807.5 | K8: 4525.75 | L8: 801.25 | M8: 754.29166666666663
A9: 8 | B9: SK 54/50 Essen-Borbeck | C9: 8 | D9: =E9+F9 -> 4 | E9: 2 | F9: 2 | G9: -8 | H9: 250 | I9: 35840 | J9: 4453.5 | K9: 4506.5 | L9: 742.25 | M9: 751.08333333333337

A1: weibl. Jugend U18 | B1: Samstag 26.11.11 | C1: Korschenbroich | E1: Hallensportzentrum
A2: 3. Tuniertag

A1: Pl. | B1: Name | C1: Verein | D1: Holz | E1: Pkt.
A2: 1 | B2: Henkel, Isabel | C2: Mülheim | D2: 2951 | E2: 200
A3: 2 | B3: Ziemke, Sarah | C3: Remscheid | D3: 2687 | E3: 189
A4: 3 | B4: Schmelter, Sonja | C4: Wuppertal | D4: 2619 | E4: 188
A5: 4 | B5: Jasper, Maren | C5: Heiligenhaus | D5: 2684 | E5: 185
A6: 5 | B6: Kolba, Sabrina | C6: Kamp-Lintfort | D6: 2677 | E6: 185
A7: 6 | B7: Sowinski, Fabienne | C7: Remscheid | D7: 2620 | E7: 182
A8: 7 | B8: Tenckhoff, Lisa | C8: Düsseldorf | D8: 2013 | E8: 166
A9: 8 | B9: Erwied, Kerstin | C9: Mülheim | D9: 1777 | E9: 164
A10: 9 | B10: Ifland, Corinna | C10: Düsseldorf | D10: 1795 | E10: 129
A11: 10 | B11: Ifland, Simone | C11: Düsseldorf | D11: 1758 | E11: 128
A12: 11 | B12: Richter, Jennifer | C12: Heiligenhaus | D12: 1320 | E12: 94
A13: 12 | B13: Glas, Nina | C13: Korschenbroich | D13: 631 | E13: 46
A14: 13 | B14: Gluch, Sabrina | C14: Essen | D14: 336 | E14: 40
A15: 14

A1: männl. Jugend U18 | B1: Samstag 26.11.11 | C1: Korschenbroich | E1: Hallensportzentrum
A2: 3. Tuniertag

A1: Pl. | B1: Name | C1: Verein | D1: Holz | E1: Pkt.
A2: 1 | B2: Schwarzkopf, Tobias | C2: Korschenbroich | D2: 2984 | E2: 191
A3: 2 | B3: Panneck, Marcel | C3: Mülheim | D3: 2926 | E3: 188
A4: 3 | B4: Eichenhofer, Nils | C4: Kamp-Lintfort | D4: 2901 | E4: 182
A5: 4 | B5: Dziura, Torben | C5: Mülheim | D5: 2858 | E5: 181
A6: 5 | B6: Mratschkowski, Julian | C6: Kamp-Lintfort | D6: 2857 | E6: 179
A7: 6 | B7: Mitscha, Tobias | C7: Heiligenhaus | D7: 2793 | E7: 175
A8: 7 | B8: Rippel, Lukas | C8: Rees | D8: 2810 | E8: 173
A9: 8 | B9: Bolz, Alexander | C9: Wuppertal | D9: 2793 | E9: 172
A10: 9 | B10: Fedkenhauer, Christoph | C10: Heiligenhaus | D10: 2737 | E10: 166
A11: 10 | B11: Keßmeier, Jonas | C11: Heiligenhaus | D11: 2683 | E11: 159
A12: 11 | B12: Hülsken, André | C12: Rees | D12: 2644 | E12: 152
A13: 12 | B13: Hensing, Jan | C13: Essen | D13: 2618 | E13: 151
A14: 13 | B14: Holler, Robin | C14: Heiligenhaus | D14: 2337 | E14: 150
A15: 14 | B15: van Lier, Tobias | C15: Rees | D15: 2571 | E15: 144
A16: 15 | B16: Hochstein, Steven | C16: Kamp-Lintfort | D16: 2444 | E16: 140
A17: 16 | B17: Flore, Marius | C17: Heiligenhaus | D17: 2449 | E17: 139
A18: 17 | B18: Jaschinski, Nils | C18: Heiligenhaus | D18: 2471 | E18: 138
A19: 18 | B19: Dappen, Hendrik | C19: Korschenbroich | D19: 2489 | E19: 138
A20: 19 | B20: Markett, Sean | C20: Rees | D20: 2140 | E20: 130
A21: 20 | B21: Vavro, Mathias | C21: Heiligenhaus | D21: 1250 | E21: 71
A22: 21 | B22: Opitz, Florian | C22: Heiligenhaus | D22: 486 | E22: 31

A1: männl. Jugend U14 | B1: Samstag 15.10.11 | C1: Korschenbroich | E1: Hallensportzentrum
A2: 3. Tuniertag

A1: Name | B1: Verein | C1: Holz | D1: Punkte
A2: Coenen, Leon | B2: VNK | C2: 586 | D2: 50
A3: Panneck, Marvin | B3: VNK | C3: 559 | D3: 49
A4: Dahlmann, Christoph | B4: Wesel | C4: 536 | D4: 48
A5: Pütz, René | B5: Heiligenhaus | C5: 509 | D5: 47
A6: Holzum, Niklas | B6: Rees | C6: 488 | D6: 46
A7: Holzum, Yannik | B7: Rees | C7: 484 | D7: 45
A8: Jaschinksi, Timo | B8: Heiligenhaus | C8: 468 | D8: 44
A9: Ibeyi, Semih | B9: Heiligenhaus | C9: 456 | D9: 43
A10: Rathnow, Leon | B10: Heiligenhaus | C10: 448 | D10: 42
A11: Eichler, Thilo | B11: Heiligenhaus | C11: 439 | D11: 41
A12: Hesse, Jack | B12: Heiligenhaus | C12: 433 | D12: 40
A13: Maas, Steffen | B13: Rees | C13: 404 | D13: 39
A14: van Merwyk, Torsten | B14: Rees | C14: 397 | D14: 38
A15: Sarialtin, Dogan | B15: Heiligenhaus | C15: 386 | D15: 37
A16: Malze, Justin | B16: Rees | C16: 377 | D16: 36
A17: Knüfer, Jonas | B17: Rees | C17: 373 | D17: 35
A18: Heidenreich, Leon | B18: Heiligenhaus | C18: 368 | D18: 34
A19: Schlaghecken, Niclas | B19: Rees | C19: 348 | D19: 33
A20: Kehnen, Robert | B20: Korschenbroich | C20: 271 | D20: 32
A21: Brockmann, Rudi | B21: Rees | C21: 265 | D21: 31
A22: Hülser, Nick | B22: Korschenbroich | C22: 249 | D22: 30
A23: Maas, Hendrik | B23: Rees | C23: 0 | D23: 0
A24: Nienhuysen, Max | B24: Rees | C24: 0 | D24: 0
A25: Opitz, Florian | B25: Heiligenhaus | C25: 0 | D25: 0