A1: 1. Bundesliga Herren | B1: Sonnstag 23.10.11 | C1: KSF Chemie Holten-Duisburg 1 | D1: / | E1: BW 61 Mülheim 1 | F1: 3 : 0 ( 51 : 27 ) 5151 : 5059
A2: 8. Spieltag
A3: Mannschaftstabelle nach dem 8. Spieltag

A1: Platz | B1: Mannschaft | C1: Spiele | D1: Punkte | E1: Heim | F1: Ausw. | G1: +/- | H1: EWP | I1: Holz | J1: Ø Heim | K1: Ø ausw. | L1: Ø Heim | M1: Ø ausw.
A2: 1 | B2: SK Heilingenhaus | C2: 8 | D2: =E2+F2 -> 17 | E2: 13 | F2: 4 | G2: 2 | H2: 344 | I2: 41736 | J2: 5270.6 | K2: 5127.666666666667 | L2: 878.43333333333339 | M2: 854.6111111111112
A3: 2 | B3: KSV Riol | C3: 8 | D3: =E3+F3 -> 17 | E3: 6 | F3: 11 | G3: 11 | H3: 312 | I3: 41446 | J3: 5232.5 | K3: 5163.5 | L3: 872.08333333333337 | M3: 860.58333333333337
A4: 3 | B4: Ninepin 09 Isalohn | C4: 8 | D4: =E4+F4 -> 15 | E4: 11 | F4: 4 | G4: 3 | H4: 311 | I4: 41094 | J4: 5145 | K4: 5128.5 | L4: 857.5 | M4: 854.75
A5: 4 | B5: SK Münstermaifeld | C5: 8 | D5: =E5+F5 -> 14 | E5: 13 | F5: 1 | G5: -4 | H5: 351 | I5: 41117 | J5: 5211.166666666667 | K5: 4925 | L5: 868.52777777777783 | M5: 820.83333333333337
A6: 5 | B6: SKG 67 Paffrath | C6: 8 | D6: =E6+F6 -> 14 | E6: 14 | F6: 0 | G6: -1 | H6: 339 | I6: 41541 | J6: 5342.6 | K6: 4942.666666666667 | L6: 890.43333333333339 | M6: 823.77777777777783
A7: 6 | B7: KF Obertal | C7: 8 | D7: =E7+F7 -> 13 | E7: 9 | F7: 4 | G7: 4 | H7: 335 | I7: 42698 | J7: 5707 | K7: 5115.4 | L7: 951.16666666666663 | M7: 852.56666666666661
A8: 7 | B8: KSF Chemie Holten-Duisburg | C8: 8 | D8: =E8+F8 -> 12 | E8: 11 | F8: 1 | G8: -3 | H8: 335 | I8: 40710 | J8: 5121.4 | K8: 5034.333333333333 | L8: 853.56666666666661 | M8: 839.05555555555554
A9: 8 | B9: KSG Tecklenburger Land | C9: 8 | D9: =E9+F9 -> 8 | E9: 7 | F9: 1 | G9: -1 | H9: 268 | I9: 39856 | J9: 5220.666666666667 | K9: 4838.8 | L9: 870.1111111111112 | M9: 806.4666666666667
A10: 9 | B10: BW 61 Mülheim | C10: 8 | D10: =E10+F10 -> 6 | E10: 5 | F10: 1 | G10: -3 | H10: 261 | I10: 39917 | J10: 5078 | K10: 4936.6 | L10: 846.33333333333337 | M10: 822.76666666666677
A11: 10 | B11: KSG BG 99 Neuhof | C11: 8 | D11: =E11+F11 -> 4 | E11: 4 | F11: 0 | G11: -8 | H11: 240 | I11: 39766 | J11: 5153.5 | K11: 4788 | L11: 858.91666666666663 | M11: 798

A1: Niederrhein-Liga Damen | B1: Sonnstag 23.10.11 | C1: RW 59 Mülheim 1 | D1: / | E1: DSKC Heiligenhaus | F1: 0 : 0 ( 0 : 0 ) 0 : 0
A2: 4. Spieltag
A3: 4. Spiel wurde abgebrochen und wird am 4.11. wiederholt Mannschaftstabelle nach dem 3. Spieltag

A1: Platz | B1: Mannschaft | C1: Spiele | D1: Punkte | E1: Heim | F1: Ausw. | G1: +/- | H1: EWP | I1: Holz | J1: Ø Heim | K1: Ø ausw. | L1: Ø Heim E | M1: Ø ausw. E
A2: 1 | B2: SKV Rees | C2: 3 | D2: 7 | E2: 3 | F2: 4 | G2: 4 | H2: 130 | I2: 13321 | J2: 4473,0 | K2: 4424,0 | L2: 745,5 | M2: 737,3
A3: 2 | B3: RW 59 Mülheim | C3: 2 | D3: 5 | E3: 5 | F3: 0 | G3: -1 | H3: 98 | I3: 9377 | J3: 4688,5 | L3: 781,4
A4: 3 | B4: SK Kleve | C4: 2 | D4: 5 | E4: 2 | F4: 3 | G4: 2 | H4: 79 | I4: 8882 | J4: 4558,0 | K4: 4324,0 | L4: 759,7 | M4: 720,7
A5: 4 | B5: DSKC Heilingenhaus | C5: 2 | D5: 1 | E5: 0 | F5: 1 | G5: -2 | H5: 77 | I5: 8799 | J5: 4266,0 | K5: 4533,0 | L5: 711,0 | M5: 755,5
A6: 5 | B6: RSV Samo Remscheid 2 | C6: 3 | D6: 0 | E6: 0 | F6: 0 | G6: -3 | H6: 84 | I6: 11330 | J6: 4093,0 | K6: 3618,5 | L6: 682,2 | M6: 603,1

A1: BezirksLiga 1 Damen | B1: Sonnstag 23.10.11 | C1: FSKC Wesel | D1: / | E1: RW 59 Mülheim 2 | F1: 2 : 1 ( 32 : 46 ) 3921 : 3915
A2: 5. Spieltag
A3: Mannschaftstabelle nach dem 5. Spieltag

A1: Platz | B1: Mannschaft | C1: Spiele | D1: Punkte | E1: Heim | F1: Ausw. | G1: +/- | H1: EWP | I1: Holz | J1: Ø Heim | K1: Ø ausw. | L1: Ø Heim | M1: Ø ausw.
A2: 1 | B2: FSKC Wesel | C2: 5 | D2: =E2+F2 -> 11 | E2: 4 | F2: 7 | G2: 5 | H2: 197 | I2: 19852 | J2: 3862.5 | K2: 4042.3333333333335 | L2: 643.75 | M2: 673.72222222222229
A3: 2 | B3: ESV BW Rhgd. Düsseldorf | C3: 4 | D3: =E3+F3 -> 11 | E3: 8 | F3: 3 | G3: 2 | H3: 182 | I3: 16610 | J3: 4189.666666666667 | K3: 4041 | L3: 698.27777777777783 | M3: 673.5
A4: 3 | B4: RW 59 Mülheim 2 | C4: 5 | D4: =E4+F4 -> 7 | E4: 5 | F4: 2 | G4: 1 | H4: 206 | I4: 18533 | J4: 3956.5 | K4: 3540 | L4: 659.41666666666663 | M4: 590
A5: 4 | B5: Montan 66 Duisburg | C5: 4 | D5: =E5+F5 -> 6 | E5: 5 | F5: 1 | G5: -3 | H5: 167 | I5: 15529 | J5: 3944.3333333333335 | K5: 3696 | L5: 657.38888888888891 | M5: 616
A6: 5 | B6: Düsseldorf 2010 | C6: 4 | D6: =E6+F6 -> 6 | E6: 4 | F6: 2 | G6: 0 | H6: 151 | I6: 16012 | J6: 3978 | K6: 4028 | L6: 663 | M6: 671.33333333333337
A7: 7 | B7: SK Kamp-Lintfort 2 | C7: 4 | D7: =E7+F7 -> 2 | E7: 0 | F7: 2 | G7: -1 | H7: 133 | I7: 13670 | J7: 3844 | K7: 3275.3333333333335 | L7: 640.66666666666663 | M7: 545.88888888888891
A8: 6 | B8: SK 54/50 Essen-Borbeck | C8: 4 | D8: =E8+F8 -> 2 | E8: 2 | F8: 0 | G8: -4 | H8: 130 | I8: 13337 | J8: 3558.5 | K8: 3110 | L8: 593.08333333333337 | M8: 518.33333333333337

A1: BezirksLiga 1 Herren | B1: Sonnstag 23.10.11 | C1: SK Heilingenhaus 3 | D1: / | E1: BW 61 Mülheim 2 | F1: 3:0 ( 48 : 30 ) 4688 : 4387
A2: 5. Spieltag
A3: Mannschaftstabelle nach dem 5. Spieltag

A1: Pl. | B1: Mannschaft | C1: S. | D1: P. | E1: H. | F1: A. | G1: +\- | H1: EWP | I1: Holz | J1: Ø H. | K1: Ø A.
A2: 1 | B2: SK Heiligenhaus 3 | C2: 5 | D2: 11 | E2: 8 | F2: 3 | G2: 2 | H2: 219 | I2: 23008 | J2: 781 | K2: 746
A3: 2 | B3: BW 61 Mülheim 2 | C3: 5 | D3: 10 | E3: 7 | F3: 3 | G3: 1 | H3: 211 | I3: 23477 | J3: 805 | K3: 749
A4: 3 | B4: SK Kamp-Lintfort 3 | C4: 5 | D4: 9 | E4: 8 | F4: 1 | G4: 0 | H4: 215 | I4: 23791 | J4: 843 | K4: 719
A5: 4 | B5: SK Dinslaken 2 | C5: 5 | D5: 8 | E5: 7 | F5: 1 | G5: -1 | H5: 196 | I5: 22307 | J5: 778 | K5: 692
A6: 5 | B6: SK Düsseldorf 3 | C6: 5 | D6: 7 | E6: 4 | F6: 3 | G6: 1 | H6: 188 | I6: 23528 | J6: 801 | K6: 773
A7: 6 | B7: SKC Kapellen 1 | C7: 5 | D7: 7 | E7: 5 | F7: 2 | G7: 1 | H7: 188 | I7: 21275 | J7: 703 | K7: 713
A8: 7 | B8: KSC Harmonie Duisburg 1 | C8: 5 | D8: 4 | E8: 3 | F8: 1 | G8: -2 | H8: 186 | I8: 23493 | J8: 776 | K8: 788
A9: 8 | B9: SK 54/59 Essen-Borbeck 1 | C9: 5 | D9: 4 | E9: 2 | F9: 2 | G9: -2 | H9: 157 | I9: 22550 | J9: 743 | K9: 758

A1: BezirksKlasse 1 Herren | B1: Sonnstag 23.10.11 | C1: KSC 71 Saarn | D1: / | E1: KSC Harmonie 64 Walsum | F1: 0 : 3 ( 35 : 43 ) 4477 : 4607
A2: 5. Spieltag
A3: Mannschaftstabelle nach dem 5. Spieltag

A1: Platz | B1: Mannschaft | C1: Spiele | D1: Punkte | E1: Heim | F1: Ausw. | G1: +/- | H1: EWP | I1: Holz | J1: Ø Heim | K1: Ø ausw. | L1: Ø Heim | M1: Ø ausw.
A2: 1 | B2: KSC Hrmonie 64 Walsum | C2: 5 | D2: =E2+F2 -> 12 | E2: 5 | F2: 7 | G2: 6 | H2: 208 | I2: 22351 | J2: 4512 | K2: 4442.333333333333 | L2: 752 | M2: 740.3888888888888
A3: 2 | B3: SK Kleve | C3: 5 | D3: =E3+F3 -> 10 | E3: 3 | F3: 7 | G3: 4 | H3: 220 | I3: 22373 | J3: 4516 | K3: 4447 | L3: 752.66666666666663 | M3: 741.16666666666663
A4: 3 | B4: KSF 32 Duisburg | C4: 5 | D4: =E4+F4 -> 10 | E4: 8 | F4: 2 | G4: 1 | H4: 218 | I4: 21473 | J4: 4366 | K4: 4187.5 | L4: 727.66666666666663 | M4: 697.91666666666663
A5: 4 | B5: SKV Rees 2 | C5: 5 | D5: =E5+F5 -> 9 | E5: 8 | F5: 1 | G5: 0 | H5: 211 | I5: 22172 | J5: 4516 | K5: 4312 | L5: 752.66666666666663 | M5: 718.66666666666663
A6: 5 | B6: ESV Oberhausen | C6: 5 | D6: =E6+F6 -> 8 | E6: 5 | F6: 3 | G6: 2 | H6: 203 | I6: 21641 | J6: 4244 | K6: 4384.333333333333 | L6: 707.33333333333337 | M6: 730.72222222222217
A7: 6 | B7: KSC 71 Saarn | C7: 5 | D7: =E7+F7 -> 8 | E7: 2 | F7: 6 | G7: 2 | H7: 197 | I7: 21948 | J7: 4404 | K7: 4380 | L7: 734 | M7: 730
A8: 7 | B8: SK Kamp-Lintfort 5 | C8: 5 | D8: =E8+F8 -> 2 | E8: 2 | F8: 0 | G8: -7 | H8: 157 | I8: 20633 | J8: 4252.333333333333 | K8: 3938 | L8: 708.72222222222217 | M8: 656.33333333333337
A9: 8 | B9: Sk Dinslaken 4 | C9: 5 | D9: =E9+F9 -> 1 | E9: 0 | F9: 1 | G9: -8 | H9: 165 | I9: 20545 | J9: 4088.3333333333335 | K9: 4140 | L9: 681.38888888888891 | M9: 690

A1: BezirksKlasse 2 Herren | B1: Sonnstag 23.10.11 | C1: BW 61 Mülheim 3 | D1: / | E1: BFG Wesel 2 | F1: 3 : 0 ( 53 : 25 ) 4399 : 3781
A2: 5 Spieltag
A3: Mannschaftstabelle nach dem 5. Spieltag

A1: Platz | B1: Mannschaft | C1: Spiele | D1: Punkte | E1: Heim | F1: Ausw. | G1: +/- | H1: EWP | I1: Holz | J1: Ø Heim | K1: Ø ausw. | L1: Ø Heim | M1: Ø ausw.
A2: 1 | B2: Sk Kamp-Lintfort 4 | C2: 4 | D2: =E2+F2 -> 12 | E2: 6 | F2: 6 | G2: 6 | H2: 192 | I2: 18667 | J2: 4826 | K2: 4507.5 | L2: 804.33333333333337 | M2: 751.25
A3: 2 | B3: Sk Dinslaken 3 | C3: 5 | D3: =E3+F3 -> 9 | E3: 5 | F3: 4 | G3: 0 | H3: 214 | I3: 22920 | J3: 4823.666666666667 | K3: 4224.5 | L3: 803.94444444444446 | M3: 704.08333333333337
A4: 3 | B4: BFG 1920 Wesel 2 | C4: 4 | D4: =E4+F4 -> 8 | E4: 7 | F4: 1 | G4: 1 | H4: 179 | I4: 17451 | J4: 4490 | K4: 4235.5 | L4: 748.33333333333337 | M4: 705.91666666666663
A5: 4 | B5: BW 61 Mülheim 3 | C5: 4 | D5: =E5+F5 -> 6 | E5: 5 | F5: 1 | G5: 0 | H5: 151 | I5: 17389 | J5: 4367.5 | K5: 4327 | L5: 727.91666666666663 | M5: 721.16666666666663
A6: 5 | B6: SKG 31 Essen | C6: 5 | D6: =E6+F6 -> 5 | E6: 2 | F6: 3 | G6: -4 | H6: 179 | I6: 21500 | J6: 4389.333333333333 | K6: 4166 | L6: 731.55555555555554 | M6: 694.33333333333337
A7: 6 | B7: SK 66/99 Solingen 2 | C7: 4 | D7: =E7+F7 -> 3 | E7: 2 | F7: 1 | G7: 0 | H7: 125 | I7: 16799 | J7: 4440 | K7: 4119.666666666667 | L7: 740 | M7: 686.6111111111112
A8: 7 | B8: KSC Harmonie Duisburg 2 | C8: 4 | D8: =E8+F8 -> 2 | E8: 2 | F8: 0 | G8: -4 | H8: 130 | I8: 17294 | J8: 4221.5 | K8: 4425.5 | L8: 703.58333333333337 | M8: 737.58333333333337

A1: KreisLiga 2 Herren | B1: Sonnstag 23.10.11 | C1: ESV Oberhausen 2 | D1: / | E1: BW 61 Mülheim 4 | F1: 0 : 3 ( 14 : 22 ) 2515 : 2569
A2: 5. Spieltag
A3: Mannschaftstabelle nach dem 5. Spieltag

A1: Platz | B1: Mannschaft | C1: Spiele | D1: Punkte | E1: Heim | F1: Ausw. | G1: +/- | H1: EWP | I1: Holz | J1: Ø Heim | K1: Ø ausw. | L1: Ø Heim | M1: Ø ausw.
A2: 1 | B2: SK Kamp-Lintfort 6 | C2: 5 | D2: =E2+F2 -> 12 | E2: 8 | F2: 4 | G2: 3 | H2: 109 | I2: 14166 | J2: 2871 | K2: 2776.5 | L2: 478.5 | M2: 462.75
A3: 2 | B3: BW 61 Mülheim 4 | C3: 5 | D3: =E3+F3 -> 12 | E3: 6 | F3: 6 | G3: 3 | H3: 97 | I3: 13257 | J3: 2698.6666666666665 | K3: 2580.5 | L3: 449.77777777777777 | M3: 430.08333333333331
A4: 3 | B4: Sk 54/59 Essen-Borbeck 2 | C4: 5 | D4: =E4+F4 -> 10 | E4: 3 | F4: 7 | G4: 4 | H4: 98 | I4: 13700 | J4: 2676 | K4: 2782.6666666666665 | L4: 446 | M4: 463.77777777777777
A5: 4 | B5: SKC Kapellen 2 | C5: 5 | D5: =E5+F5 -> 8 | E5: 4 | F5: 4 | G5: 1 | H5: 78 | I5: 12736 | J5: 2566.5 | K5: 2534.3333333333335 | L5: 427.75 | M5: 422.38888888888891
A6: 5 | B6: SKC Vesalia Wesel 1 | C6: 5 | D6: =E6+F6 -> 7 | E6: 2 | F6: 5 | G6: 1 | H6: 86 | I6: 12741 | J6: 2600 | K6: 2513.6666666666665 | L6: 433.33333333333331 | M6: 418.9444444444444
A7: 6 | B7: SKV Rees 4 | C7: 5 | D7: =E7+F7 -> 5 | E7: 2 | F7: 3 | G7: -2 | H7: 85 | I7: 13236 | J7: 2652.5 | K7: 2643.6666666666665 | L7: 442.08333333333331 | M7: 440.61111111111109
A8: 7 | B8: ESV Oberhausen 2 | C8: 5 | D8: =E8+F8 -> 5 | E8: 5 | F8: 0 | G8: -4 | H8: 79 | I8: 12190 | J8: 2467.6666666666665 | K8: 2393.5 | L8: 411.27777777777777 | M8: 398.91666666666669
A9: 8 | B9: SK Kleve 3 | C9: 5 | D9: =E9+F9 -> 3 | E9: 2 | F9: 1 | G9: -6 | H9: 75 | I9: 12381 | J9: 2608 | K9: 2278.5 | L9: 434.66666666666669 | M9: 379.75

A1: weibl. Jugend U18 | B1: Samstag 22.10.11 | C1: Korschenbroich | E1: Hallensportzentrum
A2: 3. Tuniertag

A1: Name | B1: Verein | C1: Holz | D1: Punkte
A2: Henkel, Isabel | B2: Mülheim | C2: 696 | D2: 50
A3: Schmelter, Sonja | B3: Wuppertal | C3: 657 | D3: 49
A4: Richter, Jennifer | B4: Heiligenhaus | C4: 647 | D4: 48
A5: Ziemke, Sarah | B5: Remscheid | C5: 634 | D5: 47
A6: Glas, Nina | B6: Korschenbroich | C6: 631 | D6: 46
A7: Kolba, Sabrina | B7: Kamp-Lintfort | C7: 625 | D7: 45
A8: Sowinski, Fabienne | B8: Remscheid | C8: 613 | D8: 44
A9: Ifland, Simone | B9: Düsseldorf | C9: 606 | D9: 43
A10: Jasper, Maren | B10: Heiligenhaus | C10: 588 | D10: 42
A11: Ifland, Corinna | B11: Düsseldorf | C11: 524 | D11: 41
A12: Tenckhoff, Lisa | B12: Düsseldorf | C12: 454 | D12: 40
A13: Erwied, Kerstin | B13: Mülheim | C13: 357 | D13: 39
A14: Gluch, Sabrina | B14: Essen | C14: 0 | D14: 0
A15: Geldmacher, Ronja | B15: Remscheid | C15: 0 | D15: 0
A16: Schöpp, Juliane | C16: 0 | D16: 0

A1: männl. Jugend U18 | B1: Samstag 22.10.11 | C1: Korschenbroich | E1: Hallensportzentrum
A2: 3. Tuniertag

A1: Name | B1: Verein | C1: Holz | D1: Punkte
A2: Holler, Robin | B2: Heiligenhaus | C2: 741 | D2: 50
A3: Eichenhofer, Nils | B3: Kamp-Lintfort | C3: 727 | D3: 49
A4: Panneck, Marcel | B4: Mülheim | C4: 722 | D4: 48
A5: Schwarzkopf, Tobias | B5: Korschenbroich | C5: 714 | D5: 47
A6: Fedkenhauer, Christoph | B6: Heiligenhaus | C6: 709 | D6: 46
A7: Dziura, Torben | B7: Mülheim | C7: 702 | D7: 45
A8: Bolz, Alexander | B8: Wuppertal | C8: 699 | D8: 44
A9: Mitscha, Tobias | B9: Heiligenhaus | C9: 672 | D9: 43
A10: Keßmeier, Jonas | B10: Heiligenhaus | C10: 672 | D10: 43
A11: Mratschkowski, Julian | B11: Kamp-Lintfort | C11: 667 | D11: 41
A12: Rippel, Lukas | B12: Rees | C12: 665 | D12: 40
A13: Hülsken, André | B13: Rees | C13: 660 | D13: 39
A14: Jaschinski, Nils | B14: Heiligenhaus | C14: 651 | D14: 38
A15: Flore, Marius | B15: Heiligenhaus | C15: 644 | D15: 37
A16: van Lier, Tobias | B16: Rees | C16: 640 | D16: 36
A17: Vavro, Mathias | B17: Heiligenhaus | C17: 609 | D17: 35
A18: Dappen, Hendrik | B18: Korschenbroich | C18: 580 | D18: 34
A19: Hochstein, Steven | B19: Kamp-Lintfort | C19: 577 | D19: 33
A20: Hensing, Jan | B20: Essen | C20: 561 | D20: 32
A21: Opitz, Florian | B21: Heiligenhaus | C21: 0 | D21: 0
A22: Bansmann, Robert | B22: Essen | C22: 0 | D22: 0
A23: Markett, Sean | B23: Rees | C23: 0 | D23: 0

A1: männl. Jugend U14 | B1: Samstag 15.10.11 | C1: Korschenbroich | E1: Hallensportzentrum
A2: 3. Tuniertag

A1: Name | B1: Verein | C1: Holz | D1: Punkte
A2: Coenen, Leon | B2: VNK | C2: 586 | D2: 50
A3: Panneck, Marvin | B3: VNK | C3: 559 | D3: 49
A4: Dahlmann, Christoph | B4: Wesel | C4: 536 | D4: 48
A5: Pütz, René | B5: Heiligenhaus | C5: 509 | D5: 47
A6: Holzum, Niklas | B6: Rees | C6: 488 | D6: 46
A7: Holzum, Yannik | B7: Rees | C7: 484 | D7: 45
A8: Jaschinksi, Timo | B8: Heiligenhaus | C8: 468 | D8: 44
A9: Ibeyi, Semih | B9: Heiligenhaus | C9: 456 | D9: 43
A10: Rathnow, Leon | B10: Heiligenhaus | C10: 448 | D10: 42
A11: Eichler, Thilo | B11: Heiligenhaus | C11: 439 | D11: 41
A12: Hesse, Jack | B12: Heiligenhaus | C12: 433 | D12: 40
A13: Maas, Steffen | B13: Rees | C13: 404 | D13: 39
A14: van Merwyk, Torsten | B14: Rees | C14: 397 | D14: 38
A15: Sarialtin, Dogan | B15: Heiligenhaus | C15: 386 | D15: 37
A16: Malze, Justin | B16: Rees | C16: 377 | D16: 36
A17: Knüfer, Jonas | B17: Rees | C17: 373 | D17: 35
A18: Heidenreich, Leon | B18: Heiligenhaus | C18: 368 | D18: 34
A19: Schlaghecken, Niclas | B19: Rees | C19: 348 | D19: 33
A20: Kehnen, Robert | B20: Korschenbroich | C20: 271 | D20: 32
A21: Brockmann, Rudi | B21: Rees | C21: 265 | D21: 31
A22: Hülser, Nick | B22: Korschenbroich | C22: 249 | D22: 30
A23: Maas, Hendrik | B23: Rees | C23: 0 | D23: 0
A24: Nienhuysen, Max | B24: Rees | C24: 0 | D24: 0
A25: Opitz, Florian | B25: Heiligenhaus | C25: 0 | D25: 0