A1: RW 59 Mülheim - 2. Mannschaft | B1: RW 59 Mülheim - 2. Mannschaft
A2: Saison 2011/2012 in der Bezirksliga 1 Mannschaftstabelle nach dem 7. Spieltag Spielerbestenlisten nach dem 7. Spieltag 7.Spieltag am 20.11.11 spielfrei 6 Spieltag am 06.11.11 5 Spieltag am 23.10.11 4 Spieltag am 16.10.11 12:00 3 Spieltag am 09.10.11 10:00 Uhr 2 Spieltag am 25.09.11 10:00 Uhr 1 Spieltag am 11.09.11 13:00 Uhr | B2: Spielplan und Ergebnisse Bezirksliga 1 2011/2012 Alle Spielberichte gibt es wie immer unter www.w-k-v.de Hinrunde Rückrunde

A1: Platz | B1: Mannschaft | C1: Spiele | D1: Punkte | E1: Heim | F1: Ausw. | G1: +/- | H1: EWP | I1: Holz | J1: Ø Heim | K1: Ø ausw. | L1: Ø Heim | M1: Ø ausw.
A2: 1 | B2: ESV BW Rhgd. Düsseldorf | C2: 6 | D2: =E2+F2 -> 17 | E2: 11 | F2: 6 | G2: 5 | H2: 276 | I2: 24739 | J2: 4174 | K2: 4021.5 | L2: 695.66666666666663 | M2: 670.25
A3: 2 | B3: Düsseldorf 2010 | C3: 5 | D3: =E3+F3 -> 11 | E3: 6 | F3: 5 | G3: 2 | H3: 238 | I3: 23807 | J3: 3966 | K3: 5954.5 | L3: 661 | M3: 992.41666666666663
A4: 3 | B4: FSKC Wesel | C4: 6 | D4: =E4+F4 -> 11 | E4: 4 | F4: 7 | G4: 2 | H4: 232 | I4: 23742 | J4: 3871.6666666666665 | K4: 4042.3333333333335 | L4: 645.27777777777771 | M4: 673.72222222222229
A5: 4 | B5: RW 59 Mülheim 2 | C5: 6 | D5: =E5+F5 -> 10 | E5: 5 | F5: 5 | G5: 4 | H5: 248 | I5: 22703 | J5: 3956.5 | K5: 3697.5 | L5: 659.41666666666663 | M5: 616.25
A6: 5 | B6: Montan 66 Duisburg | C6: 6 | D6: =E6+F6 -> 9 | E6: 7 | F6: 2 | G6: -3 | H6: 251 | I6: 23146 | J6: 3905.5 | K6: 3762 | L6: 650.91666666666663 | M6: 627
A7: 6 | B7: SK Kamp-Lintfort 2 | C7: 6 | D7: =E7+F7 -> 3 | E7: 0 | F7: 3 | G7: -3 | H7: 200 | I7: 21152 | J7: 3877.5 | K7: 3349.25 | L7: 646.25 | M7: 558.20833333333337
A8: 7 | B8: SK 54/50 Essen-Borbeck | C8: 5 | D8: =E8+F8 -> 2 | E8: 2 | F8: 0 | G8: -7 | H8: 187 | I8: 16801 | J8: 5133.5 | K8: 2178 | L8: 855.58333333333337 | M8: 363

A1: Pl. | B1: Spieler | C1: Mannschaft | D1: S. | E1: EWP | F1: Ø | G1: Holz | H1: Ø | I1: Ø H. | J1: Ø A. | K1: Max
A2: 1 | B2: Kolba, Simone | C2: SK Kamp-Lintfort 2 | D2: 6 | E2: 67 | F2: 11.2 | G2: 4457 | H2: 742.8 | I2: 766.5 | J2: 731.0 | K2: 778
A3: 2 | B3: Grote, Gisela | C3: ESV BW Rhgd. Düsseldorf | D3: 6 | E3: 66 | F3: 11.0 | G3: 4513 | H3: 752.2 | I3: 750.3 | J3: 756.0 | K3: 772
A4: 3 | B4: Hartwig, Vanessa | C4: Düsseldorf 2010 | D4: 6 | E4: 65 | F4: 10.8 | G4: 4324 | H4: 720.7 | I4: 712.3 | J4: 729.0 | K4: 742
A5: 4 | B5: Gereck, Magdalene | C5: ESV BW Rhgd. Düsseldorf | D5: 6 | E5: 63 | F5: 10.5 | G5: 4416 | H5: 736.0 | I5: 756.0 | J5: 696.0 | K5: 762
A6: 5 | B6: Schiffer, Christel | C6: SK 54/59 Essen-Borbeck | D6: 6 | E6: 62 | F6: 10.3 | G6: 4177 | H6: 696.2 | I6: 711.3 | J6: 681.0 | K6: 732
A7: 6 | B7: Moranvansky, Martina | C7: ESV BW Rhgd. Düsseldorf | D7: 6 | E7: 61 | F7: 10.2 | G7: 4326 | H7: 721.0 | I7: 712.0 | J7: 739.0 | K7: 768
A8: 7 | B8: Prenger, Monika | C8: RW 59 Mülheim 2 | D8: 6 | E8: 59 | F8: 9.8 | G8: 4200 | H8: 700.0 | I8: 723.5 | J8: 688.3 | K8: 736
A9: 8 | B9: Hentschel, Petra | C9: RW 59 Mülheim 2 | D9: 6 | E9: 56 | F9: 9.3 | G9: 4201 | H9: 700.2 | I9: 723.0 | J9: 688.8 | K9: 748
A10: 9 | B10: Rausch, Angelika | C10: Montan 66 Duisburg | D10: 6 | E10: 56 | F10: 9.3 | G10: 4051 | H10: 675.2 | I10: 677.3 | J10: 671.0 | K10: 709
A11: 10 | B11: Drenk, Anneliese | C11: Montan 66 Duisburg | D11: 6 | E11: 54 | F11: 9.0 | G11: 4000 | H11: 666.7 | I11: 664.3 | J11: 671.5 | K11: 713
A12: 11 | B12: Dorp, Jutta | C12: FSKC Wesel | D12: 6 | E12: 48 | F12: 8.0 | G12: 4085 | H12: 680.8 | I12: 680.0 | J12: 681.7 | K12: 738
A13: 12 | B13: Daniels, Sabine | C13: FSKC Wesel | D13: 6 | E13: 48 | F13: 8.0 | G13: 3995 | H13: 665.8 | I13: 656.3 | J13: 675.3 | K13: 708
A14: 13 | B14: Schoenbeck, Melanie | C14: Montan 66 Duisburg | D14: 4 | E14: 44 | F14: 11.0 | G14: 2890 | H14: 722.5 | I14: 708.7 | J14: 764.0 | K14: 764
A15: 14 | B15: König, Anita | C15: RW 59 Mülheim 2 | D15: 5 | E15: 44 | F15: 8.8 | G15: 3427 | H15: 685.4 | I15: 696.0 | J15: 678.3 | K15: 707
A16: 15 | B16: Gräber, Maria | C16: Düsseldorf 2010 | D16: 6 | E16: 44 | F16: 7.3 | G16: 3960 | H16: 660.0 | I16: 654.7 | J16: 665.3 | K16: 676
A17: 16 | B17: Schmidt, Marianne | C17: Montan 66 Duisburg | D17: 6 | E17: 43 | F17: 7.2 | G17: 3909 | H17: 651.5 | I17: 662.0 | J17: 630.5 | K17: 706
A18: 17 | B18: Zimmermann, Eva-Maria | C18: RW 59 Mülheim 2 | D18: 6 | E18: 42 | F18: 7.0 | G18: 4016 | H18: 669.3 | I18: 677.5 | J18: 665.3 | K18: 691
A19: 18 | B19: Ifland, Corinna | C19: Düsseldorf 2010 | D19: 6 | E19: 41 | F19: 6.8 | G19: 3942 | H19: 657.0 | I19: 662.3 | J19: 651.7 | K19: 691
A20: 19 | B20: Benner, Andrea | C20: SK 54/59 Essen-Borbeck | D20: 6 | E20: 40 | F20: 6.7 | G20: 3872 | H20: 645.3 | I20: 646.3 | J20: 644.3 | K20: 696
A21: 20 | B21: Sondermann, Sabine | C21: FSKC Wesel | D21: 6 | E21: 39 | F21: 6.5 | G21: 3927 | H21: 654.5 | I21: 632.7 | J21: 676.3 | K21: 742
A22: 21 | B22: Kolba, Sabrina | C22: SK Kamp-Lintfort 2 | D22: 6 | E22: 38 | F22: 6.3 | G22: 3977 | H22: 662.8 | I22: 660.5 | J22: 664.0 | K22: 717
A23: 22 | B23: Tetzlaff, Ines | C23: ESV BW Rhgd. Düsseldorf | D23: 6 | E23: 38 | F23: 6.3 | G23: 3967 | H23: 661.2 | I23: 680.3 | J23: 623.0 | K23: 703
A24: 23 | B24: Schunk, Brigitte | C24: Montan 66 Duisburg | D24: 6 | E24: 36 | F24: 6.0 | G24: 3739 | H24: 623.2 | I24: 639.8 | J24: 590.0 | K24: 644
A25: 24 | B25: Gräber, Michaela | C25: Düsseldorf 2010 | D25: 6 | E25: 35 | F25: 5.8 | G25: 3980 | H25: 663.3 | I25: 665.0 | J25: 661.7 | K25: 700
A26: 25 | B26: Zulj, Ingrid | C26: SK 54/59 Essen-Borbeck | D26: 6 | E26: 35 | F26: 5.8 | G26: 3645 | H26: 607.5 | I26: 638.7 | J26: 576.3 | K26: 663
A27: 26 | B27: van den Berg, Maria | C27: FSKC Wesel | D27: 6 | E27: 34 | F27: 5.7 | G27: 3826 | H27: 637.7 | I27: 645.7 | J27: 629.7 | K27: 673
A28: 27 | B28: Topolinski, Ingrid | C28: FSKC Wesel | D28: 5 | E28: 31 | F28: 6.2 | G28: 3221 | H28: 644.2 | I28: 637.0 | J28: 649.0 | K28: 662
A29: 28 | B29: Nacci, Elisabeth | C29: RW 59 Mülheim 2 | D29: 5 | E29: 29 | F29: 5.8 | G29: 3300 | H29: 660.0 | I29: 639.5 | J29: 673.7 | K29: 691
A30: 29 | B30: Gräber, Stefanie | C30: ESV BW Rhgd. Düsseldorf | D30: 6 | E30: 29 | F30: 4.8 | G30: 3915 | H30: 652.5 | I30: 673.3 | J30: 611.0 | K30: 711
A31: 30 | B31: Ebert, Angelika | C31: SK 54/59 Essen-Borbeck | D31: 6 | E31: 29 | F31: 4.8 | G31: 3667 | H31: 611.2 | I31: 619.0 | J31: 603.3 | K31: 642
A32: 31 | B32: Erwied, Inge | C32: FSKC Wesel | D32: 6 | E32: 28 | F32: 4.7 | G32: 3781 | H32: 630.2 | I32: 630.0 | J32: 630.3 | K32: 681
A33: 32 | B33: Ahlburg, Susanne | C33: SK Kamp-Lintfort 2 | D33: 3 | E33: 26 | F33: 8.7 | G33: 2085 | H33: 695.0 | J33: 695.0 | K33: 725
A34: 33 | B34: Ifland, Dagmar | C34: Düsseldorf 2010 | D34: 4 | E34: 26 | F34: 6.5 | G34: 2621 | H34: 655.3 | I34: 667.5 | J34: 643.0 | K34: 674
A35: 34 | B35: Heckhausen, Helga | C35: ESV BW Rhgd. Düsseldorf | D35: 6 | E35: 19 | F35: 3.2 | G35: 3602 | H35: 600.3 | I35: 602.3 | J35: 596.5 | K35: 632
A36: 35 | B36: Kaiser, Doris | C36: SK Kamp-Lintfort 2 | D36: 5 | E36: 18 | F36: 3.6 | G36: 2986 | H36: 597.2 | I36: 603.5 | J36: 593.0 | K36: 621
A37: 36 | B37: Stahl, Katrin | C37: Montan 66 Duisburg | D37: 5 | E37: 15 | F37: 3.0 | G37: 2954 | H37: 590.8 | I37: 594.8 | J37: 575.0 | K37: 638
A38: 37 | B38: Keilig-Bruns, Petra | C38: SK 54/59 Essen-Borbeck | D38: 5 | E38: 14 | F38: 2.8 | G38: 2823 | H38: 564.6 | I38: 574.0 | J38: 550.5 | K38: 585
A39: 38 | B39: Becker, Sieglinde | C39: RW 59 Mülheim 2 | D39: 4 | E39: 13 | F39: 3.3 | G39: 2531 | H39: 632.8 | I39: 653.0 | J39: 626.0 | K39: 653
A40: 39 | B40: Mangold-Hänsel, Renate | C40: SK Kamp-Lintfort 2 | D40: 1 | E40: 12 | F40: 12.0 | G40: 834 | H40: 834.0 | I40: 834.0 | K40: 834
A41: 40 | B41: Kreisel, Nicole | C41: SK Kamp-Lintfort 2 | D41: 1 | E41: 12 | F41: 12.0 | G41: 821 | H41: 821.0 | I41: 821.0 | K41: 821
A42: 41 | B42: Riddermann, Marita | C42: SK Kamp-Lintfort 2 | D42: 5 | E42: 12 | F42: 2.4 | G42: 2578 | H42: 515.6 | I42: 519.5 | J42: 513.0 | K42: 554
A43: 42 | B43: Lehmberg, Mara | C43: Düsseldorf 2010 | D43: 2 | E43: 11 | F43: 5.5 | G43: 1327 | H43: 663.5 | I43: 647.0 | J43: 680.0 | K43: 680
A44: 43 | B44: Coenen, Ute | C44: Düsseldorf 2010 | D44: 3 | E44: 10 | F44: 3.3 | G44: 1904 | H44: 634.7 | I44: 632.0 | J44: 636.0 | K44: 645
A45: 44 | B45: Kirchgesser, Ulla | C45: SK Kamp-Lintfort 2 | D45: 6 | E45: 10 | F45: 1.7 | G45: 2804 | H45: 467.3 | I45: 500.0 | J45: 451.0 | K45: 520
A46: 45 | B46: Gluch, Sabrina | C46: SK 54/59 Essen-Borbeck | D46: 4 | E46: 7 | F46: 1.8 | G46: 1417 | H46: 354.3 | I46: 349.5 | J46: 359.0 | K46: 384
A47: 46 | B47: Hübel, Anja | C47: SK Kamp-Lintfort 2 | D47: 1 | E47: 5 | F47: 5.0 | G47: 610 | H47: 610.0 | J47: 610.0 | K47: 610
A48: 47 | B48: Zimmermann, Stella | C48: RW 59 Mülheim 2 | D48: 3 | E48: 5 | F48: 1.7 | G48: 1028 | H48: 342.7 | I48: 341.0 | J48: 343.5 | K48: 360
A49: 48 | B49: Overkämping, Marianne | C49: FSKC Wesel | D49: 1 | E49: 4 | F49: 4.0 | G49: 607 | H49: 607.0 | I49: 607.0 | K49: 607
A50: 49 | B50: Ifland, Simone | C50: Düsseldorf 2010 | D50: 1 | E50: 3 | F50: 3.0 | G50: 606 | H50: 606.0 | I50: 606.0 | K50: 606
A51: 50 | B51: Vilaso-Remis, Maria | C51: Düsseldorf 2010 | D51: 2 | E51: 3 | F51: 1.5 | G51: 1143 | H51: 571.5 | I51: 595.0 | J51: 548.0 | K51: 595
A52: 51 | B52: Syfus, Helga | C52: Montan 66 Duisburg | D52: 3 | E52: 3 | F52: 1.0 | G52: 1603 | H52: 534.3 | I52: 544.0 | J52: 529.5 | K52: 544

A1: SK Kamp-Lintfort 2 | D1: RW 59 Mülheim 2
A2: Kolba, Simone | B2: 755 | C2: 11 | D2: Becker, Sieglinde | E2: 631 | F2: 4
A3: Mangold-Hänsel, Renate | B3: 834 | C3: 12 | D3: Hentschel, Petra | E3: 736 | F3: 10
A4: Kolba, Sabrina | B4: 692 | C4: 7 | D4: König, Anita | E4: 707 | F4: 8
A5: Kaiser, Doris | B5: 596 | C5: 3 | D5: Nacci, Elisabeth | E5: 691 | F5: 6
A6: Kirhmesser, Ulla | B6: 480 | C6: 1 | D6: Prenger, Monika | E6: 714 | F6: 9
A7: Riddermann, Marita | B7: 554 | C7: 2 | D7: Zimmermann, Eva-Maria | E7: 691 | F7: 5
A8: Einzelwertungspunkte (EWP) | C8: 35 | D8: 42
A9: Punkte | C9: 0 | D9: 3
A10: Holzzahl | C10: 3911 | D10: 4170

A1: FSKC Wesel | D1: RW 59 Mülheim 2
A2: Dorp, Jutta | B2: 726 | C2: 12 | D2: Becker, Sieglinde | E2: 615 | F2: 1
A3: Daniels, Sabine | B3: 647 | C3: 6 | D3: Hentschel, Petra | E3: 654 | F3: 8
A4: Topolinski, Ingrid | B4: 644 | C4: 5 | D4: König, Anita | E4: 668 | F4: 11
A5: Sondermann, Sabine | B5: 631 | C5: 3 | D5: Nacci, Elisabeth | E5: 654 | F5: 7
A6: Erwied, Inge | B6: 630 | C6: 2 | D6: Prenger, Monika | E6: 667 | F6: 10
A7: van den Berg, Maria | B7: 643 | C7: 4 | D7: Zimmermann, Eva-Maria | E7: 657 | F7: 9
A8: Einzelwertungspunkte (EWP) | C8: 32 | D8: 46
A9: Punkte | C9: 2 | D9: 1
A10: Holzzahl | C10: 3921 | D10: 3915

A1: RW 59 Mülheim 2 | D1: SK 54/50 Essen-Borbeck
A2: Nacci, Elisabeth | B2: 648 | C2: 6 | D2: Ebert, Angelika | E2: 631 | F2: 5
A3: Zimmermann, Stella | B3: 341 | C3: 2 | D3: Gluch, Sabrina | E3: 371 | F3: 3
A4: König, Anita | B4: 686 | C4: 9 | D4: Zlj, Angrid | E4: 562 | F4: 4
A5: Prenger, Monika | B5: 711 | C5: 12 | D5: Schiffer, Christel | E5: 690 | F5: 10
A6: Zimmermann, Eva-Maria | B6: 670 | C6: 8 | D6: Brenner, Andrea | E6: 669 | F6: 7
A7: Hentschel, Petra | B7: 986 | C7: 11
A8: Einzelwertungspunkte (EWP) | C8: 48 | D8: 29
A9: Punkte | C9: 3 | D9: 0
A10: Holzzahl | C10: 3754 | D10: 2923

A1: Montan 66 Duisburg | D1: RW 59 Mülheim 2
A2: Schunk, Brigitte | B2: 643 | C2: 4 | D2: Hentschel, Petra | E2: 699 | F2: 10
A3: Stahl, Katrin | B3: 602 | C3: 2 | D3: Becker, Sieglinde | E3: 632 | F3: 3
A4: Schönbeck, Melanie | B4: 694 | C4: 9 | D4: König, Anita | E4: 660 | F4: 7
A5: Rausch, Angelika | B5: 669 | C5: 8 | D5: Zimmermann, Stella | E5: 327 | F5: 1
A6: Schmidt, Marianne | B6: 660 | C6: 6 | D6: Prenger, Monika | E6: 704 | F6: 11
A7: Drenk, Anneliese | B7: 713 | C7: 12 | D7: Zimmermann, Eva-Mariria | E7: 644 | F7: 5
A8: Einzelwertungspunkte (EWP) | C8: 41 | D8: 37
A9: Punkte | C9: 2 | D9: 1
A10: Holzzahl | C10: 3981 | D10: 3666

A1: RW 59 Mülheim 2 | D1: Düsseldorf 2010
A2: Becker, Sieglinde | B2: 653 | C2: 5 | D2: Hartwig, Petra | E2: 729 | F2: 10
A3: Hentschel, Petra | B3: 748 | C3: 12 | D3: Ifland, Corinna | E3: 615 | F3: 1
A4: König, Anita | B4: 706 | C4: 9 | D4: Gräber, Maria | E4: 664 | F4: 6
A5: Nacci, Elisabeth | B5: 631 | C5: 2 | D5: Gräber, Michaela | E5: 677 | F5: 7
A6: Prenger, Monika | B6: 736 | C6: 11 | D6: Ifland, Dagmar | E6: 637 | F6: 3
A7: Zimmermann, Eva-Maria | B7: 685 | C7: 8 | D7: Coenen, Ute | E7: 645 | F7: 4
A8: Einzelwertungspunkte (EWP) | C8: 47 | D8: 31
A9: Punkte | C9: 2 | D9: 1
A10: Holzzahl | C10: 4159 | D10: 3967

A1: ESV BW Rhgd. Düsseldorf | D1: RW 59 Mülheim 2
A2: Gereck, Magdalene | B2: 744 | C2: 11 | D2: Hentschel, Petra | E2: 666 | F2: 5
A3: Gräber, Stefanie | B3: 665 | C3: 4 | D3: Nacci, Elisabeth | E3: 676 | F3: 8
A4: Grote Gisela | B4: 757 | C4: 12 | D4: Prenger, Monika | E4: 668 | F4: 6
A5: Heckkausen, Helga | B5: 583 | C5: 3 | D5: Zimmermann, Eva-Maria | E5: 669 | F5: 7
A6: Moranvansky, Martina | B6: 689 | C6: 9 | D6: Zimmermann, Stella | E6: 360 | F6: 2
A7: Tetzlaff, Ines | B7: 703 | C7: 10
A8: Einzelwertungspunkte (EWP) | C8: 49 | D8: 28
A9: Punkte | C9: 3 | D9: 0
A10: Holzzahl | C10: 4141 | D10: 3039

A1: Datum | B1: Spieltag | C1: Nr. | D1: Uhrzeit | E1: Heim | G1: Gast | H1: Punkte | I1: ZW | J1: Holz
A2: 11.09.2011 | B2: 1 | C2: 1 | D2: 13:00 | E2: Montan 66 Duisburg | F2: - | G2: SK 54/59 Essen-Borbeck | H2: 3 : 0 | I2: 53 : 25 | J2: 3991 : 3297
C3: 2 | D3: 13:00 | E3: Düsseldorf 2010 | F3: - | G3: FSKC Wesel | H3: 2 : 1 | I3: 39 : 39 | J3: 3955 : 3921
C4: 3 | D4: 16:00 | E4: ESV BW Rheingold Düsseldorf | F4: - | G4: RW 59 Mülheim 2 | H4: 3 . 0 | I4: 49 : 28 | J4: 4141 : 3039
C5: 4 | E5: SK Kamp-Lintfort 2 | F5: - | G5: spielfrei
A6: 25.09.2011 | B6: 2 | C6: 5 | E6: spielfrei | F6: - | G6: ESV BW Rheingold Düsseldorf
C7: 6 | D7: 10:00 | E7: SK 54/59 Essen-Borbeck | F7: - | G7: SK Kamp-Lintfort 2 | H7: 2 : 1 | I7: 39 : 38 | J7: 3535 : 3016
C8: 7 | D8: 10:00 | E8: FSKC Wesel | F8: - | G8: Montan 66 Duisburg | H8: 2 : 1 | I8: 41 : 37 | J8: 3804 : 3696
C9: 8 | D9: 10:00 | E9: RW 59 Mülheim 2 | F9: - | G9: Düsseldorf 2010 | H9: 2 . 1 | I9: 47 : 31 | J9: 4159 : 3967
A10: 09.10.2011 | B10: 3 | C10: 9 | D10: 10:00 | E10: ESV BW Rheingold Düsseldorf | F10: - | G10: SK Kamp-Lintfort 2 | H10: 3 : 0 | I10: 49 : 29 | J10: 4274 : 3728
C11: 10 | D11: 10:00 | E11: Montan 66 Duisburg | F11: - | G11: RW 59 Mülheim 2 | H11: 2 : 1 | I11: 41 : 37 | J11: 3981 : 3666
C12: 11 | E12: Düsseldorf 2010 | F12: - | G12: spielfrei
C13: 12 | D13: 10:00 | E13: SK 54/59 Essen-Borbeck | F13: - | G13: FSKC Wesel | H13: 0 : 3 | I13: 37 : 41 | J13: 3582 : 3796
A14: 16.10.2011 | B14: 4 | C14: 13 | D14: 12:00 | E14: RW 59 Mülheim 2 | F14: - | G14: SK 54/59 Essen-Borbeck | H14: 3 : 0 | I14: 48 : 29 | J14: 3754 : 2923
C15: 14 | D15: 03:00 | E15: SK Kamp-Lintfort 2 | F15: - | G15: FSKC Wesel | H15: 0 : 3 | I15: 34 : 44 | J15: 3844 : 4110
C16: 15 | D16: 15:00 | E16: ESV BW Rheingold Düsseldorf | F16: - | G16: Düsseldorf 2010 | H16: 2 : 1 | I16: 42 : 36 | J16: 4154 : 4089
C17: 26 | E17: spielfrei | F17: - | G17: Montan 66 Duisburg
A18: 23.10.2011 | B18: 5 | C18: 17 | D18: 16:00 | E18: Düsseldorf 2010 | F18: - | G18: SK Kamp-Lintfort 2 | H18: 2 : 1 | I18: 45 : 32 | J18: 4001 : 3082
C19: 18 | E19: SK 54/59 Essen-Borbeck | F19: - | G19: spielfrei
C20: 19 | D20: 16:00 | E20: FSKC Wesel | F20: - | G20: RW 59 Mülheim 2 | H20: 2 : 1 | I20: 32 : 46 | J20: 3921 : 3915
C21: 20 | D21: 16:00 | E21: Montan 66 Duisburg | F21: - | G21: ESV BW Rheingold Düsseldorf | H21: 0 : 3 | I21: 36 : 42 | J21: 3861 : 4041
A22: 06.11.2011 | B22: 6 | C22: 21 | E22: spielfrei | F22: - | G22: FSKC Wesel
C23: 22 | D23: 13:00 | E23: Düsseldorf 2010 | F23: - | G23: Montan 66 Duisburg | H23: 2 : 1 | I23: 41 : 37 | J23: 3942 : 3828
C24: 23 | D24: 15:00 | E24: ESV BW Rheingold Düsseldorf | F24: - | G24: SK 54/59 Essen-Borbeck | H24: 3 : 0 | I24: 51 : 26 | J24: 4127 : 3114
C25: 24 | D25: 13:00 | E25: SK Kamp-Lintfort 2 | F25: - | G25: RW 59 Mülheim 2 | H25: 0 : 3 | I25: 36 : 42 | J25: 3911 : 4170
A26: 20.11.2011 | B26: 7 | C26: 25 | E26: RW 59 Mülheim 2 | F26: - | G26: spielfrei
C27: 26 | D27: 10:00 | E27: FSKC Wesel | F27: - | G27: ESV BW Rheingold Düsseldorf
C28: 27 | D28: 10:00 | E28: Montan 66 Duisburg | F28: - | G28: SK Kamp-Lintfort 2
C29: 28 | D29: 10:00 | E29: SK 54/59 Essen-Borbeck | F29: - | G29: Düsseldorf 2010

A1: Datum | B1: Spieltag | C1: Nr. | D1: Uhrzeit | E1: Heim | G1: Gast | H1: Punkte | I1: ZW | J1: Holz
A2: 04.12.2011 | B2: 8 | C2: 29 | D2: 10:00 | E2: SK 54/59 Essen-Borbeck | F2: - | G2: Montan 66 Duisburg
C3: 30 | D3: 10:00 | E3: FSKC Wesel | F3: - | G3: Düsseldorf 2010
C4: 31 | D4: 13:00 | E4: RW 59 Mülheim 2 | F4: - | G4: ESV BW Rheingold Düsseldorf
C5: 32 | E5: spielfrei | F5: - | G5: SK Kamp-Lintfort 2
A6: 18.12.2011 | B6: 9 | C6: 33 | E6: ESV BW Rheingold Düsseldorf | F6: - | G6: spielfrei
C7: 34 | D7: 10:00 | E7: SK Kamp-Lintfort 2 | F7: - | G7: SK 54/59 Essen-Borbeck
C8: 35 | D8: 10:00 | E8: Montan 66 Duisburg | F8: - | G8: FSKC Wesel
C9: 36 | D9: 11:00 | E9: Düsseldorf 2010 | F9: - | G9: RW 59 Mülheim 2
A10: 15.01.2012 | B10: 10 | C10: 37 | D10: 16:00 | E10: SK Kamp-Lintfort 2 | F10: - | G10: ESV BW Rheingold Düsseldorf
C11: 38 | D11: 13:00 | E11: RW 59 Mülheim 2 | F11: - | G11: Montan 66 Duisburg
C12: 39 | E12: spielfrei | F12: - | G12: Düsseldorf 2010
C13: 40 | D13: 12:00 | E13: FSKC Wesel | F13: - | G13: SK 54/59 Essen-Borbeck
A14: 12.02.2012 | B14: 11 | C14: 41 | D14: 12:00 | E14: SK 54/59 Essen-Borbeck | F14: - | G14: RW 59 Mülheim 2
C15: 42 | D15: 16:00 | E15: FSKC Wesel | F15: - | G15: SK Kamp-Lintfort 2
C16: 43 | D16: 13:00 | E16: Düsseldorf 2010 | F16: - | G16: ESV BW Rheingold Düsseldorf
C17: 44 | E17: Montan 66 Duisburg | F17: - | G17: spielfrei
A18: 26.02.2012 | B18: 12 | C18: 45 | D18: 13:00 | E18: SK Kamp-Lintfort 2 | F18: - | G18: Düsseldorf 2010
C19: 46 | E19: spielfrei | F19: - | G19: SK 54/59 Essen-Borbeck
C20: 47 | D20: 15:00 | E20: RW 59 Mülheim 2 | F20: - | G20: FSKC Wesel
C21: 48 | D21: 15:00 | E21: ESV BW Rheingold Düsseldorf | F21: - | G21: Montan 66 Duisburg
A22: 04.03.2012 | B22: 13 | C22: 49 | E22: FSKC Wesel | F22: - | G22: spielfrei
C23: 50 | D23: 15:00 | E23: Montan 66 Duisburg | F23: - | G23: Düsseldorf 2010
C24: 51 | D24: 13:00 | E24: SK 54/59 Essen-Borbeck | F24: - | G24: ESV BW Rheingold Düsseldorf
C25: 52 | D25: 16:00 | E25: RW 59 Mülheim 2 | F25: - | G25: SK Kamp-Lintfort 2
A26: 25.03.2012 | B26: 14 | C26: 53 | E26: spielfrei | F26: - | G26: RW 59 Mülheim 2
C27: 54 | D27: 15:00 | E27: ESV BW Rheingold Düsseldorf | F27: - | G27: FSKC Wesel
C28: 55 | D28: 13:00 | E28: SK Kamp-Lintfort 2 | F28: - | G28: Montan 66 Duisburg
C29: 56 | D29: 13:00 | E29: Düsseldorf 2010 | F29: - | G29: SK 54/59 Essen-Borbeck