A12: STADTMEISTERSCHAFTEN 2004
A14: Bei allen Wettbewerben gibt es vier Durchgänge. Davon ist der Schlechteste ein Streichdurchgang.
A16: Damen Paarkampf
C17: 1. Durchgang | D17: 2. Durchgang | E17: 3. Durchgang | F17: 4. Durchgang | G17: Gesamt
C18: Bahnen 5-8 | D18: Bahnen 1-4 | E18: Bahnen 5-8 | F18: Bahnen 1-4
A19: 1 | B19: Simona Dziura/ | C19: 629 | D19: 571 | E19: 600 | F19: 0 | G19: 1800
B20: Marion Henkel
A21: 2 | B21: Birgit Sowinski/ | C21: 607 | D21: 504 | E21: 0 | F21: 576 | G21: 1687
B22: Simone Sauer
A23: 3 | B23: Anja Hübel/ | C23: 535 | D23: 548 | E23: 536 | F23: 487 | G23: 1619
B24: Simone Kolba
A25: 4 | B25: Dagmar D´heur/ | C25: 502 | D25: 551 | E25: 517 | F25: 472 | G25: 1570
B26: Monika Prenger
A27: 5 | B27: Sieglinde Becker/ | C27: 506 | D27: 481 | E27: 477 | F27: 436 | G27: 1464
B28: Renate Zwick
A29: 6 | B29: Ellen Sickelmann/ | C29: 476 | D29: 380 | E29: 381 | F29: 411 | G29: 1268
B30: Eva-Maria Zimmermann
A34: Herren Paarkampf
C35: 1. Durchgang | D35: 2. Durchgang | E35: 3. Durchgang | F35: 4. Durchgang | G35: Gesamt
C36: Bahnen 5-8 | D36: Bahnen 1-4 | E36: Bahnen 5-8 | F36: Bahnen 1-4
A37: 1 | B37: Frank Dahlhaus Michael Kuenkamp | C37: 657 | D37: 622 | E37: 721 | F37: 653 | G37: 2031
A38: 2 | B38: Jann Henniges Joachim Pohl | C38: 698 | D38: 642 | E38: 664 | F38: 627 | G38: 2004
A39: 3 | B39: Thomas Klasen Bernd Ries | C39: 633 | D39: 581 | E39: 719 | F39: 651 | G39: 2003
A40: 4 | B40: Marcel Bernsee Sebastian Hentschel | C40: 625 | D40: 637 | E40: 581 | F40: 596 | G40: 1858
A41: 5 | B41: Stefan BlumUdo Gietmann | C41: 645 | D41: 0 | E41: 654 | F41: 554 | G41: 1853
A42: 6 | B42: Karl-Heinz Gabel Hans-Peter Strack | C42: 554 | D42: 604 | E42: 576 | F42: 0 | G42: 1734
A43: 7 | B43: Herbert Alexa Marc Papendiek | C43: 571 | D43: 582 | E43: 499 | F43: 513 | G43: 1666
A44: 8 | B44: Dieter Hegewald Leonhard Jacobs | C44: 504 | D44: 508 | E44: 512 | F44: 474 | G44: 1524
A45: 9 | B45: Dominik Bernsee Achim Cyriax | C45: 478 | D45: 458 | E45: 418 | F45: 510 | G45: 1446
A46: 10 | B46: Harald Bernsee Uwe Willrich | C46: 400 | D46: 479 | E46: 465 | F46: 395 | G46: 1344
A47: 11 | B47: Dieter Neumann Dietmar Kröber | C47: 0 | D47: 516 | E47: 448 | F47: 0 | G47: 964
A51: Mixed Paarkampf
C52: 1. Durchgang | D52: 2. Durchgang | E52: 3. Durchgang | F52: 4. Durchgang | G52: Gesamt
C53: Bahnen 1-4 | D53: Bahnen 5-8 | E53: Bahnen 1-4 | F53: Bahnen 5-8
A54: 1 | B54: Marion Henkel/ | C54: 634 | D54: 639 | E54: 571 | F54: 622 | G54: =SUM(C52:F53)-MIN(C52:F53) -> 1895
B55: Bernd Ries
A56: 2 | B56: Carolin Sengpiehl/Jann Henniges | C56: 588 | D56: 601 | E56: 0 | F56: 645 | G56: =SUM(C54:F55) -> 1834
A57: 3 | B57: Birgit Sowinski/ | C57: 588 | D57: 607 | E57: 0 | F57: 606 | G57: 1801
B58: Frank Dahlhaus
A59: 4 | B59: Simona Dziura/ | C59: 500 | D59: 570 | E59: 538 | F59: 634 | G59: =SUM(C58:F59)-MIN(C58:F59) -> 1742
B60: Bernd Loske
A61: 5 | B61: Simone Sauer/Marcel Bernsee | C61: 549 | D61: 557 | E61: 0 | F61: 621 | G61: =SUM(C60:F61)-MIN(C60:F61) -> 1727
A62: 6 | B62: Eva -Maria Zimmermann/ | C62: 544 | D62: 528 | E62: 512 | F62: 528 | G62: =SUM(C60:F61)-MIN(C60:F61) -> 1600
B63: Joachim Pohl
A64: 7 | B64: Anja Hübel/ | C64: 538 | D64: 505 | E64: 0 | F64: 539 | G64: =SUM(C64:F65)-MIN(C64:F65) -> 1582
B65: Marc Papendiek
A66: 8 | B66: Monika Prenger/Hans-Peter Strack | C66: 539 | D66: 520 | E66: 512 | F66: 501 | G66: =SUM(C66:F67)-MIN(C66:F67) -> 1571
A67: 9 | B67: Sieglinde Becker/ | C67: 506 | D67: 518 | E67: 518 | F67: 477 | G67: =SUM(C66:F67)-MIN(C66:F67) -> 1513
B68: Gunther Lorenz
A69: 10 | B69: Dagmar D´heur/ | C69: 462 | D69: 448 | E69: 0 | F69: 551 | G69: =SUM(C70:F71)-MIN(C70:F71) -> 1461
B70: Klaus Zwick
A71: 11 | B71: Renate Zwick/Peter Goldenberg | C71: 467 | D71: 469 | E71: 419 | F71: 491 | G71: =SUM(C72:F73)-MIN(C72:F73) -> 1427
A72: 12 | B72: Monika Sicking/ | C72: 458 | D72: 0 | E72: 492 | F72: 0 | G72: =SUM(C74:F75)-MIN(C74:F75) -> 950
B73: Ewald Sicking
A74: 13 | B74: Ellen Sickelmann/Dietmar Kröber | C74: 435 | D74: 449 | E74: 0 | F74: 0 | G74: =SUM(C74:F75)-MIN(C74:F75) -> 884