A1: Platz | B1: Name | C1: 1. DG | D1: Pkt. | E1: 2. DG | F1: Pkt. | G1: 3. DG | H1: Pkt. | I1: 4.DG | J1: Pkt. | K1: Gesamt Holzzahl | L1: Gesamt Punkte
C2: Volle | E2: Komb. | G2: Volle | I2: Komb.
A3: 1. | B3: Sickelmann, Sebastian | C3: 927 | D3: 2 | E3: 722 | F3: 1 | G3: 865 | H3: 1 | I3: 818 | J3: 1 | K3: 3332 | L3: 5
A4: 2. | B4: Lorenz, Gunther | C4: 901 | D4: 3 | E4: 677 | F4: 2 | G4: 852 | H4: 3 | I4: 701 | J4: 5 | K4: 3131 | L4: 13
A5: 3. | B5: Cyriax, Achim | C5: 864 | D5: 5.5 | E5: 651 | F5: 6 | G5: 859 | H5: 2 | I5: 761 | J5: 2 | K5: 3135 | L5: 15.5
A6: 4. | B6: Eichler, Manfred | C6: 928 | D6: 1 | E6: 657 | F6: 5 | G6: 845 | H6: 4 | I6: 675 | J6: 7 | K6: 3105 | L6: 17
A7: 5. | B7: Bernsee, Dominik | C7: 864 | D7: 5.5 | E7: 672 | F7: 3 | G7: 828 | H7: 6 | I7: 739 | J7: 3 | K7: 3103 | L7: 17.5
A8: 6. | B8: Görg Dr., Siegfried | C8: 885 | D8: 4 | E8: 662 | F8: 4 | G8: 834 | H8: 5 | I8: 676 | J8: 6 | K8: 3057 | L8: 19
A9: 7. | B9: Wittkamp, Paul | C9: 860 | D9: 7 | E9: 573 | F9: 7 | G9: 773 | H9: 7 | I9: 726 | J9: 4 | K9: 2932 | L9: 25
A10: 8. | B10: Beek aus der, Wilfried | C10: 852 | D10: 8 | E10: 0 | F10: 8 | G10: 0 | H10: 8 | I10: 0 | J10: 8 | K10: 852 | L10: 32
A11: 9. | B11: Zimmermann, Heinz | C11: 845 | D11: 9 | E11: 0 | F11: 8 | G11: 0 | H11: 8 | I11: 0 | J11: 8 | K11: 845 | L11: 33
A12: 10. | B12: Bernsee, Harald | C12: 0 | D12: 10 | E12: 0 | F12: 8 | G12: 0 | H12: 8 | I12: 0 | J12: 8 | K12: 0 | L12: 34
A13: 10. | B13: Denkhaus, Manfred | C13: 0 | D13: 10 | E13: 0 | F13: 8 | G13: 0 | H13: 8 | I13: 0 | J13: 8 | K13: 0 | L13: 34
A14: 10. | B14: Dufhues, Rolf | C14: 0 | D14: 10 | E14: 0 | F14: 8 | G14: 0 | H14: 8 | I14: 0 | J14: 8 | K14: 0 | L14: 34
A15: 10. | B15: Hentschel, Henry | C15: 0 | D15: 10 | E15: 0 | F15: 8 | G15: 0 | H15: 8 | I15: 0 | J15: 8 | K15: 0 | L15: 34
A16: 10. | B16: Ising, Horst | C16: 0 | D16: 10 | E16: 0 | F16: 8 | G16: 0 | H16: 8 | I16: 0 | J16: 8 | K16: 0 | L16: 34
A17: 10. | B17: Ulrich, Detlef | C17: 0 | D17: 10 | E17: 0 | F17: 8 | G17: 0 | H17: 8 | I17: 0 | J17: 8 | K17: 0 | L17: 34

A1: 2007 | B1: 1. Sebastian Sickelmannl | C1: 2. Gunther Lorenz | D1: 3. Achim Cyriax
A2: 2006 | B2: 1. Harry Hentschel | C2: 2. Siegfried Görg | D2: 3. Manfred Eichler
A3: 2005 | B3: 1. Achim Cyriax | C3: 2. Dominik Bernsee | D3: 3. Paul Wittkamp
A4: 2004 | B4: 1. Gunther Lorenz | C4: 2. Paul Wittkamp | D4: 3. Manfred Denkhaus
A5: 2003 | B5: 1. Sebastian Hentschel | C5: 2. Henry Hentschel | D5: 3. Achim Cyriax

K1: Gesamt- | L1: Gesamt-
A2: Platz | B2: Name | C2: 1. DG | D2: Punkte | E2: 2. DG | F2: Punkte | G2: 3. DG | H2: Punkte | I2: 4.DG | J2: Punkte | K2: Holz | L2: Punkte
C3: Volle | E3: Komb. | G3: Volle | I3: Komb.
A4: 1. | B4: Sickelmann, Sebastian | C4: 927 | D4: 2 | E4: 722 | F4: 1 | G4: 865 | H4: 1 | I4: 818 | J4: 1 | K4: =C4+E4+G4+I4 -> 3332 | L4: =D4+F4+H4+J4 -> 5
A5: 2. | B5: Lorenz, Gunther | C5: 901 | D5: 3 | E5: 677 | F5: 2 | G5: 852 | H5: 3 | I5: 701 | J5: 5 | K5: =C5+E5+G5+I5 -> 3131 | L5: =D5+F5+H5+J5 -> 13
A6: 3. | B6: Cyriax, Achim | C6: 864 | D6: 5.5 | E6: 651 | F6: 6 | G6: 859 | H6: 2 | I6: 761 | J6: 2 | K6: =C6+E6+G6+I6 -> 3135 | L6: =D6+F6+H6+J6 -> 15.5
A7: 4. | B7: Eichler, Manfred | C7: 928 | D7: 1 | E7: 657 | F7: 5 | G7: 845 | H7: 4 | I7: 675 | J7: 7 | K7: =C7+E7+G7+I7 -> 3105 | L7: =D7+F7+H7+J7 -> 17
A8: 5. | B8: Bernsee, Dominik | C8: 864 | D8: 5.5 | E8: 672 | F8: 3 | G8: 828 | H8: 6 | I8: 739 | J8: 3 | K8: =C8+E8+G8+I8 -> 3103 | L8: =D8+F8+H8+J8 -> 17.5
A9: 6. | B9: Görg Dr., Siegfried | C9: 885 | D9: 4 | E9: 662 | F9: 4 | G9: 834 | H9: 5 | I9: 676 | J9: 6 | K9: =C9+E9+G9+I9 -> 3057 | L9: =D9+F9+H9+J9 -> 19
A10: 7. | B10: Wittkamp, Paul | C10: 860 | D10: 7 | E10: 573 | F10: 7 | G10: 773 | H10: 7 | I10: 726 | J10: 4 | K10: =C10+E10+G10+I10 -> 2932 | L10: =D10+F10+H10+J10 -> 25
A11: 8. | B11: Beek aus der, Wilfried | C11: 852 | D11: 8 | E11: 0 | F11: 8 | G11: 0 | H11: 8 | I11: 0 | J11: 8 | K11: =C11+E11+G11+I11 -> 852 | L11: =D11+F11+H11+J11 -> 32
A12: 9. | B12: Zimmermann, Heinz | C12: 845 | D12: 9 | E12: 0 | F12: 8 | G12: 0 | H12: 8 | I12: 0 | J12: 8 | K12: =C12+E12+G12+I12 -> 845 | L12: =D12+F12+H12+J12 -> 33
A13: 10. | B13: Bernsee, Harald | C13: 0 | D13: 10 | E13: 0 | F13: 8 | G13: 0 | H13: 8 | I13: 0 | J13: 8 | K13: =C13+E13+G13+I13 -> 0 | L13: =D13+F13+H13+J13 -> 34
A14: 10. | B14: Denkhaus, Manfred | C14: 0 | D14: 10 | E14: 0 | F14: 8 | G14: 0 | H14: 8 | I14: 0 | J14: 8 | K14: =C14+E14+G14+I14 -> 0 | L14: =D14+F14+H14+J14 -> 34
A15: 10. | B15: Dufhues, Rolf | C15: 0 | D15: 10 | E15: 0 | F15: 8 | G15: 0 | H15: 8 | I15: 0 | J15: 8 | K15: =C15+E15+G15+I15 -> 0 | L15: =D15+F15+H15+J15 -> 34
A16: 10. | B16: Hentschel, Henry | C16: 0 | D16: 10 | E16: 0 | F16: 8 | G16: 0 | H16: 8 | I16: 0 | J16: 8 | K16: =C16+E16+G16+I16 -> 0 | L16: =D16+F16+H16+J16 -> 34
A17: 10. | B17: Ising, Horst | C17: 0 | D17: 10 | E17: 0 | F17: 8 | G17: 0 | H17: 8 | I17: 0 | J17: 8 | K17: =C17+E17+G17+I17 -> 0 | L17: =D17+F17+H17+J17 -> 34
A18: 10. | B18: Ulrich, Detlef | C18: 0 | D18: 10 | E18: 0 | F18: 8 | G18: 0 | H18: 8 | I18: 0 | J18: 8 | K18: =C18+E18+G18+I18 -> 0 | L18: =D18+F18+H18+J18 -> 34