B1: Gruppe A: | C1: 1. Durchgang | D1: 2. Durchgang | E1: Gesamt
A2: 1. | B2: Lorenz, Gunther | C2: 682 | D2: 741 | E2: =SUM(C15:D15) -> 1423
A3: 2. | B3: Wittkamp, Paul | C3: 698 | D3: 719 | E3: =SUM(C16:D16) -> 1417
A4: 3. | B4: Denkhaus, Manfred | C4: 641 | D4: 711 | E4: =SUM(C17:D17) -> 1352
A5: 4. | B5: Bernsee, Harald | C5: 579 | D5: 671 | E5: =SUM(C18:D18) -> 1250
A6: 5. | B6: Bernsee, Dominik | C6: 585 | D6: 576 | E6: =SUM(C25:D25) -> 1161
A7: 6. | B7: Hentschel, Sebastian | C7: 732 | D7: 0 | E7: =SUM(C26:D26) -> 732

B1: Gruppe A: | C1: 1. Durchgang | D1: 2. Durchgang | E1: Gesamt
A2: 1. | B2: Hentschel, Sebastian | C2: 769 | D2: 763 | E2: =SUM(C15:D15) -> 1532
A3: 2. | B3: Lorenz, Gunther | C3: 695 | D3: 761 | E3: =SUM(C16:D16) -> 1456
A4: 3. | B4: Cyriax, Achim | C4: 690 | D4: 744 | E4: =SUM(C17:D17) -> 1434
A5: 4. | B5: Hentschel, Henry | C5: 0 | D5: 0 | E5: =SUM(C18:D18) -> 0
B8: Gruppe B: | C8: 1. Durchgang | D8: 2. Durchgang | E8: Gesamt
A9: 1. | B9: Wittkamp, Paul | C9: 691 | D9: 697 | E9: =SUM(C25:D25) -> 1388
A10: 2. | B10: Denkhaus, Manfred | C10: 680 | D10: 655 | E10: =SUM(C26:D26) -> 1335
A11: 3. | B11: Görg Dr., Siegfried | C11: 697 | D11: 626 | E11: =SUM(C27:D27) -> 1323
A12: 4. | B12: Zimmermann, Heinz | C12: 657 | D12: 658 | E12: =SUM(C28:D28) -> 1315
B15: Gruppe C: | C15: 1. Durchgang | D15: 2. Durchgang | E15: Gesamt
A16: 1. | B16: Bernsee, Dominik | C16: 647 | D16: 604 | E16: =SUM(C35:D35) -> 1251
A17: 2. | B17: Bernsee, Harald | C17: 618 | D17: 607 | E17: =SUM(C36:D36) -> 1225
A18: 3. | B18: Zimmermann, Georg | C18: 538 | D18: 531 | E18: =SUM(C37:D37) -> 1069
A19: 4. | B19: Willrich, Uwe | C19: 0 | D19: 0 | E19: =SUM(C38:D38) -> 0