B1: d | C1: 1. Durchgang | D1: 2. Durchgang | E1: Gesamt
A2: 1. | B2: Hentschel, Sebastian | C2: 732 | D2: 756 | E2: =SUM(C15:D15) -> 1488
A3: 2. | B3: Hentschel, Henry | C3: 710 | D3: 695 | E3: =SUM(C16:D16) -> 1405
A4: 3. | B4: Cyriax, Achim | C4: 657 | D4: 732 | E4: =SUM(C17:D17) -> 1389
A5: 4. | B5: Zimmermann, Heinz | C5: 619 | D5: 690 | E5: =SUM(C18:D18) -> 1309
A6: 5. | B6: Wittkamp, Paul | C6: 672 | D6: 629 | E6: =SUM(C19:D19) -> 1301
A7: 6. | B7: Bernsee, Dominik | C7: 642 | D7: 165 | E7: =SUM(C20:D20) -> 807

B13: Gruppe A: | C13: 1. Durchgang | D13: 2. Durchgang | E13: Gesamt
A14: 1. | B14: Hentschel, Henry | C14: 716 | D14: 774 | E14: =SUM(C15:D15) -> 1490
A15: 2. | B15: Hentschel, Sebastian | C15: 727 | D15: 763 | E15: =SUM(C16:D16) -> 1490
A16: 3. | B16: Lang, Ralf | C16: 686 | D16: 711 | E16: =SUM(C17:D17) -> 1397
A17: 4. | B17: Lorenz, Gunther | C17: 725 | D17: 0 | E17: =SUM(C18:D18) -> 725
A18: 5. | B18: Oelschläger, Jürgen | C18: 685 | D18: 0 | E18: =SUM(C19:D19) -> 685
A19: 6. | B19: Ulrich, Detlef | C19: 0 | D19: 0 | E19: =SUM(C20:D20) -> 0
B22: Gruppe B: | C22: 1. Durchgang | D22: 2. Durchgang | E22: Gesamt
A23: 1. | B23: Cyriax, Achim | C23: 650 | D23: 688 | E23: =SUM(C25:D25) -> 1338
A24: 2. | B24: Zimmermann, Heinz | C24: 651 | D24: 598 | E24: =SUM(C26:D26) -> 1249
A25: 3. | B25: Dungs, Werner | C25: 636 | D25: 577 | E25: =SUM(C27:D27) -> 1213
A26: 4. | B26: Biermann, Karl-Heinz | C26: 738 | D26: 0 | E26: =SUM(C28:D28) -> 738
A27: 5. | B27: Denkhaus, Manfred | C27: 699 | D27: 0 | E27: =SUM(C29:D29) -> 699
A28: 6. | B28: Görg Dr., Siegfried | C28: 0 | D28: 0 | E28: =SUM(C30:D30) -> 0
B31: Gruppe C: | C31: 1. Durchgang | D31: 2. Durchgang | E31: Gesamt
A32: 1. | B32: Bernsee, Dominik | C32: 637 | D32: 647 | E32: =SUM(C35:D35) -> 1284
A33: 2. | B33: Wittkamp, Paul | C33: 635 | D33: 646 | E33: =SUM(C36:D36) -> 1281
A34: 3. | B34: Bernsee, Harald | C34: 602 | D34: 598 | E34: =SUM(C37:D37) -> 1200
A35: 4. | B35: Willrich, Uwe | C35: 566 | D35: 615 | E35: =SUM(C38:D38) -> 1181
A36: 5. | B36: Zimmermann, Georg | C36: 501 | D36: 553 | E36: =SUM(C39:D39) -> 1054
A37: 6. | B37: Steinbach, Michael | C37: 0 | D37: 0 | E37: =SUM(C40:D40) -> 0