A1: BW Mülheim 61 - 1. Mannschaft | B1: BW Mülheim 61 - 1. Mannschaft
A2: Die Saison in der 1. Bundesliga 2011/2012 Tabelle: nach dem 11. Spieltag Bestenliste nach dem 11. Spieltag ´ 11. Spieltag 26.11.2011 10. Spieltag 19.11.2011 9. Spieltag 12.11.2011 8. Spieltag 23.10.2011 7. Spieltag 22.10.2011 6. Spieltag 15.10.2011 5. Spieltag 01.10.2011 4. Spieltag 18.09.2011 3. Spieltag 17.09.2011 2. Spieltag 10.09.2011 1. Spieltag 03.09.2011 t | B2: Spielplan und Ergebnisse 1. Bundesliga 2011/2012 Hinrunde: Rückrunde: 11.02.2012 1. Tag Meister- / Abstiegsrunde 25.02.2012 2. Tag Meister- / Abstiegsrunde 26.02.2012 3. Tag Meister- / Abstiegsrunde 03.03.2012 4. Tag Meister- / Abstiegsrunde

A1: Platz | B1: Mannschaft | C1: Spiele | D1: Punkte | E1: Heim | F1: Ausw. | G1: +/- | H1: EWP | I1: Holz | J1: Ø Heim | K1: Ø ausw. | L1: Ø Heim | M1: Ø ausw.
A2: 1 | B2: KSV Riol | C2: 11 | D2: =E2+F2 -> 23 | E2: 11 | F2: 12 | G2: 11 | H2: 434 | I2: 56874 | J2: 5200.75 | K2: 5153 | L2: 866.79166666666663 | M2: 858.83333333333337
A3: 2 | B3: SK Heilingenhaus | C3: 11 | D3: =E3+F3 -> 22 | E3: 16 | F3: 6 | G3: 4 | H3: 472 | I3: 56907 | J3: 5250.166666666667 | K3: 5081.2 | L3: 875.02777777777783 | M3: 846.86666666666667
A4: 3 | B4: Ninepin 09 Isalohn | C4: 11 | D4: =E4+F4 -> 22 | E4: 17 | F4: 5 | G4: 4 | H4: 450 | I4: 56130 | J4: 5104.833333333333 | K4: 5100.2 | L4: 850.80555555555554 | M4: 850.0333333333333
A5: 3 | B5: KF Obertal | C5: 11 | D5: =E5+F5 -> 20 | E5: 12 | F5: 8 | G5: 8 | H5: 469 | I5: 58836 | J5: 5696.25 | K5: 5150.1428571428569 | L5: 949.375 | M5: 858.35714285714278
A6: 4 | B6: SK Münstermaifeld | C6: 11 | D6: =E6+F6 -> 17 | E6: 16 | F6: 1 | G6: -4 | H6: 452 | I6: 55875 | J6: 5186.8571428571431 | K6: 4891.75 | L6: 864.47619047619048 | M6: 815.29166666666663
A7: 5 | B7: SKG 67 Paffrath | C7: 11 | D7: =E7+F7 -> 16 | E7: 16 | F7: 0 | G7: -2 | H7: 438 | I7: 56670 | J7: 5320.333333333333 | K7: 4949.6 | L7: 886.72222222222217 | M7: 824.93333333333339
A8: 6 | B8: KSG Tecklenburger Land | C8: 11 | D8: =E8+F8 -> 16 | E8: 15 | F8: 1 | G8: -2 | H8: 422 | I8: 55664 | J8: 5245 | K8: 4838.8 | L8: 874.16666666666663 | M8: 806.4666666666667
A9: 7 | B9: KSF Chemie Holten-Duisburg | C9: 11 | D9: =E9+F9 -> 15 | E9: 14 | F9: 1 | G9: -3 | H9: 381 | I9: 55377 | J9: 5114.5 | K9: 4938 | L9: 852.41666666666663 | M9: 823
A10: 8 | B10: BW 61 Mülheim | C10: 11 | D10: =E10+F10 -> 8 | E10: 7 | F10: 1 | G10: -7 | H10: 367 | I10: 55005 | J10: 5084.6 | K10: 4930.333333333333 | L10: 847.43333333333339 | M10: 821.72222222222217
A11: 10 | B11: KSG BG 99 Neuhof | C11: 11 | D11: =E11+F11 -> 6 | E11: 6 | F11: 0 | G11: -9 | H11: 327 | I11: 54657 | J11: 5180.6 | K11: 4792.333333333333 | L11: 863.43333333333339 | M11: 798.72222222222217

A1: Nr. | B1: Spieler | C1: Klub | D1: Sp | E1: EWP | F1: EWP-Ø | G1: Holz | H1: Holz-Ø | I1: Best
A2: 1 | B2: Mayer, Holger | C2: KF Oberthal | D2: 11 | E2: 110 | F2: 10 | G2: 10142 | H2: 922 | I2: 1010
A3: 2 | B3: Mittelstädt, Daniel | C3: SK Heiligenhaus | D3: 11 | E3: 109 | F3: 9.91 | G3: 9944 | H3: 904 | I3: 954
A4: 3 | B4: Laukmann, André | C4: SKC 67 Paffrath | D4: 11 | E4: 105 | F4: 9.55 | G4: 9780 | H4: 889.09 | I4: 962
A5: 4 | B5: Knobel, Kai | C5: KSV Riol | D5: 11 | E5: 104 | F5: 9.45 | G5: 9738 | H5: 885.27 | I5: 928
A6: 5 | B6: Stoffels, Rainer | C6: SK Münstermaifeld | D6: 11 | E6: 103 | F6: 9.36 | G6: 9615 | H6: 874.09 | I6: 926
A7: 6 | B7: Steinke, Christian | C7: Ninepin 09 Iserlohn | D7: 11 | E7: 99 | F7: 9 | G7: 9537 | H7: 867 | I7: 911
A8: 7 | B8: Grohmann, Florian | C8: SKC 67 Paffrath | D8: 11 | E8: 95 | F8: 8.64 | G8: 9693 | H8: 881.18 | I8: 949
A9: 8 | B9: Parassini, Holger | C9: SK Heiligenhaus | D9: 11 | E9: 95 | F9: 8.64 | G9: 9653 | H9: 877.55 | I9: 935
A10: 9 | B10: Martini, Knut | C10: KSF Chemie Holten-Duisburg | D10: 11 | E10: 95 | F10: 8.64 | G10: 9539 | H10: 867.18 | I10: 931
A11: 10 | B11: Klein, Thomas | C11: KSG Tecklenburger Land | D11: 11 | E11: 91 | F11: 8.27 | G11: 9485 | H11: 862.27 | I11: 908
A12: 11 | B12: Klöpper, Hans Joachim | C12: Ninepin 09 Iserlohn | D12: 11 | E12: 89 | F12: 8.09 | G12: 9451 | H12: 859.18 | I12: 898
A13: 12 | B13: Schulz, Daniel | C13: KF Oberthal | D13: 11 | E13: 83 | F13: 7.55 | G13: 9837 | H13: 894.27 | I13: 989
A14: 13 | B14: Kargus, Carsten | C14: Ninepin 09 Iserlohn | D14: 11 | E14: 83 | F14: 7.55 | G14: 9421 | H14: 856.45 | I14: 908
A15: 14 | B15: Schneimann, Marcel | C15: KSF Chemie Holten-Duisburg | D15: 11 | E15: 83 | F15: 7.55 | G15: 9364 | H15: 851.27 | I15: 881
A16: 15 | B16: Gebauer, Markus | C16: KF Oberthal | D16: 11 | E16: 82 | F16: 7.45 | G16: 9906 | H16: 900.55 | I16: 995
A17: 16 | B17: Göbel, Bernd | C17: SK Münstermaifeld | D17: 10 | E17: 82 | F17: 8.2 | G17: 8548 | H17: 854.8 | I17: 920
A18: 17 | B18: Grote, Marcel | C18: SK Heiligenhaus | D18: 10 | E18: 81 | F18: 8.1 | G18: 8784 | H18: 878.4 | I18: 957
A19: 18 | B19: Stenger, Stephan | C19: KSF Chemie Holten-Duisburg | D19: 11 | E19: 80 | F19: 7.27 | G19: 9401 | H19: 854.64 | I19: 895
A20: 19 | B20: Blasen, Steve | C20: KSV Riol | D20: 9 | E20: 78 | F20: 8.67 | G20: 7934 | H20: 881.56 | I20: 938
A21: 20 | B21: Hoffmann, Martin | C21: KSV Riol | D21: 11 | E21: 78 | F21: 7.09 | G21: 9542 | H21: 867.45 | I21: 925
A22: 21 | B22: Schöneberger, Daniel | C22: KF Oberthal | D22: 11 | E22: 77 | F22: 7 | G22: 9756 | H22: 886.91 | I22: 951
A23: 22 | B23: Pohl, Joachim | C23: BW 61 Mülheim | D23: 11 | E23: 76 | F23: 6.91 | G23: 9326 | H23: 847.82 | I23: 899
A24: 23 | B24: Immendorff, Bernardo | C24: SKC 67 Paffrath | D24: 11 | E24: 75 | F24: 6.82 | G24: 9451 | H24: 859.18 | I24: 904
A25: 24 | B25: Krefter, Rainer | C25: BW 61 Mülheim | D25: 11 | E25: 73 | F25: 6.64 | G25: 9273 | H25: 843 | I25: 888
A26: 25 | B26: Panneck, Ralf | C26: KSF Chemie Holten-Duisburg | D26: 11 | E26: 70 | F26: 6.36 | G26: 9319 | H26: 847.18 | I26: 919
A27: 26 | B27: Vogel, Boris | C27: KSG BG 99 Neuhof | D27: 11 | E27: 69 | F27: 6.27 | G27: 9350 | H27: 850 | I27: 916
A28: 27 | B28: Mitscher, Alfred | C28: SK Münstermaifeld | D28: 10 | E28: 69 | F28: 6.9 | G28: 8445 | H28: 844.5 | I28: 868
A29: 28 | B29: Nielinger, Michael | C29: Ninepin 09 Iserlohn | D29: 11 | E29: 69 | F29: 6.27 | G29: 9268 | H29: 842.55 | I29: 877
A30: 29 | B30: Port, Volker | C30: SK Münstermaifeld | D30: 9 | E30: 63 | F30: 7 | G30: 7658 | H30: 850.89 | I30: 910
A31: 30 | B31: Förster, Jörg | C31: Ninepin 09 Iserlohn | D31: 8 | E31: 62 | F31: 7.75 | G31: 6768 | H31: 846 | I31: 881
A32: 31 | B32: Verlemann, Andre | C32: KSG Tecklenburger Land | D32: 7 | E32: 60 | F32: 8.57 | G32: 6075 | H32: 867.86 | I32: 938
A33: 32 | B33: Lampe, Stefan | C33: KSG Tecklenburger Land | D33: 11 | E33: 60 | F33: 5.45 | G33: 9237 | H33: 839.73 | I33: 888
A34: 33 | B34: Killadt, Mike | C34: SK Münstermaifeld | D34: 10 | E34: 60 | F34: 6 | G34: 8389 | H34: 838.9 | I34: 892
A35: 34 | B35: Kerkhoff, Raphael | C35: Ninepin 09 Iserlohn | D35: 10 | E35: 60 | F35: 6 | G35: 8350 | H35: 835 | I35: 882
A36: 35 | B36: Meck, Stefan | C36: KSG Tecklenburger Land | D36: 8 | E36: 59 | F36: 7.38 | G36: 6847 | H36: 855.88 | I36: 915
A37: 36 | B37: Mickisch, Horst | C37: KSV Riol | D37: 11 | E37: 59 | F37: 5.36 | G37: 9344 | H37: 849.45 | I37: 888
A38: 37 | B38: Wagner, Jürgen | C38: KF Oberthal | D38: 9 | E38: 58 | F38: 6.44 | G38: 7979 | H38: 886.56 | I38: 947
A39: 38 | B39: Rittmann, Marko | C39: SKC 67 Paffrath | D39: 10 | E39: 57 | F39: 5.7 | G39: 8483 | H39: 848.3 | I39: 901
A40: 39 | B40: Hippert, Uwe | C40: KSF Chemie Holten-Duisburg | D40: 11 | E40: 57 | F40: 5.18 | G40: 9155 | H40: 832.27 | I40: 877
A41: 40 | B41: Perez, Jose | C41: SK Heiligenhaus | D41: 6 | E41: 55 | F41: 9.17 | G41: 5261 | H41: 876.83 | I41: 895
A42: 41 | B42: Glöckner, Marc | C42: KSV Riol | D42: 11 | E42: 55 | F42: 5 | G42: 9342 | H42: 849.27 | I42: 889
A43: 42 | B43: Klink, Daniel | C43: KSV Riol | D43: 11 | E43: 53 | F43: 4.82 | G43: 9333 | H43: 848.45 | I43: 931
A44: 43 | B44: Gietmann, Udo | C44: BW 61 Mülheim | D44: 10 | E44: 53 | F44: 5.3 | G44: 8308 | H44: 830.8 | I44: 904
A45: 44 | B45: Vogel, Jens | C45: KSG BG 99 Neuhof | D45: 11 | E45: 52 | F45: 4.73 | G45: 9163 | H45: 833 | I45: 917
A46: 45 | B46: van de Kamer, Björn | C46: BW 61 Mülheim | D46: 10 | E46: 52 | F46: 5.2 | G46: 8324 | H46: 832.4 | I46: 878
A47: 46 | B47: Schad, Jochen | C47: KSG BG 99 Neuhof | D47: 9 | E47: 51 | F47: 5.67 | G47: 7558 | H47: 839.78 | I47: 912
A48: 47 | B48: Ahlers, Andre | C48: KSG Tecklenburger Land | D48: 10 | E48: 51 | F48: 5.1 | G48: 8367 | H48: 836.7 | I48: 905
A49: 48 | B49: Henkel, Boris | C49: KSG BG 99 Neuhof | D49: 11 | E49: 50 | F49: 4.55 | G49: 9110 | H49: 828.18 | I49: 888
A50: 49 | B50: Möller, Dieter | C50: KSG BG 99 Neuhof | D50: 7 | E50: 50 | F50: 7.14 | G50: 5724 | H50: 817.71 | I50: 885
A51: 50 | B51: Kuenkamp, Michael | C51: BW 61 Mülheim | D51: 8 | E51: 49 | F51: 6.13 | G51: 6700 | H51: 837.5 | I51: 894
A52: 51 | B52: Heinichen, Robert | C52: SK Münstermaifeld | D52: 9 | E52: 48 | F52: 5.33 | G52: 7474 | H52: 830.44 | I52: 874
A53: 52 | B53: Stumpe, Dieter | C53: KSG Tecklenburger Land | D53: 7 | E53: 47 | F53: 6.71 | G53: 5942 | H53: 848.86 | I53: 925
A54: 53 | B54: Habeth, Thomas | C54: SK Heiligenhaus | D54: 10 | E54: 47 | F54: 4.7 | G54: 8379 | H54: 837.9 | I54: 877
A55: 54 | B55: Martschin, Michael | C55: BW 61 Mülheim | D55: 6 | E55: 42 | F55: 7 | G55: 5064 | H55: 844 | I55: 906
A56: 55 | B56: Förster, Frank | C56: SKC 67 Paffrath | D56: 5 | E56: 40 | F56: 8 | G56: 4372 | H56: 874.4 | I56: 894
A57: 56 | B57: Kammler, Christian | C57: SK Heiligenhaus | D57: 7 | E57: 37 | F57: 5.29 | G57: 5900 | H57: 842.86 | I57: 886
A58: 57 | B58: Häussler, Jochen | C58: SKC 67 Paffrath | D58: 9 | E58: 37 | F58: 4.11 | G58: 7497 | H58: 833 | I58: 895
A59: 58 | B59: Röttgen, Hans-Joachim | C59: KSF Chemie Holten-Duisburg | D59: 5 | E59: 34 | F59: 6.8 | G59: 4176 | H59: 835.2 | I59: 868
A60: 59 | B60: Wagner, Hilbert | C60: KF Oberthal | D60: 4 | E60: 33 | F60: 8.25 | G60: 3747 | H60: 936.75 | I60: 962
A61: 60 | B61: Ratzko, Alexander | C61: SK Heiligenhaus | D61: 6 | E61: 32 | F61: 5.33 | G61: 5051 | H61: 841.83 | I61: 857
A62: 61 | B62: Lambers, Christian | C62: KSG Tecklenburger Land | D62: 6 | E62: 30 | F62: 5 | G62: 4941 | H62: 823.5 | I62: 888
A63: 62 | B63: Köhl, Gerd | C63: SK Münstermaifeld | D63: 6 | E63: 26 | F63: 4.33 | G63: 4949 | H63: 824.83 | I63: 851
A64: 63 | B64: Kockmann, Thorsten | C64: KF Oberthal | D64: 7 | E64: 24 | F64: 3.43 | G64: 5852 | H64: 836 | I64: 865
A65: 64 | B65: Schröder, Jörg | C65: SKC 67 Paffrath | D65: 6 | E65: 24 | F65: 4 | G65: 4997 | H65: 832.83 | I65: 901
A66: 65 | B66: Schmedt, Werner | C66: KSG Tecklenburger Land | D66: 5 | E66: 23 | F66: 4.6 | G66: 4059 | H66: 811.8 | I66: 876
A67: 66 | B67: Vogel, Frank | C67: KSG BG 99 Neuhof | D67: 5 | E67: 22 | F67: 4.4 | G67: 4234 | H67: 846.8 | I67: 873
A68: 67 | B68: Balzer, Werner | C68: KSG BG 99 Neuhof | D68: 5 | E68: 18 | F68: 3.6 | G68: 4056 | H68: 811.2 | I68: 849
A69: 68 | B69: Springer, Patrick | C69: BW 61 Mülheim | D69: 7 | E69: 16 | F69: 2.29 | G69: 5609 | H69: 801.29 | I69: 831
A70: 69 | B70: Liefgen, Marcel | C70: KSF Chemie Holten-Duisburg | D70: 6 | E70: 16 | F70: 2.67 | G70: 4423 | H70: 737.17 | I70: 854
A71: 70 | B71: Diegmüller, Markus | C71: KSG BG 99 Neuhof | D71: 5 | E71: 13 | F71: 2.6 | G71: 3935 | H71: 787 | I71: 802
A72: 71 | B72: Bacinski, Sascha | C72: Ninepin 09 Iserlohn | D72: 4 | E72: 12 | F72: 3 | G72: 3335 | H72: 833.75 | I72: 849
A73: 72 | B73: Holler, Robin | C73: SK Heiligenhaus | D73: 2 | E73: 12 | F73: 6 | G73: 1631 | H73: 815.5 | I73: 861
A74: 73 | B74: Bohn, Christian | C74: KSV Riol | D74: 1 | E74: 5 | F74: 5 | G74: 829 | H74: 829 | I74: 829
A75: 74 | B75: Henniges, Jann | C75: BW 61 Mülheim | D75: 1 | E75: 2 | F75: 2 | G75: 830 | H75: 830 | I75: 830
A76: 75 | B76: Pock, Manfred | C76: SK Heiligenhaus | D76: 1 | E76: 2 | F76: 2 | G76: 788 | H76: 788 | I76: 788
A77: 76 | B77: Fischer, Matthias | C77: KSG BG 99 Neuhof | D77: 2 | E77: 2 | F77: 1 | G77: 1527 | H77: 763.5 | I77: 766
A78: 77 | B78: Petry, Pascal | C78: KF Oberthal | D78: 1 | E78: 1 | F78: 1 | G78: 815 | H78: 815 | I78: 815
A79: 78 | B79: Hein, Hermann Josef | C79: SK Münstermaifeld | D79: 1 | E79: 1 | F79: 1 | G79: 797 | H79: 797 | I79: 797
A80: 79 | B80: Blum, Stefan | C80: BW 61 Mülheim | D80: 1 | E80: 1 | F80: 1 | G80: 775 | H80: 775 | I80: 775
A81: 80 | B81: Gerhardus, Wolfgang | C81: SKC 67 Paffrath | D81: 1 | E81: 1 | F81: 1 | G81: 774 | H81: 774 | I81: 774
A82: 81 | B82: Benedens, Tim | C82: SK Heiligenhaus | D82: 1 | E82: 1 | F82: 1 | G82: 707 | H82: 707 | I82: 707
A83: 82 | B83: Benedens, Tim | C83: SK Heiligenhaus | D83: 1 | E83: 1 | F83: 1 | G83: 707 | H83: 707 | I83: 707

A1: SK Münstermaifeld 1 | D1: Blau-Weiß 61 Mülheim 1
A2: Göbel, Benrd | B2: 849 | C2: 9 | D2: Springer, Patrik | E2: 831 | F2: 6
A3: Heinichen, Robert | B3: 810 | C3: 4 | D3: Pohl, Joachim | E3: 838 | F3: 8
A4: Mitscher, Alfredr | B4: 861 | C4: 11 | D4: Krefter, Rainer | E4: 783 | F4: 1
A5: Port, Volker | B5: 838 | C5: 7 | D5: Gietmann, Udo | E5: 787 | F5: 2
A6: Stoffels, Rainer | B6: 863 | C6: 12 | D6: Martschin, Michael | E6: 853 | F6: 10
A7: Köhl, Gerd | B7: 820 | C7: 5 | D7: van de Kamer, Björn | E7: 807 | F7: 3
A8: Einzelwertungspunkte (EWP) | C8: 48 | D8: 30
A9: Punkte | C9: 3 | D9: 0
A10: Holzzahl | C10: 5041 | D10: 4899

A1: Blau-Weiß 61 Mülheim | D1: SK Heilingenhaus 1
A2: Gietmann, Udo | B2: 904 | C2: 12 | D2: Holler, Robin | E2: 770 | F2: 1
A3: Pohl, Achim | B3: 815 | C3: 5 | D3: Pock, Manfred | E3: 788 | F3: 2
A4: Krefter, Rainer | B4: 841 | C4: 8 | D4: Mittelstädt, Daniel | E4: 901 | F4: 11
A5: Martschin, Michael | B5: 831 | C5: 6 | D5: Kammler, Christian | E5: 796 | F5: 3
A6: van de Kamer,Björn | B6: 832 | C6: 7 | D6: Parassini, Holger | E6: 878 | F6: 10
A7: Huenkamp, Michael | B7: 815 | C7: 4 | D7: Habeth, Thomas | E7: 877 | F7: 9
A8: Einzelwertungspunkte (EWP) | C8: 492 | D8: 36
A9: Punkte | C9: 2 | D9: 1
A10: Holzzahl | C10: 5038 | D10: 5010

A1: Blau-Weiß 61 Mülheim | D1: KF Obertal 1
A2: Gietmann, Udo | B2: 835 | C2: 3 | D2: Mayer, Holger | E2: 912 | F2: 12
A3: Pohl, Achim | B3: 861 | C3: 5 | D3: Gebauer, Markus | E3: 874 | F3: 9
A4: Krefter, Rainer | B4: 863 | C4: 6 | D4: Schulz, Daniel | E4: 883 | F4: 10
A5: Martschin, Michael | B5: 831 | C5: 2 | D5: Schöneberger, Daniel | E5: 846 | F5: 4
A6: van de Kamer | B6: 867 | C6: 7 | D6: Wagner, Jürgen | E6: 867 | F6: 8
A7: Huenkamp, Michael | B7: 894 | C7: 11 | D7: Kockmann, Thorsten | E7: 825 | F7: 1
A8: Einzelwertungspunkte (EWP) | C8: 42 | D8: 36
A9: Punkte | C9: 0 | D9: 3
A10: Holzzahl | C10: 5151 | D10: 5207

A1: KSF Chemie Holten-Duisburg 1 | D1: Blau-Weiß 61 Mülheim 1
A2: Panneck, Ralf | B2: 877 | C2: 11 | D2: Kuenkamp, Michael | E2: 799 | F2: 2
A3: Stenger, Stephan | B3: 895 | C3: 12 | D3: Pohl, Joachim | E3: 812 | F3: 5
A4: Schneimann, Marcel | B4: 876 | C4: 10 | D4: Krefter, Rainer | E4: 819 | F4: 8
A5: Martini, Knut | B5: 812 | C5: 3 | D5: Gietmann, Udo | E5: 818 | F5: 7
A6: Hippert, Uwe | B6: 843 | C6: 9 | D6: Martschin, Michael | E6: 812 | F6: 4
A7: Röttgen, Hans-Joachim | B7: 818 | C7: 6 | D7: van de Kamer, Björn | E7: 783 | F7: 1
A8: Einzelwertungspunkte (EWP) | C8: 51 | D8: 27
A9: Punkte | C9: 3 | D9: 0
A10: Holzzahl | C10: 5151 | D10: 5059

A1: KSG BG 99 Neuhof 1 | D1: Blau-Weiß 61 Mülheim 1
A2: Vogel, Frank | B2: 848 | C2: 6 | D2: Gietmann, Udo | E2: 830 | F2: 5
A3: Vogel, Jens | B3: 873 | C3: 10 | D3: Pohl, Joachim | E3: 870 | F3: 8
A4: Henkel, Boris | B4: 812 | C4: 2 | D4: Springer, Patrick | E4: 787 | F4: 1
A5: Möller, Dieter | B5: 871 | C5: 9 | D5: Krefter, Rainer | E5: 830 | F5: 4
A6: Vogel, Boris | B6: 864 | C6: 7 | D6: Martschin, Michael | E6: 906 | F6: 12
A7: Schad, Jochen | B7: 882 | C7: 11 | D7: van de Kamer, Björn | E7: 813 | F7: 3
A8: Einzelwertungspunkte (EWP) | C8: 45 | D8: 33
A9: Punkte | C9: 2 | D9: 1
A10: Holzzahl | C10: 5150 | D10: 5036

A1: Blau-Weiß 61 Mülheim | D1: KSG Tecklenburger Land 1
A2: Gietmann, Udo | B2: 829 | C2: 6 | D2: Verlemann, Andre | E2: 846 | F2: 10
A3: Pohl, Achim | B3: 894 | C3: 12 | D3: Lambers, Christian | E3: 812 | F3: 4
A4: Krefter, Rainer | B4: 875 | C4: 11 | D4: Klein. Thomas | E4: 829 | F4: 7
A5: Martschin, Michael | B5: 831 | C5: 8 | D5: Meck, Stefan | E5: 773 | F5: 1
A6: van de Kamer | B6: 796 | C6: 3 | D6: Ahlers, Andre | E6: 825 | F6: 5
A7: Huenkamp, Michael | B7: 842 | C7: 9 | D7: Lampe, Stefan | E7: 778 | F7: 2
A8: Einzelwertungspunkte (EWP) | C8: 49 | D8: 29
A9: Punkte | C9: 3 | D9: 0
A10: Holzzahl | C10: 5067 | D10: 4863
A11: eingewechselt ab 46 Wurf Patrick Springer für Björn van de Kamer

A1: KSV Riol 1 | D1: Blau-Weiß 61 Mülheim 1
A2: Knobel, Kai | B2: 849 | C2: 8 | D2: Kuenkamp, Michael | E2: 821 | F2: 3
A3: Blasen, Steve | B3: 900 | C3: 12 | D3: Pohl, Joachim | E3: 812 | F3: 2
A4: Mickisch, Horst | B4: 868 | C4: 9 | D4: Krefter, Rainer | E4: 843 | F4: 7
A5: Klink, Daniel (5) | B5: 835 | C5: 5 | D5: Springer, Patrick | E5: 823 | F5: 4
A6: Glöckner, Marc (6) | B6: 835 | C6: 6 | D6: Blum, Stefan | E6: 775 | F6: 1
A7: Hoffmann, Martin | B7: 876 | C7: 10 | D7: van de Kamer, Björn | E7: 878 | F7: 11
A8: Einzelwertungspunkte (EWP) | C8: 50 | D8: 28
A9: Punkte | C9: 3 | D9: 0
A10: Holzzahl | C10: 5163 | D10: 4952

A1: Blau-Weiß 61 Mülheim 1 | D1: Ninepin 09 Iserlohn 1
A2: Gietmann, Udo | B2: 873 | C2: 10 | D2: Klöpper, Hans Joachim | E2: 856 | F2: 8
A3: Pohl, Joachim | B3: 871 | C3: 9 | D3: Förster, Jörg | E3: 855 | F3: 7
A4: Springer, Patrick | B4: 817 | C4: 1 | D4: Kargus, Carsten | E4: 881 | F4: 11
A5: Krefter, Rainer | B5: 854 | C5: 6 | D5: Steinke, Christian | E5: 885 | F5: 12
A6: van de Kamer, Björn | B6: 854 | C6: 5 | D6: Nielinger, Michael | E6: 845 | F6: 3
A7: Henniges, Jann | B7: 830 | C7: 2 | D7: Bacinski, Sascha | E7: 849 | F7: 4
A8: Einzelwertungspunkte (EWP) | C8: 33 | D8: 45
A9: Punkte | C9: 0 | D9: 3
A10: Holzzahl | C10: 5099 | D10: 5171

A1: SKC 67 Paffrath 1 | D1: Blau-Weiß 61 Mülheim 1
A2: Laukmann, André | B2: 907 | C2: 11 | D2: Kuenkamp, Michael | E2: 836 | F2: 5
A3: Immendorff, Bernardo | B3: 847 | C3: 6 | D3: Pohl, Joachim | E3: 848 | F3: 7
A4: Schröder, Jörg | B4: 901 | C4: 10 | D4: Krefter, Rainer | E4: 822 | F4: 2
A5: Rittmann, Marko | B5: 877 | C5: 8 | D5: Springer, Patrick | E5: 790 | F5: 1
A6: Grohmann, Florian | B6: 909 | C6: 12 | D6: van de Kamer, Björn | E6: 833 | F6: 4
A7: Förster, Frank | B7: 882 | C7: 9 | D7: Gietmann, Udo | E7: 829 | F7: 3
A8: Einzelwertungspunkte (EWP) | C8: 56 | D8: 22
A9: Punkte | C9: 3 | D9: 0
A10: Holzzahl | C10: 5323 | D10: 4958

A1: Blau-Weiß 61 Mülheim 1 | D1: SK Münstermaifeld 1
A2: Kuenkamp, Michael | B2: 848 | C2: 8 | D2: Heinichen, Robert | E2: 838 | F2: 6
A3: Pohl, Joachim | B3: 899 | C3: 12 | D3: Göbel, Bernd | E3: 850 | F3: 9
A4: Springer, Patrick | B4: 803 | C4: 2 | D4: Stoffels, Rainer | E4: 832 | F4: 5
A5: Krefter, Rainer | B5: 855 | C5: 10 | D5: Killadt, Mike | E5: 824 | F5: 4
A6: van de Kamer, Björn | B6: 841 | C6: 7 | D6: Mitscher, Alfred | E6: 868 | F6: 11
A7: Gietmann, Udo | B7: 822 | C7: 3 | D7: Hein, Hermann Josef | E7: 797 | F7: 1
A8: Einzelwertungspunkte (EWP) | C8: 42 | D8: 36
A9: Punkte | C9: 2 | D9: 1
A10: Holzzahl | C10: 5068 | D10: 5009

A1: SK Heligenhaus1 | D1: Blau-Weiß 61 Mülheim 1
A2: Grote, Marcel | B2: 844 | C2: 6 | D2: Kuenkamp, Michael | E2: 845 | F2: 7
A3: Mittelstädt, Daniel | B3: 954 | C3: 12 | D3: Pohl, Joachim | E3: 806 | F3: 3
A4: Perez, Jose | B4: 895 | C4: 11 | D4: Krefter, Rainer | E4: 888 | F4: 10
A5: Ratzko, Alexander | B5: 853 | C5: 8 | D5: Springer, Patrick | E5: 758 | F5: 1
A6: Parassini, Holger | B6: 888 | C6: 9 | D6: Gietmann, Udo | E6: 781 | F6: 2
A7: Habeth, Thomas | B7: 831 | C7: 5 | D7: van de Kamer, Björn | E7: 816 | F7: 4
A8: Einzelwertungspunkte (EWP) | C8: 51 | D8: 27
A9: Punkte | C9: 3 | D9: 0
A10: Holzzahl | C10: 5265 | D10: 4894

A1: Datum | B1: Spieltag | C1: Nr. | D1: Uhrzeit | E1: Heim | G1: Gast | H1: Punkte | I1: ZW | J1: Holz
A2: 03.09.2011 | B2: 1 | C2: 1 | D2: 14:00 | E2: SKC Paffrath | F2: - | G2: Ninepin 09 Iserlohn | H2: 3 : 0 | I2: 54:24 | J2: 5337:5071
C3: 2 | D3: 15:00 | E3: SK Münstermaifeld | F3: - | G3: KSV Riol | H3: 0 : 3 | I3: 33:45 | J3: 5159:5244
C4: 3 | D4: 15:00 | E4: SK Heiligenhaus | F4: - | G4: Blau-Weiß 61 Mülheim | H4: 3 : 0 | I4: 51:27 | J4: 5265:4894
C5: 4 | D5: 14:00 | E5: KF Oberthal | F5: - | G5: KSG BG 99 Neuhof | H5: 3 : 0 | I5: 57:21 | J5: 5735:4890
C6: 5 | D6: 15:00 | E6: KSF Chemie Holten-Duisburg | F6: - | G6: KSG Tecklenburger-Land | H6: 3 : 0 | I6: 57:21 | J6: 5222:4746
A7: 10.09.2011 | B7: 2 | C7: 6 | D7: 16:00 | E7: KSV Riol | F7: - | G7: SKC Paffrath | H7: 3 : 0 | I7: 49:30 | J7: 5302:5142
C8: 7 | D8: 13:00 | E8: Ninepin 09 Iserlohn | F8: - | G8: KSG Tecklenburger-Land | H8: 3 0 | I8: 57:21 | J8: 5175:4709
C9: 8 | D9: 16:00 | E9: Blau-Weiß 61 Mülheim | F9: - | G9: SK Münstermaifeld | H9: 2 : 1 | I9: 42:36 | J9: 5068:5009
C10: 9 | D10: 13:00 | E10: KSG BG 99 Neuhof | F10: - | G10: SK Heiligenhaus | H10: 0 : 3 | I10: 35:43 | J10: 5152:5171
C11: 10 | D11: 15:00 | E11: KSF Chemie Holten-Duisburg | F11: - | G11: KF Oberthal | H11: 2 : 1 | I11: 47:31 | J11: 5116:4981
A12: 17.09.2011 | B12: 3 | C12: 11 | D12: 14:00 | E12: SKC Paffrath | F12: - | G12: Blau-Weiß 61 Mülheim | H12: 3 : 0 | I12: 56:22 | J12: 5323:4988
C13: 12 | D13: 13:00 | E13: Ninepin 09 Iserlohn | F13: - | G13: KSV Riol | H13: 2 . 1 | I13: 46:32 | J13: 5119:5031
C14: 13 | D14: 15:00 | E14: SK Münstermaifeld | F14: - | G14: KSG BG 99 Neuhof | H14: 3 : 0 | I14: 57:21 | J14: 5301:4784
C15: 14 | D15: 15:00 | E15: SK Heiligenhaus | F15: - | G15: KSF Chemie Holten-Duisburg | H15: 3 : 0 | I15: 49:29 | J15: 5231:5085
C16: 15 | D16: 15:00 | E16: KSG Tecklenburger-Land | F16: - | G16: KF Oberthal | H16: 2 : 1 | I16: 40:38 | J16: 5175:5150
A17: 18.09.2011 | B17: 4 | C17: 16 | D17: 10:00 | E17: SKC Paffrath | F17: - | G17: KSG BG 99 Neuhof | H17: 3 : 0 | I17: 57:21 | J17: 5371:4768
C18: 17 | D18: 10:00 | E18: Blau-Weiß 61 Mülheim | F18: - | G18: Ninepin 09 Iserlohn | H18: 0 : 3 | I18: 33:45 | J18: 5099:5171
C19: 18 | D19: 10:00 | E19: KSG Tecklenburger-Land | F19: - | G19: KSV Riol | H19: 2 : 1 | I19: 46:32 | J19: 5178:5024
C20: 19 | D20: 10:00 | E20: SK Münstermaifeld | F20: - | G20: KSF Chemie Holten-Duisburg | H20: 2 : 1 | I20: 43:35 | J20: 5201:5110
C21: 20 | D21: 10:00 | E21: KF Oberthal | F21: - | G21: SK Heiligenhaus | H21: 2 : 1 | I21: 44:34 | J21: 5221:5137
A22: 01.10.2011 | B22: 5 | C22: 21 | D22: 15:00 | E22: KSF Chemie Holten-Duisburg | F22: - | G22: SKC Paffrath | H22: 3 : 0 | I22: 50:28 | J22: 5094:4889
C23: 22 | D23: 13:00 | E23: Ninepin 09 Iserlohn | F23: - | G23: Ninepin 09 Iserlohn | H23: 3 : 0 | I23: 57:21 | J23: 5164:4710
C24: 23 | D24: 16:00 | E24: KSV Riol | F24: - | G24: Blau-Weiß 61 Mülheim | H24: 3 : 0 | I24: 50:28 | J24: 5163:4952
C25: 24 | D25: 15:00 | E25: SK Münstermaifeld | F25: - | G25: KF Oberthal | H25: 2 : 1 | I25: 42:36 | J25: 5265:5174
C26: 25 | D26: 15:00 | E26: KSG Tecklenburger-Land | F26: - | G26: SK Heiligenhaus | H26: 3 : 0 | I26: 51:27 | J26: 5309:5044
A27: 15.10.2011 | B27: 6 | C27: 26 | D27: 14:00 | E27: SKC Paffrath | F27: - | G27: KF Oberthal
C28: 27 | D28: 13:00 | E28: Ninepin 09 Iserlohn | F28: - | G28: KSF Chemie Holten-Duisburg
C29: 28 | D29: 13:00 | E29: KSG BG 99 Neuhof | F29: - | G29: KSV Riol
C30: 29 | D30: 16:00 | E30: Blau-Weiß 61 Mülheim | F30: - | G30: KSG Tecklenburger-Land
C31: 30 | D31: 15:00 | E31: SK Heiligenhaus | F31: - | G31: SK Münstermaifeld
A32: 22.10.2011 | B32: 7 | C32: 31 | D32: 14:00 | E32: SKC Paffrath | F32: - | G32: SK Heiligenhaus
C33: 32 | D33: 14:00 | E33: KF Oberthal | F33: - | G33: Ninepin 09 Iserlohn
C34: 33 | D34: 16:00 | E34: KSV Riol | F34: - | G34: KSF Chemie Holten-Duisburg
C35: 34 | D35: 13:00 | E35: KSG BG 99 Neuhof | F35: - | G35: Blau-Weiß 61 Mülheim
C36: 35 | D36: 15:00 | E36: KSG Tecklenburger-Land | F36: - | G36: SK Münstermaifeld
A37: 23.10.2011 | B37: 8 | C37: 36 | D37: 10:00 | E37: SK Münstermaifeld | F37: - | G37: SKC Paffrath
C38: 37 | D38: 10:00 | E38: SK Heiligenhaus | F38: - | G38: Ninepin 09 Iserlohn
C39: 38 | D39: 10:00 | E39: KF Oberthal | F39: - | G39: KSV Riol
C40: 39 | D40: 10:00 | E40: KSF Chemie Holten-Duisburg | F40: - | G40: Blau-Weiß 61 Mülheim
C41: 40 | D41: 10:00 | E41: KSG BG 99 Neuhof | F41: - | G41: KSG Tecklenburger-Land
A42: 12.11.2011 | B42: 9 | C42: 41 | D42: 15:00 | E42: KSG Tecklenburger-Land | F42: - | G42: SKC Paffrath
C43: 42 | D43: 13:00 | E43: Ninepin 09 Iserlohn | F43: - | G43: SK Münstermaifeld
C44: 43 | D44: 16:00 | E44: KSV Riol | F44: - | G44: KSV Riol
C45: 44 | D45: 16:00 | E45: Blau-Weiß 61 Mülheim | F45: - | G45: KF Oberthal
C46: 45 | D46: 15::00 | E46: KSF Chemie Holten-Duisburg | F46: - | G46: KSG BG 99 Neuhof

A1: Datum | B1: Spieltag | C1: Nr. | D1: Uhrzeit | E1: Heim | G1: Gast | H1: Punkte | I1: ZW | J1: Holz
A2: 19.11.2011 | B2: 10 | C2: 46 | D2: 13:00 | E2: Ninepin 09 Iserlohn | F2: - | G2: SKC Paffrath
C3: 47 | D3: 16:00 | E3: KSV Riol | F3: - | G3: SK Münstermaifeld
C4: 48 | D4: 16:00 | E4: Blau-Weiß 61 Mülheim | F4: - | G4: SK Heiligenhaus
C5: 49 | D5: 13:00 | E5: KSG BG 99 Neuhof | F5: - | G5: KF Oberthal
C6: 50 | D6: 15:00 | E6: KSG Tecklenburger-Land | F6: - | G6: KSF Chemie Holten-Duisburg
A7: 26.11.2011 | B7: 11 | C7: 51 | D7: 14:00 | E7: SKC Paffrath | F7: - | G7: KSV Riol
C8: 52 | D8: 15:00 | E8: KSG Tecklenburger-Land | F8: - | G8: Ninepin 09 Iserlohn
C9: 53 | D9: 15:00 | E9: SK Münstermaifeld | F9: - | G9: Blau-Weiß 61 Mülheim
C10: 54 | D10: 15:00 | E10: SK Heiligenhaus | F10: - | G10: KSG BG 99 Neuhof
C11: 55 | D11: 14:00 | E11: KF Oberthal | F11: - | G11: KSF Chemie Holten-Duisburg
A12: 10.12.2011 | B12: 12 | C12: 56 | D12: 16:00 | E12: Blau-Weiß 61 Mülheim | F12: - | G12: SKC Paffrath
C13: 57 | D13: 16:00 | E13: KSV Riol | F13: - | G13: Ninepin 09 Iserlohn
C14: 58 | D14: 13:00 | E14: KSG BG 99 Neuhof | F14: - | G14: SK Münstermaifeld
C15: 59 | D15: 15:00 | E15: KSF Chemie Holten-Duisburg | F15: - | G15: SK Heiligenhaus
C16: 60 | D16: 14:00 | E16: KF Oberthal | F16: - | G16: KSG Tecklenburger-Land
A17: 11.12.2011 | B17: 13 | C17: 61 | D17: 10:00 | E17: KSG BG 99 Neuhof | F17: - | G17: SKC Paffrath
C18: 62 | D18: 10:00 | E18: Ninepin 09 Iserlohn | F18: - | G18: Blau-Weiß 61 Mülheim
C19: 63 | D19: 10:00 | E19: KSV Riol | F19: - | G19: KSG Tecklenburger-Land
C20: 64 | D20: 10:00 | E20: KSF Chemie Holten-Duisburg | F20: - | G20: SK Münstermaifeld
C21: 65 | D21: 10:00 | E21: SK Heiligenhaus | F21: - | G21: KF Oberthal
A22: 17.12.2011 | B22: 14 | C22: 66 | D22: 14:00 | E22: SKC Paffrath | F22: - | G22: KSF Chemie Holten-Duisburg
C23: 67 | D23: 13:00 | E23: Ninepin 09 Iserlohn | F23: - | G23: Ninepin 09 Iserlohn
C24: 68 | D24: 16:00 | E24: Blau-Weiß 61 Mülheim | F24: - | G24: KSV Riol
C25: 69 | D25: 14:00 | E25: KF Oberthal | F25: - | G25: SK Münstermaifeld
C26: 70 | D26: 15:00 | E26: SK Heiligenhaus | F26: - | G26: KSG Tecklenburger-Land
A27: 14.01.2012 | B27: 15 | C27: 71 | D27: 14:00 | E27: KF Oberthal | F27: - | G27: SKC Paffrath
C28: 72 | D28: 15:00 | E28: KSF Chemie Holten-Duisburg | F28: - | G28: Ninepin 09 Iserlohn
C29: 73 | D29: 16:00 | E29: KSV Riol | F29: - | G29: KSG BG 99 Neuhof
C30: 74 | D30: 15:00 | E30: KSG Tecklenburger-Land | F30: - | G30: Blau-Weiß 61 Mülheim
C31: 75 | D31: 15:00 | E31: SK Münstermaifeld | F31: - | G31: SK Heiligenhaus
A32: 21.01.2012 | B32: 16 | C32: 76 | D32: 15:00 | E32: SK Heiligenhaus | F32: - | G32: SKC Paffrath
C33: 77 | D33: 13:00 | E33: Ninepin 09 Iserlohn | F33: - | G33: KF Oberthal
C34: 78 | D34: 15:00 | E34: KSF Chemie Holten-Duisburg | F34: - | G34: KSV Riol
C35: 79 | D35: 16:00 | E35: Blau-Weiß 61 Mülheim | F35: - | G35: KSG BG 99 Neuhof
C36: 80 | D36: 15:00 | E36: SK Münstermaifeld | F36: - | G36: KSG Tecklenburger-Land
A37: 22.01.2012 | B37: 17 | C37: 81 | D37: 10:00 | E37: SKC Paffrath | F37: - | G37: SK Münstermaifeld
C38: 82 | D38: 10:00 | E38: Ninepin 09 Iserlohn | F38: - | G38: SK Heiligenhaus
C39: 83 | D39: 10:00 | E39: KSV Riol | F39: - | G39: KF Oberthal
C40: 84 | D40: 10:00 | E40: Blau-Weiß 61 Mülheim | F40: - | G40: KSF Chemie Holten-Duisburg
C41: 85 | D41: 10:00 | E41: KSG Tecklenburger-Land | F41: - | G41: KSG BG 99 Neuhof
A42: 28.01.2012 | B42: 18 | C42: 86 | D42: 13:00 | E42: SKC Paffrath | F42: - | G42: KSG Tecklenburger-Land
C43: 87 | D43: 13:00 | E43: SK Münstermaifeld | F43: - | G43: Ninepin 09 Iserlohn
C44: 88 | D44: 13:00 | E44: KSV Riol | F44: - | G44: KSV Riol
C45: 89 | D45: 13:00 | E45: KF Oberthal | F45: - | G45: Blau-Weiß 61 Mülheim
C46: 90 | D46: 13:00 | E46: KSG BG 99 Neuhof | F46: - | G46: KSF Chemie Holten-Duisburg