A1: KSC 71 Saarn - 1. Mannschaft | B1: KSC 71 Saarn - 1. Mannschaft
A2: Saison 2011/2012 in der Bezirksklasse 1 Mannschaftstabelle nach dem 8. Spieltag Spielerbestenliste nach dem 7. Spieltag 8 Ligenspieltag ( 27.11.11 ) 7 Ligenspieltag ( 13.11.11 ) 6 Ligenspieltag ( 06.11.11 ) 5 Ligenspieltag ( 23.10.11 ) 4 Ligenspieltag ( 16.10.11 ) 3. Ligenspieltag ( 02.10.11 ) 2 Ligenspieltag ( 18.09.11) 1. Ligenspieltag ( 11.09.11 ) | B2: Spielplan und Ergebnisse Bezirksklasse 1 2011/2012 Alle Spielberichte gibt es wie immer unter www.w-k-v.de Hinrunde Rückrunde

A1: Platz | B1: Mannschaft | C1: Spiele | D1: Punkte | E1: Heim | F1: Ausw. | G1: +/- | H1: EWP | I1: Holz | J1: Ø Heim | K1: Ø ausw. | L1: Ø Heim | M1: Ø ausw.
A2: 1 | B2: KSC Hrmonie 64 Walsum | C2: 8 | D2: =E2+F2 -> 21 | E2: 11 | F2: 10 | G2: 9 | H2: 365 | I2: 36398 | J2: 4610.75 | K2: 4488.75 | L2: 768.45833333333337 | M2: 748.125
A3: 2 | B3: SKV Rees 2 | C3: 8 | D3: =E3+F3 -> 17 | E3: 13 | F3: 4 | G3: 2 | H3: 359 | I3: 35626 | J3: 4522.4 | K3: 4338 | L3: 753.73333333333323 | M3: 723
A4: 3 | B4: KSF 32 Duisburg | C4: 8 | D4: =E4+F4 -> 16 | E4: 10 | F4: 6 | G4: 4 | H4: 358 | I4: 34539 | J4: 4350.25 | K4: 4284.5 | L4: 725.04166666666663 | M4: 714.08333333333337
A5: 4 | B5: KSC 71 Saarn | C5: 8 | D5: =E5+F5 -> 14 | E5: 7 | F5: 7 | G5: 2 | H5: 331 | I5: 34826 | J5: 4420.25 | K5: 4286.25 | L5: 736.70833333333337 | M5: 714.375
A6: 5 | B6: SK Kleve | C6: 8 | D6: =E6+F6 -> 12 | E6: 3 | F6: 9 | G6: 3 | H6: 321 | I6: 35265 | J6: 4519.333333333333 | K6: 4341.4 | L6: 753.22222222222217 | M6: 723.56666666666661
A7: 6 | B7: ESV Oberhausen | C7: 8 | D7: =E7+F7 -> 12 | E7: 9 | F7: 3 | G7: 0 | H7: 313 | I7: 34198 | J7: 4188.5 | K7: 4361 | L7: 698.08333333333337 | M7: 726.83333333333337
A8: 7 | B8: SK Kamp-Lintfort 5 | C8: 8 | D8: =E8+F8 -> 3 | E8: 2 | F8: 1 | G8: -9 | H8: 236 | I8: 32345 | J8: 4233.5 | K8: 3852.75 | L8: 705.58333333333337 | M8: 642.125
A9: 8 | B9: Sk Dinslaken 4 | C9: 8 | D9: =E9+F9 -> 1 | E9: 0 | F9: 1 | G9: -11 | H9: 230 | I9: 30694 | J9: 4034.5 | K9: 3639 | L9: 672.41666666666663 | M9: 606.5

A1: Pl. | B1: Spieler | C1: Mannschaft | D1: S. | E1: EWP | F1: Ø | G1: Holz | H1: Ø | I1: Ø H. | J1: Ø A. | K1: Max
A2: 1 | B2: Pohl, Thomas | C2: KSC Harmonie 64 Walsum 1 | D2: 8 | E2: 93 | F2: 11.6 | G2: 6624 | H2: 828.0 | I2: 842.0 | J2: 814.0 | K2: 871
A3: 2 | B3: Pinto, Paulo-Sergio | C3: KSF 32 Duisburg 1 | D3: 8 | E3: 83 | F3: 10.4 | G3: 5993 | H3: 749.1 | I3: 756.3 | J3: 742.0 | K3: 772
A4: 3 | B4: Hübbers, Herbert | C4: SK Kleve 1 | D4: 8 | E4: 80 | F4: 10.0 | G4: 6176 | H4: 772.0 | I4: 770.3 | J4: 773.0 | K4: 803
A5: 4 | B5: Sickelmann, Sebastian | C5: KSC 71 Saarn 1 | D5: 7 | E5: 78 | F5: 11.1 | G5: 5532 | H5: 790.3 | I5: 812.7 | J5: 773.5 | K5: 845
A6: 5 | B6: Pollmann, Klaus | C6: SKV Rees 2 | D6: 7 | E6: 78 | F6: 11.1 | G6: 5456 | H6: 779.4 | I6: 791.0 | J6: 764.0 | K6: 824
A7: 6 | B7: Trost, Christian | C7: KSC Harmonie 64 Walsum 1 | D7: 8 | E7: 77 | F7: 9.6 | G7: 6217 | H7: 777.1 | I7: 768.5 | J7: 785.8 | K7: 817
A8: 7 | B8: Vehreschild, Walter | C8: SK Kleve 1 | D8: 8 | E8: 76 | F8: 9.5 | G8: 6120 | H8: 765.0 | I8: 770.0 | J8: 762.0 | K8: 805
A9: 8 | B9: Hentschel, Henry | C9: KSC 71 Saarn 1 | D9: 8 | E9: 75 | F9: 9.4 | G9: 6021 | H9: 752.6 | I9: 758.8 | J9: 746.5 | K9: 782
A10: 9 | B10: Dohrenbusch, Karl-Heinz | C10: ESV Oberhausen 1 | D10: 8 | E10: 74 | F10: 9.3 | G10: 5942 | H10: 742.8 | I10: 732.3 | J10: 753.3 | K10: 765
A11: 10 | B11: Reckmann, Thomas | C11: SKV Rees 2 | D11: 8 | E11: 71 | F11: 8.9 | G11: 6033 | H11: 754.1 | I11: 761.0 | J11: 742.7 | K11: 792
A12: 11 | B12: Schmidt, Jürgen | C12: KSF 32 Duisburg 1 | D12: 8 | E12: 64 | F12: 8.0 | G12: 5811 | H12: 726.4 | I12: 722.3 | J12: 730.5 | K12: 766
A13: 12 | B13: Eichler, Manfred | C13: KSC 71 Saarn 1 | D13: 7 | E13: 62 | F13: 8.9 | G13: 5233 | H13: 747.6 | I13: 762.3 | J13: 728.0 | K13: 783
A14: 13 | B14: Brandt, Dieter | C14: KSF 32 Duisburg 1 | D14: 8 | E14: 62 | F14: 7.8 | G14: 5763 | H14: 720.4 | I14: 727.8 | J14: 713.0 | K14: 753
A15: 14 | B15: Dolar, Guido | C15: KSC Harmonie 64 Walsum 1 | D15: 8 | E15: 59 | F15: 7.4 | G15: 6060 | H15: 757.5 | I15: 792.5 | J15: 722.5 | K15: 811
A16: 15 | B16: Wilkes, Tobias | C16: SK Kleve 1 | D16: 8 | E16: 58 | F16: 7.3 | G16: 6004 | H16: 750.5 | I16: 763.7 | J16: 742.6 | K16: 791
A17: 16 | B17: Kottkamp, Heribert | C17: ESV Oberhausen 1 | D17: 8 | E17: 56 | F17: 7.0 | G17: 5713 | H17: 714.1 | I17: 690.5 | J17: 737.8 | K17: 765
A18: 17 | B18: Markett, Werner | C18: SKV Rees 2 | D18: 8 | E18: 55 | F18: 6.9 | G18: 5878 | H18: 734.8 | I18: 751.0 | J18: 707.7 | K18: 766
A19: 18 | B19: Magerl, Kalle | C19: ESV Oberhausen 1 | D19: 8 | E19: 53 | F19: 6.6 | G19: 5716 | H19: 714.5 | I19: 696.8 | J19: 732.3 | K19: 752
A20: 19 | B20: Canta, Guiseppe | C20: SKV Rees 2 | D20: 8 | E20: 52 | F20: 6.5 | G20: 5878 | H20: 734.8 | I20: 734.4 | J20: 735.3 | K20: 767
A21: 20 | B21: Birn, Klaus | C21: SK Kamp-Lintfort 5 | D21: 7 | E21: 49 | F21: 7.0 | G21: 5035 | H21: 719.3 | I21: 738.8 | J21: 693.3 | K21: 769
A22: 21 | B22: Wendlik, Klaus-Jürgen | C22: ESV Oberhausen 1 | D22: 8 | E22: 47 | F22: 5.9 | G22: 5689 | H22: 711.1 | I22: 694.3 | J22: 728.0 | K22: 761
A23: 22 | B23: van Treek, Walter | C23: ESV Oberhausen 1 | D23: 5 | E23: 46 | F23: 9.2 | G23: 3769 | H23: 753.8 | I23: 758.0 | J23: 751.0 | K23: 762
A24: 23 | B24: Formella, Timo | C24: KSC Harmonie 64 Walsum 1 | D24: 8 | E24: 46 | F24: 5.8 | G24: 5826 | H24: 728.3 | I24: 725.3 | J24: 731.3 | K24: 772
A25: 24 | B25: Bartl, Jörg | C25: KSC Harmonie 64 Walsum 1 | D25: 5 | E25: 43 | F25: 8.6 | G25: 3865 | H25: 773.0 | I25: 770.7 | J25: 776.5 | K25: 788
A26: 25 | B26: Sieg, Walter | C26: SKV Rees 2 | D26: 8 | E26: 43 | F26: 5.4 | G26: 5750 | H26: 718.8 | I26: 732.2 | J26: 696.3 | K26: 754
A27: 26 | B27: Ahlburg, Jörg | C27: SK Kamp-Lintfort 5 | D27: 8 | E27: 42 | F27: 5.3 | G27: 5546 | H27: 693.3 | I27: 700.5 | J27: 686.0 | K27: 729
A28: 27 | B28: Knorr, Lothar | C28: SK Dinslaken 4 | D28: 8 | E28: 41 | F28: 5.1 | G28: 5568 | H28: 696.0 | I28: 696.3 | J28: 695.8 | K28: 747
A29: 28 | B29: Cyriax, Achim | C29: KSC 71 Saarn 1 | D29: 8 | E29: 40 | F29: 5.0 | G29: 5619 | H29: 702.4 | I29: 720.3 | J29: 684.5 | K29: 728
A30: 29 | B30: Stange, Peter | C30: KSF 32 Duisburg 1 | D30: 7 | E30: 39 | F30: 5.6 | G30: 4936 | H30: 705.1 | I30: 698.3 | J30: 710.3 | K30: 726
A31: 30 | B31: Wolter, Hans-Joachim | C31: KSF 32 Duisburg 1 | D31: 5 | E31: 38 | F31: 7.6 | G31: 3588 | H31: 717.6 | I31: 744.0 | J31: 700.0 | K31: 762
A32: 31 | B32: Vogt, Karl-Heinz | C32: KSF 32 Duisburg 1 | D32: 7 | E32: 38 | F32: 5.4 | G32: 4950 | H32: 707.1 | I32: 718.0 | J32: 692.7 | K32: 733
A33: 32 | B33: Köhler, Ludwig | C33: SK Dinslaken 4 | D33: 5 | E33: 37 | F33: 7.4 | G33: 3662 | H33: 732.4 | I33: 729.0 | J33: 737.5 | K33: 749
A34: 33 | B34: Schlaghecken, Robert | C34: SKV Rees 2 | D34: 6 | E34: 37 | F34: 6.2 | G34: 4394 | H34: 732.3 | I34: 741.0 | J34: 715.0 | K34: 820
A35: 34 | B35: Mratschkowski, Julian | C35: SK Kamp-Lintfort 5 | D35: 7 | E35: 37 | F35: 5.3 | G35: 4858 | H35: 694.0 | I35: 712.5 | J35: 669.3 | K35: 760
A36: 35 | B36: Dolar, Karl-Werner | C36: KSC Harmonie 64 Walsum 1 | D36: 7 | E36: 36 | F36: 5.1 | G36: 5059 | H36: 722.7 | I36: 730.8 | J36: 712.0 | K36: 755
A37: 36 | B37: Oelschläger, Jürgen | C37: KSC 71 Saarn 1 | D37: 6 | E37: 35 | F37: 5.8 | G37: 4317 | H37: 719.5 | I37: 706.3 | J37: 732.7 | K37: 747
A38: 37 | B38: Saemann, Albert | C38: SK Dinslaken 4 | D38: 6 | E38: 35 | F38: 5.8 | G38: 4219 | H38: 703.2 | I38: 720.0 | J38: 686.3 | K38: 733
A39: 38 | B39: Hommers, Manfred | C39: SK Kleve 1 | D39: 7 | E39: 35 | F39: 5.0 | G39: 4989 | H39: 712.7 | I39: 741.7 | J39: 691.0 | K39: 758
A40: 39 | B40: Watzelt, Adolf | C40: KSF 32 Duisburg 1 | D40: 5 | E40: 34 | F40: 6.8 | G40: 3578 | H40: 715.6 | I40: 733.7 | J40: 688.5 | K40: 759
A41: 40 | B41: van de Kamer, Stefan | C41: SK Kleve 1 | D41: 8 | E41: 34 | F41: 4.3 | G41: 5660 | H41: 707.5 | I41: 744.3 | J41: 685.4 | K41: 780
A42: 41 | B42: Thissen, Christian | C42: SK Kleve 1 | D42: 8 | E42: 33 | F42: 4.1 | G42: 5624 | H42: 703.0 | I42: 729.3 | J42: 687.2 | K42: 754
A43: 42 | B43: Stiebing, Dieter | C43: SK Dinslaken 4 | D43: 7 | E43: 30 | F43: 4.3 | G43: 4725 | H43: 675.0 | I43: 686.3 | J43: 660.0 | K43: 745
A44: 43 | B44: Veelmann, Lothar | C44: ESV Oberhausen 1 | D44: 8 | E44: 30 | F44: 3.8 | G44: 5489 | H44: 686.1 | I44: 675.5 | J44: 696.8 | K44: 726
A45: 44 | B45: Yilmaz, Sadik | C45: SK Kamp-Lintfort 5 | D45: 4 | E45: 27 | F45: 6.8 | G45: 2882 | H45: 720.5 | I45: 729.0 | J45: 712.0 | K45: 762
A46: 45 | B46: Lorenz, Gunther | C46: KSC 71 Saarn 1 | D46: 6 | E46: 25 | F46: 4.2 | G46: 4218 | H46: 703.0 | I46: 691.8 | J46: 725.5 | K46: 741
A47: 46 | B47: Tönnissen, Manfred | C47: SKV Rees 2 | D47: 2 | E47: 22 | F47: 11.0 | G47: 1601 | H47: 800.5 | I47: 800.5 | K47: 819
A48: 47 | B48: Dratwa, Peter | C48: SK Dinslaken 4 | D48: 6 | E48: 19 | F48: 3.2 | G48: 3865 | H48: 644.2 | I48: 650.7 | J48: 637.7 | K48: 719
A49: 48 | B49: Korth, Manfred | C49: SK Kamp-Lintfort 5 | D49: 6 | E49: 16 | F49: 2.7 | G49: 3901 | H49: 650.2 | I49: 668.0 | J49: 641.3 | K49: 682
A50: 49 | B50: Schadowski, Kurt | C50: SK Dinslaken 4 | D50: 3 | E50: 15 | F50: 5.0 | G50: 1405 | H50: 468.3 | J50: 468.3 | K50: 771
A51: 50 | B51: Bracun, Friedhelm | C51: SK Kamp-Lintfort 5 | D51: 2 | E51: 12 | F51: 6.0 | G51: 1436 | H51: 718.0 | I51: 724.0 | J51: 712.0 | K51: 724
A52: 51 | B52: Peters, Tim | C52: SK Kamp-Lintfort 5 | D52: 1 | E52: 11 | F52: 11.0 | G52: 814 | H52: 814.0 | I52: 814.0 | K52: 814
A53: 52 | B53: Orchowski, Dieter | C53: SK Dinslaken 4 | D53: 3 | E53: 11 | F53: 3.7 | G53: 1881 | H53: 627.0 | I53: 662.0 | J53: 609.5 | K53: 662
A54: 53 | B54: Ulrich, Detlef | C54: KSC 71 Saarn 1 | D54: 4 | E54: 11 | F54: 2.8 | G54: 2558 | H54: 639.5 | I54: 696.0 | J54: 583.0 | K54: 699
A55: 54 | B55: Eichenhofer, Nils | C55: SK Kamp-Lintfort 5 | D55: 1 | E55: 10 | F55: 10.0 | G55: 712 | H55: 712.0 | J55: 712.0 | K55: 712
A56: 55 | B56: Fusek, Manfred | C56: SK Kamp-Lintfort 5 | D56: 1 | E56: 10 | F56: 10.0 | G56: 775 | H56: 775.0 | I56: 775.0 | K56: 775
A57: 56 | B57: Doemen, Hans-Josef | C57: SK Kamp-Lintfort 5 | D57: 7 | E57: 10 | F57: 1.4 | G57: 4416 | H57: 630.9 | I57: 639.8 | J57: 619.0 | K57: 665
A58: 57 | B58: Chemello, Mike | C58: SK Kamp-Lintfort 5 | D58: 1 | E58: 9 | F58: 9.0 | G58: 764 | H58: 764.0 | J58: 764.0 | K58: 764
A59: 58 | B59: Grolmuss, Johann | C59: SK Dinslaken 4 | D59: 1 | E59: 9 | F59: 9.0 | G59: 754 | H59: 754.0 | J59: 754.0 | K59: 754
A60: 59 | B60: Trost, Klaus | C60: KSC Harmonie 64 Walsum 1 | D60: 3 | E60: 7 | F60: 2.3 | G60: 2052 | H60: 684.0 | J60: 684.0 | K60: 693
A61: 60 | B61: Lankhorst, Ingo | C61: SK Kleve 1 | D61: 1 | E61: 5 | F61: 5.0 | G61: 692 | H61: 692.0 | J61: 692.0 | K61: 692
A62: 61 | B62: Bernsee, Dominik | C62: KSC 71 Saarn 1 | D62: 2 | E62: 5 | F62: 2.5 | G62: 1328 | H62: 664.0 | J62: 664.0 | K62: 700
A63: 62 | B63: Saemann, Olaf | C63: SK Dinslaken 4 | D63: 3 | E63: 5 | F63: 1.7 | G63: 1829 | H63: 609.7 | I63: 609.7 | K63: 645
A64: 63 | B64: Schmitz, Phillip | C64: KSC Harmonie 64 Walsum 1 | D64: 1 | E64: 4 | F64: 4.0 | G64: 695 | H64: 695.0 | I64: 695.0 | K64: 695
A65: 64 | B65: Duyf, Heinz | C65: ESV Oberhausen 1 | D65: 1 | E65: 4 | F65: 4.0 | G65: 642 | H65: 642.0 | I65: 642.0 | K65: 642
A66: 65 | B66: Pabst, Georg | C66: SK Dinslaken 4 | D66: 1 | E66: 3 | F66: 3.0 | G66: 376 | H66: 376.0 | J66: 376.0 | K66: 376
A67: 66 | B67: Trestik, Hans | C67: SK Dinslaken 4 | D67: 1 | E67: 3 | F67: 3.0 | G67: 651 | H67: 651.0 | I67: 651.0 | K67: 651
A68: 67 | B68: Schaffeld, Jürgen | C68: ESV Oberhausen 1 | D68: 2 | E68: 3 | F68: 1.5 | G68: 1328 | H68: 664.0 | I68: 639.0 | J68: 689.0 | K68: 689
A69: 68 | B69: Kirchgesser, Dieter | C69: SK Kamp-Lintfort 5 | D69: 1 | E69: 2 | F69: 2.0 | G69: 661 | H69: 661.0 | I69: 661.0 | K69: 661
A70: 69 | B70: Hamacher, Udo | C70: SK Dinslaken 4 | D70: 2 | E70: 2 | F70: 1.0 | G70: 1158 | H70: 579.0 | I70: 566.0 | J70: 592.0 | K70: 592
A71: 70 | B71: van Lier, Michael | C71: SKV Rees 2 | D71: 1 | E71: 1 | F71: 1.0 | G71: 646 | H71: 646.0 | J71: 646.0 | K71: 646
A72: 71 | B72: Köster, Thomas | C72: SK Kamp-Lintfort 5 | D72: 1 | E72: 1 | F72: 1.0 | G72: 545 | H72: 545.0 | J72: 545.0 | K72: 545
A73: 72 | B73: Teschke, Günter | C73: SK Dinslaken 4 | D73: 1 | E73: 1 | F73: 1.0 | G73: 601 | H73: 601.0 | I73: 601.0 | K73: 601

A1: KSC 71 Saarn 1 | D1: SK Dinslaken 4
A2: Hentschel, Henry | B2: 765 | C2: 10 | D2: Orchochowski, Hans Dieter | F2: 619 | G2: 5
A3: Oelschläger, JürgenU | B3: 708 | C3: 6 | D3: Dratwa, Dieter | F3: 610 | G3: 4
A4: Eichler, Manfred | B4: 773 | C4: 11 | D4: Knorr, Lothar | F4: 747 | G4: 9
A5: Cyriax; Achim | B5: 726 | C5: 8 | D5: Schadowski, Kurt | F5: 178 | G5: 2
A6: Sickelmann, Sebastian | B6: 804 | C6: 12 | D6: Pabst, Georg | F6: 376 | G6: 3
A7: Lerenz, Gunther | B7: 718 | C7: 7
A8: Einzelwertungspunkte (EWP) | C8: 54 | D8: 23
A9: Punkte | C9: 3 | D9: 0
C10: 4494 | D10: 2530

A1: KSC 71 Saarn 1 | D1: SK Kamp-Lintfort 5
A2: Hentschel, Henry | B2: 782 | C2: 11 | D2: Chemello, Mike | F2: 764 | G2: 9
A3: Ulrich, Detlef | B3: 693 | C3: 5 | D3: Bracun, Friedhelm | F3: 712 | G3: 6
A4: Eichler, Manfred | B4: 779 | C4: 10 | D4: Mratschkowski, Julian | F4: 662 | G4: 4
A5: Cyriax; Achim | B5: 727 | C5: 8 | D5: Ahlburg, Jörg | F5: 722 | G5: 2
A6: Sickelmann, Sebastian | B6: 789 | C6: 12 | D6: Doemen, Hans-Josef | F6: 609 | G6: 2
A7: Lerenz, Gunther | B7: 609 | C7: 1 | D7: Korth, Manfred | F7: 639 | G7: 3
A8: Einzelwertungspunkte (EWP) | C8: 47 | D8: 31
A9: Punkte | C9: 2 | D9: 1
C10: 4379 | D10: 4108

A1: ESV Oberhausen | D1: KSC 71 Saarn 1
A2: Kottkamp, Heribert | B2: 721 | C2: 10 | D2: Hentschel, Henry | F2: 704 | G2: 9
A3: Veelmann, Lothar | B3: 648 | C3: 5 | D3: Ulrich, Detlef | F3: 600 | G3: 1
A4: Dohrenbusch, Karl-Heinz | B4: 607 | C4: 8 | D4: Cyriax, Achim | F4: 620 | G4: 4
A5: Magerl, Kalle | B5: 741 | C5: 11 | D5: Bernsee, Dominik | F5: 628 | G5: 3
A6: Duyf, Heinz | B6: 642 | C6: 4 | D6: Eichler, Manfred | F6: 671 | G6: 6
A7: Wendlik, Klaus-Jürgen | B7: 678 | C7: 7 | D7: Sickelmann, Sebastian | F7: 782 | G7: 12
A8: Einzelwertungspunkte (EWP) | C8: 45 | D8: 33
A9: Punkte | C9: 2 | D9: 1
C10: 4127 | D10: 4005

A1: KSC 71 Saarn 1 | D1: KSC Harmonie 64 Walsum
A2: Hentschel, Henry | B2: 778 | C2: 9 | D2: Trost, Klaus | F2: 693 | G2: 9
A3: Sickelmann, Sebastian | B3: 845 | C3: 12 | D3: Pohl, Thomas | F3: 832 | G3: 11
A4: Oelschläger, Jürgen | B4: 688 | C4: 1 | D4: Trost, Christian | F4: 817 | G4: 10
A5: Cyriax, Achim | B5: 711 | C5: 3 | D5: Dolar, Guido | F5: 764 | G5: 7
A6: Eichler, Manfred | B6: 714 | C6: 4 | D6: Formella, Timo | F6: 736 | G6: 5
A7: Lorens, Gunther | B7: 741 | C7: 6 | D7: Bartl, Jörg | F7: 765 | G7: 8
A8: Einzelwertungspunkte (EWP) | C8: 35 | D8: 43
A9: Punkte | C9: 0 | D9: 3
C10: 4477 | D10: 4607

A1: SK Kleve | D1: KSC 71 Saarn 1
A2: Wilkes, Tobis | B2: 757 | C2: 8 | D2: Oelschläger, Jürgen | F2: 747 | G2: 6
A3: Thissen, Christian | B3: 690 | C3: 1 | D3: Hentschel, Henry | F3: 771 | G3: 11
A4: Hübbers, Herbert | B4: 792 | C4: 12 | D4: Eichler, Manfred | F4: 758 | G4: 9
A5: Van de Kamer, Stefan | B5: 701 | C5: 2 | D5: Cyriax | F5: 728 | G5: 4
A6: Hommers, Walter | B6: 736 | C6: 5 | D6: Sickelmann, Sebastian | F6: 756 | G6: 7
A7: Vehreschild | B7: 761 | C7: 10 | D7: Lorenz, Gunther | F7: 728 | G7: 3
A8: Einzelwertungspunkte (EWP) | C8: 38 | E8: 40
A9: Punkte | C9: 0 | E9: 3
A10: Holzzahl | C10: 4437 | E10: 4488

A1: SKV Rees 2 | D1: KSC 71 Saarn 1
A2: Canta, Guiseppe | B2: 727 | C2: 5 | D2: Oelschläger, Jürgen | E2: 706 | F2: 3
A3: Markett, Werner | B3: 766 | C3: 10 | D3: Hentschel, Henry | E3: 741 | F3: 7
A4: Sieg, Walter | B4: 754 | C4: 8 | D4: Cyriax, Achim | E4: 667 | F4: 1
A5: Reckmann, Thomas | B5: 756 | C5: 9 | D5: Bernsee, Dominik | E5: 700 | F5: 2
A6: Schlaghecken, Robert | B6: 733 | C6: 6 | D6: Lorenz, Gunther | E6: 723 | F6: 4
A7: Pollmann, Klaus | B7: 771 | C7: 12 | D7: Sickelmann, Sebastian | E7: 768 | F7: 11
A8: Einzelwertungspunkte (EWP) | C8: 50 | D8: 28
A9: Punkte | C9: 3 | D9: 0
A10: Holzzahl | C10: 4507 | D10: 4305

A1: KSC 71 Saarn 1 | D1: KSF 32 Duisburg 1
A2: Ulrich, Detlev | B2: 699 | C2: 3 | D2: Vogt, Karl-Heinz | E2: 677 | F2: 1
A3: Hentschel, Henry | B3: 710 | C3: 7 | D3: Brandt, Dieter | E3: 717 | F3: 9
A4: Oelschläger, Jürgen | B4: 723 | C4: 10 | D4: Watzelt, Adolf | E4: 702 | F4: 5
A5: Cyriax, Achim | B5: 717 | C5: 8 | D5: Stange, Peter | E5: 704 | F5: 6
A6: Eichler, Manfred | B6: 783 | C6: 12 | D6: Pinto, Paulo-Sergio | E6: 749 | F6: 11
A7: Lorenz, Gunther | B7: 699 | C7: 4 | D7: Schmiedt, Jürgen | E7: 698 | F7: 2
A8: Einzelwertungspunkte (EWP) | C8: 44 | D8: 34
A9: Punkte | C9: 2 | D9: 1
A10: Holzzahl | C10: 4331 | D10: 4247

A1: SK Dinslaken 4 | D1: KSC 71 Saarn 1
A2: Knorr, Lothar | B2: 705 | C2: 5 | D2: Ulrich, Detlef | E2: 566 | F2: 2
A3: Köhler, Ludwig | B3: 742 | C3: 8 | D3: Hentschel, Henry | E3: 770 | F3: 11
A4: Saemann, Albert | B4: 727 | C4: 7 | D4: Oelschläger, Jürgen | E4: 745 | F4: 9
A5: Saemann, Olaf | B5: 563 | C5: 1 | D5: Cyriax, Achim | E5: 723 | F5: 6
A6: Stiebing, Dieter | B6: 694 | C6: 4 | D6: Eichler, Manfred | E6: 755 | F6: 10
A7: Trestik, Hans | B7: 651 | C7: 3 | D7: Sickelmann, Sebastian | E7: 788 | F7: 12
A8: Einzelwertungspunkte (EWP) | C8: 28 | D8: 50
A9: Punkte | C9: 0 | D9: 3
A10: Holzzahl | C10: 4082 | D10: 4347

A1: new TWTR.Widget({ version: 2, type: 'profile', rpp: 4, interval: 30000, width: 250, height: 300, theme: { shell: { background: '#333333', color: '#ffffff' }, tweets: { background: '#000000', color: '#ffffff', links: '#4aed05' } }, features: { scrollbar: true, loop: false, live: false, hashtags: true, timestamp: true, avatars: false, behavior: 'all' } }).render().setUser('ksc71saarn').start();

A1: Datum | B1: Spieltag | C1: Nr. | D1: Uhrzeit | E1: Heim | G1: Gast | H1: Punkte | I1: ZW | J1: Holz
A2: 11.09.2011 | B2: 1 | C2: 1 | D2: 10:00 | E2: KSF 32 Duisburg | F2: - | G2: SKV Rees | H2: 3 : 0 | I2: 48:30 | J2: 4383:4179
C3: 2 | D3: 13:00 | E3: SK Dinslaken 4 | F3: - | G3: KSC 71 Saarn | H3: 0 : 3 | I3: 28:50 | J3: 4082:4347
C4: 3 | D4: 10:00 | E4: SK Kamp-Lintfort 5 | F4: - | G4: KSC Harmonie 64 Walsum | H4: 0 : 3 | I4: 35:43 | J4: 4327:4449
C5: 4 | D5: 10:00 | E5: SK Kleve | F5: - | G5: ESV Oberhausen | H5: 3 : 0 | I5: 49:29 | J5: 4595:4452
A6: 18.09.2011 | B6: 2 | C6: 5 | D6: 10:00 | E6: ESV Oberhausen | F6: - | G6: SK Kamp-Lintfort 5
C7: 6 | D7: 10:00 | E7: SKV Rees | F7: - | G7: SK Kleve | H7: 2 : 1 | I7: 44:34 | J7: 4584:4402
C8: 7 | D8: 13:00 | E8: KSC 71 Saarn | F8: - | G8: KSF 32 Duisburg | H8: 2 : 1 | I8: 44:34 | J8: 4331:4247
C9: 8 | D9: 10:00 | E9: KSC Harmonie 64 Walsum | F9: - | G9: SK Dinslaken 4 | H9: 3 : 0 | I9: 50:28 | J9: 4555:4152
A10: 02.10.2011 | B10: 3 | C10: 9 | D10: 10:00 | E10: SK Kamp-Lintfort 5 | F10: - | G10: SK Kleve | H10: 0 : 3 | I10: 31 : 47 | J10: 4233 : 4452
C11: 10 | D11: 10:00 | E11: KSF 32 Duisburg | F11: - | G11: KSC Harmonie 64 Walsum | H11: 2 :1 | I11: 45 : 33 | J11: 4314 : 4271
C12: 11 | D12: 13:00 | E12: SK Dinslaken 4 | F12: - | G12: ESV Oberhausen | H12: 0 : 3 | I12: 26 : 52 | J12: 4160 : 4451
C13: 12 | D13: 10:00 | E13: SKV Rees | F13: - | G13: KSC 71 Saarn | H13: 3 : 0 | I13: 50 : 28 | J13: 4507 : 4305
A14: 16.10.2011 | B14: 4 | C14: 13 | D14: 10:00 | E14: KSC Harmonie 64 Walsum | F14: - | G14: SKV Rees | H14: 2 :1 | I14: 39 : 39 | J14: 4469 : 4445
C15: 14 | D15: 10:00 | E15: SK Kleve | F15: - | G15: KSC 71 Saarn | H15: 0 : 3 | I15: 38 : 40 | J15: 4437 : 4488
C16: 15 | D16: 10:00 | E16: SK Kamp-Lintfort 5 | F16: - | G16: SK Dinslaken 4 | H16: 2 : 1 | I16: 40 : 38 | J16: 4197 : 4128
C17: 26 | D17: 10:00 | E17: ESV Oberhausen | F17: - | G17: KSF 32 Duisburg | H17: 2 : 1 | I17: 44 : 34 | J17: 4271 : 4128
A18: 23.10.2011 | B18: 5 | C18: 17 | D18: 13:00 | E18: SK Dinslaken 4 | F18: - | G18: SK Kleve | H18: 0 : 3 | I18: 26 : 52 | J18: 4023 : 4487
C19: 18 | D19: 13:00 | E19: SKV Rees | F19: - | G19: ESV Oberhausen | H19: 3 : 0 | I19: 48 : 30 | J19: 4467 : 4340
C20: 19 | D20: 13:00 | E20: KSC 71 Saarn | F20: - | G20: KSC Harmonie 64 Walsum | H20: 0 : 3 | I20: 35 : 43 | J20: 4477 : 4607
C21: 20 | D21: 13:00 | E21: KSF 32 Duisburg | F21: - | G21: SK Kamp-Lintfort 5 | H21: 3 : 0 | I21: 57 : 21 | J21: 4401 : 3984
A22: 06.11.2011 | B22: 6 | C22: 21 | D22: 10:00 | E22: ESV Oberhausen | F22: - | G22: KSC 71 Saarn
C23: 22 | D23: 13:00 | E23: SK Dinslaken 4 | F23: - | G23: KSF 32 Duisburg
C24: 23 | D24: 10:00 | E24: SK Kamp-Lintfort 5 | F24: - | G24: SKV Rees
C25: 24 | D25: 10:00 | E25: SK Kleve | F25: - | G25: KSC Harmonie 64 Walsum
A26: 13.11.2011 | B26: 7 | C26: 25 | D26: 10:00 | E26: KSC Harmonie 64 Walsum | F26: - | G26: ESV Oberhausen
C27: 26 | D27: 10:00 | E27: KSC 71 Saarn | F27: - | G27: SK Kamp-Lintfort 5
C28: 27 | D28: 10:00 | E28: KSF 32 Duisburg | F28: - | G28: SK Kleve
C29: 28 | D29: 10:00 | E29: SKV Rees | F29: - | G29: SK Dinslaken 4

A1: Datum | B1: Spieltag | C1: Nr. | D1: Uhrzeit | E1: Heim | G1: Gast | H1: Punkte | I1: ZW | J1: Holz
A2: 27.11.2011 | B2: 8 | C2: 29 | D2: 10:00 | E2: SKV Rees | F2: - | G2: KSF 32 Duisburg
C3: 30 | D3: 10:00 | E3: KSC 71 Saarn | F3: - | G3: SK Dinslaken 4
C4: 31 | D4: 10:00 | E4: KSC Harmonie 64 Walsum | F4: - | G4: SK Kamp-Lintfort 5
C5: 32 | D5: 10:00 | E5: ESV Oberhausen | F5: - | G5: SK Kleve
A6: 11.12.2011 | B6: 9 | C6: 33 | D6: 10:00 | E6: SK Kamp-Lintfort 5 | F6: - | G6: ESV Oberhausen
C7: 34 | D7: 10:00 | E7: SK Kleve | F7: - | G7: SKV Rees
C8: 35 | D8: 13:00 | E8: KSF 32 Duisburg | F8: - | G8: KSC 71 Saarn
C9: 36 | D9: 13:00 | E9: SK Dinslaken 4 | F9: - | G9: KSC Harmonie 64 Walsum
A10: 15.01.2012 | B10: 10 | C10: 37 | D10: 10:00 | E10: SK Kleve | F10: - | G10: SK Kamp-Lintfort 5
C11: 38 | D11: 10:00 | E11: KSC Harmonie 64 Walsum | F11: - | G11: KSF 32 Duisburg
C12: 39 | D12: 10:00 | E12: ESV Oberhausen | F12: - | G12: SK Dinslaken 4
C13: 40 | D13: 10:00 | E13: KSC 71 Saarn | F13: - | G13: SKV Rees
A14: 12.02.2012 | B14: 11 | C14: 41 | D14: 10:00 | E14: SKV Rees | F14: - | G14: KSC Harmonie 64 Walsum
C15: 42 | D15: 10:00 | E15: KSC 71 Saarn | F15: - | G15: SK Kleve
C16: 43 | D16: 13:00 | E16: SK Dinslaken 4 | F16: - | G16: SK Kamp-Lintfort 5
C17: 44 | D17: 10:00 | E17: KSF 32 Duisburg | F17: - | G17: ESV Oberhausen
A18: 26.02.2012 | B18: 12 | C18: 45 | D18: 10:00 | E18: SK Kleve | F18: - | G18: SK Dinslaken 4
C19: 46 | D19: 10:00 | E19: ESV Oberhausen | F19: - | G19: SKV Rees
C20: 47 | D20: 10:00 | E20: KSC Harmonie 64 Walsum | F20: - | G20: KSC 71 Saarn
C21: 48 | D21: 10:00 | E21: SK Kamp-Lintfort 5 | F21: - | G21: KSF 32 Duisburg
A22: 04.03.2012 | B22: 13 | C22: 49 | D22: 13:00 | E22: KSC 71 Saarn | F22: - | G22: ESV Oberhausen
C23: 50 | D23: 10:00 | E23: KSF 32 Duisburg | F23: - | G23: SK Dinslaken 4
C24: 51 | D24: 13:00 | E24: SKV Rees | F24: - | G24: SK Kamp-Lintfort 5
C25: 52 | D25: 10:00 | E25: KSC Harmonie 64 Walsum | F25: - | G25: SK Kleve
A26: 25.03.2012 | B26: 14 | C26: 53 | D26: 10:00 | E26: ESV Oberhausen | F26: - | G26: KSC Harmonie 64 Walsum
C27: 54 | D27: 10:00 | E27: SK Kamp-Lintfort 5 | F27: - | G27: KSC 71 Saarn
C28: 55 | D28: 10:00 | E28: SK Kleve | F28: - | G28: KSF 32 Duisburg
C29: 56 | D29: 10:00 | E29: SK Dinslaken 4 | F29: - | G29: SKV Rees