A1: BW 61 Mülheim - 4. Mannschaft | B1: BW 61 Mülheim - 4. Mannschaft
A2: Saison 2011/2012 in der Kreisliga Gruppe 2 Mannschaftstabelle nach dem 5. Spieltag Spielerbestenliste nach dem 5. Spieltag 5. Ligenspieltag ( 23.10.11 ) 4. Ligenspieltag ( 16.10.11 ) 3. Ligenspieltag (02.10.11) 2. Ligenspieltag (18.09.11) 1. Ligenspieltag (11.09.11) | B2: Spielplan und Ergebnisse Kreisliga 2 2011/2012 Alle Spielberichte gibt es wie immer unter www.w-k-v.de Hinrunde Rückrunde

A1: Platz | B1: Mannschaft | C1: Spiele | D1: Punkte | E1: Heim | F1: Ausw. | G1: +/- | H1: EWP | I1: Holz | J1: Ø Heim | K1: Ø ausw. | L1: Ø Heim | M1: Ø ausw.
A2: 1 | B2: SK Kamp-Lintfort 6 | C2: 5 | D2: =E2+F2 -> 12 | E2: 8 | F2: 4 | G2: 3 | H2: 109 | I2: 14166 | J2: 2871 | K2: 2776.5 | L2: 478.5 | M2: 462.75
A3: 2 | B3: BW 61 Mülheim 4 | C3: 5 | D3: =E3+F3 -> 12 | E3: 6 | F3: 6 | G3: 3 | H3: 97 | I3: 13257 | J3: 2698.6666666666665 | K3: 2580.5 | L3: 449.77777777777777 | M3: 430.08333333333331
A4: 3 | B4: Sk 54/59 Essen-Borbeck 2 | C4: 5 | D4: =E4+F4 -> 10 | E4: 3 | F4: 7 | G4: 4 | H4: 98 | I4: 13700 | J4: 2676 | K4: 2782.6666666666665 | L4: 446 | M4: 463.77777777777777
A5: 4 | B5: SKC Kapellen 2 | C5: 5 | D5: =E5+F5 -> 8 | E5: 4 | F5: 4 | G5: 1 | H5: 78 | I5: 12736 | J5: 2566.5 | K5: 2534.3333333333335 | L5: 427.75 | M5: 422.38888888888891
A6: 5 | B6: SKC Vesalia Wesel 1 | C6: 5 | D6: =E6+F6 -> 7 | E6: 2 | F6: 5 | G6: 1 | H6: 86 | I6: 12741 | J6: 2600 | K6: 2513.6666666666665 | L6: 433.33333333333331 | M6: 418.9444444444444
A7: 6 | B7: SKV Rees 4 | C7: 5 | D7: =E7+F7 -> 5 | E7: 2 | F7: 3 | G7: -2 | H7: 85 | I7: 13236 | J7: 2652.5 | K7: 2643.6666666666665 | L7: 442.08333333333331 | M7: 440.61111111111109
A8: 7 | B8: ESV Oberhausen 2 | C8: 5 | D8: =E8+F8 -> 5 | E8: 5 | F8: 0 | G8: -4 | H8: 79 | I8: 12190 | J8: 2467.6666666666665 | K8: 2393.5 | L8: 411.27777777777777 | M8: 398.91666666666669
A9: 8 | B9: SK Kleve 3 | C9: 5 | D9: =E9+F9 -> 3 | E9: 2 | F9: 1 | G9: -6 | H9: 75 | I9: 12381 | J9: 2608 | K9: 2278.5 | L9: 434.66666666666669 | M9: 379.75

A1: Pl. | B1: Spieler | C1: Mannschaft | D1: S. | E1: EWP | F1: Ø | G1: Holz | H1: Ø | I1: Ø H. | J1: Ø A. | K1: Max
A2: 1 | B2: Exner, Guido | C2: SKC Vesalia Wesel 1 | D2: 5 | E2: 37 | F2: 7.4 | G2: 3575 | H2: 715.0 | I2: 739.5 | J2: 698.7 | K2: 747
A3: 2 | B3: Fusek, Manfred | C3: SK Kamp-Lintfort 6 | D3: 5 | E3: 34 | F3: 6.8 | G3: 3680 | H3: 736.0 | I3: 750.7 | J3: 714.0 | K3: 766
A4: 3 | B4: Brand, Horst | C4: SKC Kapellen 2 | D4: 5 | E4: 32 | F4: 6.4 | G4: 3369 | H4: 673.8 | I4: 678.5 | J4: 670.7 | K4: 699
A5: 4 | B5: Saemann, Horst | C5: SKC Vesalia Wesel 1 | D5: 5 | E5: 30 | F5: 6.0 | G5: 3445 | H5: 689.0 | I5: 708.0 | J5: 676.3 | K5: 722
A6: 5 | B6: van Lier, Michael | C6: SKV Rees 4 | D6: 4 | E6: 28 | F6: 7.0 | G6: 2907 | H6: 726.8 | I6: 745.0 | J6: 720.7 | K6: 745
A7: 6 | B7: Sobczak, Wilfried | C7: SK Kamp-Lintfort 6 | D7: 4 | E7: 27 | F7: 6.8 | G7: 2949 | H7: 737.3 | I7: 727.7 | J7: 766.0 | K7: 766
A8: 7 | B8: Bruns, Georg | C8: BW 61 Mülheim 4 | D8: 5 | E8: 27 | F8: 5.4 | G8: 3388 | H8: 677.6 | I8: 677.7 | J8: 677.5 | K8: 695
A9: 8 | B9: Neumann, Hans-Dieter | C9: BW 61 Mülheim 4 | D9: 4 | E9: 26 | F9: 6.5 | G9: 2814 | H9: 703.5 | I9: 711.7 | J9: 679.0 | K9: 717
A10: 9 | B10: Bunde, Siegfried | C10: SKC Kapellen 2 | D10: 5 | E10: 26 | F10: 5.2 | G10: 3316 | H10: 663.2 | I10: 647.5 | J10: 673.7 | K10: 714
A11: 10 | B11: Schiffer jun., Matthias | C11: SK 54/59 Essen-Borbeck 2 | D11: 4 | E11: 25 | F11: 6.3 | G11: 2874 | H11: 718.5 | I11: 722.0 | J11: 717.3 | K11: 722
A12: 11 | B12: Wilkes, Frank | C12: SK Kleve 3 | D12: 5 | E12: 25 | F12: 5.0 | G12: 3215 | H12: 643.0 | I12: 674.3 | J12: 596.0 | K12: 679
A13: 12 | B13: Ebert, Heinz-Willi | C13: SK 54/59 Essen-Borbeck 2 | D13: 3 | E13: 23 | F13: 7.7 | G13: 2235 | H13: 745.0 | J13: 745.0 | K13: 750
A14: 13 | B14: Hülsken, Andre | C14: SKV Rees 4 | D14: 5 | E14: 23 | F14: 4.6 | G14: 3327 | H14: 665.4 | I14: 659.5 | J14: 669.3 | K14: 729
A15: 14 | B15: Duyf, Heinz | C15: ESV Oberhausen 2 | D15: 5 | E15: 23 | F15: 4.6 | G15: 3192 | H15: 638.4 | I15: 634.0 | J15: 645.0 | K15: 656
A16: 15 | B16: Spath, Anton | C16: SK Kamp-Lintfort 6 | D16: 5 | E16: 22 | F16: 4.4 | G16: 3457 | H16: 691.4 | I16: 696.3 | J16: 684.0 | K16: 715
A17: 16 | B17: Bracun, Friedhelm | C17: SK Kamp-Lintfort 6 | D17: 4 | E17: 19 | F17: 4.8 | G17: 2759 | H17: 689.8 | I17: 696.3 | J17: 670.0 | K17: 737
A18: 17 | B18: Kröber, Dietmar | C18: BW 61 Mülheim 4 | D18: 4 | E18: 19 | F18: 4.8 | G18: 2666 | H18: 666.5 | I18: 670.7 | J18: 654.0 | K18: 678
A19: 18 | B19: Pötters, Günter | C19: ESV Oberhausen 2 | D19: 5 | E19: 19 | F19: 3.8 | G19: 3046 | H19: 609.2 | I19: 609.0 | J19: 609.5 | K19: 632
A20: 19 | B20: Engels, Erwin | C20: SKC Kapellen 2 | D20: 4 | E20: 18 | F20: 4.5 | G20: 2634 | H20: 658.5 | I20: 636.0 | J20: 681.0 | K20: 687
A21: 20 | B21: Griess, Walter | C21: ESV Oberhausen 2 | D21: 4 | E21: 15 | F21: 3.8 | G21: 2280 | H21: 570.0 | I21: 624.0 | J21: 516.0 | K21: 635
A22: 21 | B22: Thissen, Norbert | C22: SK Kleve 3 | D22: 2 | E22: 14 | F22: 7.0 | G22: 1434 | H22: 717.0 | I22: 717.0 | K22: 730
A23: 22 | B23: Schiffer, Matthias | C23: SK 54/59 Essen-Borbeck 2 | D23: 4 | E23: 14 | F23: 3.5 | G23: 2709 | H23: 677.3 | I23: 672.0 | J23: 679.0 | K23: 705
A24: 23 | B24: van den Boom, Rainer | C24: SKV Rees 4 | D24: 5 | E24: 14 | F24: 2.8 | G24: 3189 | H24: 637.8 | I24: 642.0 | J24: 635.0 | K24: 660
A25: 24 | B25: Floeth, Willi | C25: SKC Kapellen 2 | D25: 4 | E25: 13 | F25: 3.3 | G25: 2503 | H25: 625.8 | I25: 604.5 | J25: 647.0 | K25: 657
A26: 25 | B26: Schröter, Horst | C26: ESV Oberhausen 2 | D26: 4 | E26: 12 | F26: 3.0 | G26: 2373 | H26: 593.3 | I26: 591.3 | J26: 599.0 | K26: 613
A27: 26 | B27: Wachs, Michael | C27: SK 54/59 Essen-Borbeck 2 | D27: 2 | E27: 11 | F27: 5.5 | G27: 1356 | H27: 678.0 | I27: 678.0 | K27: 689
A28: 27 | B28: Schaffeld, Jürgen | C28: ESV Oberhausen 2 | D28: 2 | E28: 10 | F28: 5.0 | G28: 1299 | H28: 649.5 | I28: 652.0 | J28: 647.0 | K28: 652
A29: 28 | B29: Hausmann, Günter | C29: SK Kleve 3 | D29: 2 | E29: 10 | F29: 5.0 | G29: 1348 | H29: 674.0 | I29: 674.0 | K29: 681
A30: 29 | B30: Swoboda, Udo | C30: SK Kleve 3 | D30: 3 | E30: 10 | F30: 3.3 | G30: 1769 | H30: 589.7 | I30: 637.0 | J30: 566.0 | K30: 637
A31: 30 | B31: van Lier, Tobias | C31: SKV Rees 4 | D31: 4 | E31: 9 | F31: 2.3 | G31: 2525 | H31: 631.3 | I31: 669.0 | J31: 618.7 | K31: 669
A32: 31 | B32: Elsner, Christian | C32: SK 54/59 Essen-Borbeck 2 | D32: 1 | E32: 8 | F32: 8.0 | G32: 732 | H32: 732.0 | I32: 732.0 | K32: 732
A33: 32 | B33: Flegel, Michael | C33: SK 54/59 Essen-Borbeck 2 | D33: 1 | E33: 8 | F33: 8.0 | G33: 731 | H33: 731.0 | I33: 731.0 | K33: 731
A34: 33 | B34: Kox, Herbert | C34: SK Kleve 3 | D34: 3 | E34: 8 | F34: 2.7 | G34: 1741 | H34: 580.3 | I34: 604.0 | J34: 568.5 | K34: 609
A35: 34 | B35: Dentgen, Andre | C35: BW 61 Mülheim 4 | D35: 1 | E35: 7 | F35: 7.0 | G35: 709 | H35: 709.0 | I35: 709.0 | K35: 709
A36: 35 | B36: Clemens, Oliver | C36: BW 61 Mülheim 4 | D36: 4 | E36: 7 | F36: 1.8 | G36: 2376 | H36: 594.0 | I36: 603.5 | J36: 584.5 | K36: 605
A37: 36 | B37: van der Staad, Cees | C37: SK Kleve 3 | D37: 4 | E37: 7 | F37: 1.8 | G37: 2343 | H37: 585.8 | I37: 623.5 | J37: 548.0 | K37: 634
A38: 37 | B38: Birn, Klaus | C38: SK Kamp-Lintfort 6 | D38: 1 | E38: 6 | F38: 6.0 | G38: 718 | H38: 718.0 | J38: 718.0 | K38: 718
A39: 38 | B39: Rothe, Helmut | C39: BW 61 Mülheim 4 | D39: 1 | E39: 6 | F39: 6.0 | G39: 653 | H39: 653.0 | J39: 653.0 | K39: 653
A40: 39 | B40: Schlaghecken, Robert | C40: SKV Rees 4 | D40: 1 | E40: 6 | F40: 6.0 | G40: 645 | H40: 645.0 | I40: 645.0 | K40: 645
A41: 40 | B41: Giesen, Johannes | C41: SKC Vesalia Wesel 1 | D41: 4 | E41: 6 | F41: 1.5 | G41: 2288 | H41: 572.0 | I41: 585.0 | J41: 559.0 | K41: 620
A42: 41 | B42: Räsing, Josef | C42: SKC Vesalia Wesel 1 | D42: 4 | E42: 6 | F42: 1.5 | G42: 2169 | H42: 542.3 | I42: 567.5 | J42: 517.0 | K42: 585
A43: 42 | B43: Dentgen, Ralf | C43: BW 61 Mülheim 4 | D43: 1 | E43: 5 | F43: 5.0 | G43: 651 | H43: 651.0 | J43: 651.0 | K43: 651
A44: 43 | B44: Czeke, Alexander | C44: SKV Rees 4 | D44: 1 | E44: 5 | F44: 5.0 | G44: 643 | H44: 643.0 | I44: 643.0 | K44: 643
A45: 44 | B45: Hensing, Jan | C45: SK 54/59 Essen-Borbeck 2 | D45: 3 | E45: 5 | F45: 1.7 | G45: 1829 | H45: 609.7 | I45: 607.0 | J45: 611.0 | K45: 619
A46: 45 | B46: Bansmann, Robert | C46: SK 54/59 Essen-Borbeck 2 | D46: 1 | E46: 3 | F46: 3.0 | G46: 702 | H46: 702.0 | J46: 702.0 | K46: 702
A47: 46 | B47: Gerth, Friedhelm | C47: SKC Vesalia Wesel 1 | D47: 1 | E47: 3 | F47: 3.0 | G47: 629 | H47: 629.0 | J47: 629.0 | K47: 629
A48: 47 | B48: Korth, Manfred | C48: SK Kamp-Lintfort 6 | D48: 1 | E48: 1 | F48: 1.0 | G48: 603 | H48: 603.0 | J48: 603.0 | K48: 603
A49: 48 | B49: Esser, Hans | C49: SKC Kapellen 2 | D49: 1 | E49: 1 | F49: 1.0 | G49: 553 | H49: 553.0 | J49: 553.0 | K49: 553
A50: 49 | B50: Terbonssen, Franz | C50: SKC Kapellen 2 | D50: 1 | E50: 1 | F50: 1.0 | G50: 506 | H50: 506.0 | J50: 506.0 | K50: 506
A51: 50 | B51: Berson, Rene | C51: SK Kleve 3 | D51: 1 | E51: 1 | F51: 1.0 | G51: 617 | H51: 617.0 | I51: 617.0 | K51: 617
A52: 51 | B52: Keilig-Bruns, Petra | C52: SK 54/59 Essen-Borbeck 2 | D52: 1 | E52: 1 | F52: 1.0 | G52: 532 | H52: 532.0 | I52: 532.0 | K52: 532

A1: ESV Oberhausen 2 | D1: Blau-Weiß 61 Mülheim 4
A2: Pötters, Günter | B2: 632 | C2: 4 | D2: Bruns, Georg | E2: 672 | F2: 7
A3: Duyf, Heinz | B3: 632 | C3: 3 | D3: Kröber, Ditmar | E3: 654 | F3: 6
A4: Schröter, Horst | B4: 599 | C4: 2 | D4: Neumann, Hans-Dieter | E4: 679 | F4: 8
A5: Schaffeld, Jürgen | B5: 652 | C5: 5 | D5: Clemens, Oliver | E5: 564 | F5: 1
A6: Einzelwertungspunkte (EWP) | C6: 14 | D6: 22
A7: Punkte | C7: 0 | D7: 3
A8: Holzzahl | C8: 2515 | D8: 2569

A1: Blau-Weiß 61 Mülheim 4 | D1: SK Kamp-Lintfort 6
A2: Kröber, Ditmar | B2: 678 | C2: 6 | D2: Spath, Anton | E2: 653 | F2: 3
A3: Clemens, Oliver | B3: 605 | C3: 2 | D3: Fusek, Manfred | E3: 721 | F3: 8
A4: Neumann, Hans-Dieter | B4: 717 | C4: 7 | D4: Bracun, Friedhelm | E4: 670 | F4: 5
A5: Bruns, Georg | B5: 657 | C5: 4 | D5: Korth, Manfred | E5: 603 | F5: 1
A6: Einzelwertungspunkte (EWP) | C6: 19 | D6: 17
A7: Punkte | C7: 2 | D7: 1
A8: Holzzahl | C8: 2557 | D8: 2647

A1: Blau-Weiß 61 Mülheim 4 | D1: SKV Rees 4
A2: Kröber, Dietmar | B2: 670 | C2: 4 | D2: Hülsken, Andre | E2: 729 | F2: 8
A3: Clemens, Oliver | B3: 602 | C3: 2 | D3: van Lier, Michael | E3: 718 | F3: 7
A4: Neumann, Hans-Dieter | B4: 710 | C4: 6 | D4: van Lier, Tobias | E4: 595 | F4: 1
A5: Bruns, Georg | B5: 695 | C5: 5 | D5: van den Boom, Rainer | E5: 620 | F5: 3
A6: Einzelwertungspunkte (EWP) | C6: 17 | D6: 19
A7: Punkte | C7: 2 | D7: 1
A8: Holzzahl | C8: 2677 | D8: 2662

A1: SKC Kapellen 2 | D1: Blau-Weiß 61 Mülheim 4
A2: Brand, Horst | B2: 689 | C2: 8 | D2: Rothe, Helmut | E2: 653 | F2: 6
A3: Floeth, Willi | B3: 572 | C3: 1 | D3: Dentgen, Ralf | E3: 651 | F3: 5
A4: Bunde, Siegfried | B4: 636 | C4: 4 | D4: Bruns, Georg | E4: 683 | F4: 7
A5: Engels, Erwin | B5: 623 | C5: 3 | D5: Clemens, Oliver | E5: 605 | F5: 2
A6: Einzelwertungspunkte (EWP) | C6: 16 | D6: 20
A7: Punkte | C7: 0 | D7: 3
A8: Holzzahl | C8: 2520 | D8: 2592

A1: Blau-Weiß 61 Mülheim 4 | D1: SKC Vesalia Wesel
A2: Neumann, Hans-Dieter | B2: 708 | C2: 5 | D2: Exner, Guido | E2: 738 | F2: 8
A3: Kröber, Dietmar | B3: 664 | C3: 3 | D3: Giesen, Johannes | E3: 596 | F3: 2
A4: Dentgen, Andre | B4: 709 | C4: 7 | D4: Saemann, Horst | E4: 708 | F4: 6
A5: Bruns, Georg | B5: 681 | C5: 4 | D5: Räsing, Josef | E5: 499 | F5: 1
A6: Einzelwertungspunkte (EWP) | C6: 19 | D6: 17
A7: Punkte | C7: 2 | D7: 1
A8: Holzzahl | C8: 2762 | D8: 2541

A1: Datum | B1: Spieltag | C1: Nr. | D1: Uhrzeit | E1: Heim | G1: Gast | H1: Punkte | I1: ZW | J1: Holz
A2: 11.09.2011 | B2: 1 | C2: 1 | D2: 10:00 | E2: ESV Oberhausen 2 | F2: - | G2: SK Kleve 3 | H2: 3 : 0 | I2: 26:10 | J2: 2489:2072
C3: 2 | D3: 13:00 | E3: SK Kamp-Lintfort 6 | F3: - | G3: SK 54/59 Essen-Borbeck 2 | H3: 2 : 1 | I3: 20:16 | J3: 2897:2835
C4: 3 | D4: 16:00 | E4: BW 61 Mülheim 4 | F4: - | G4: SKC Vesalia Wesel | H4: 2 : 1 | I4: 19:17 | J4: 2762:2541
C5: 4 | D5: 13:00 | E5: SKV Rees 4 | F5: - | G5: SKC Kapellen 2 | H5: 2 : 1 | I5: 21:15 | J5: 2605:2423
A6: 18.09.2011 | B6: 2 | C6: 5 | D6: 11:00 | E6: SKC Kapellen 2 | F6: - | G6: BW 61 Mülheim 4 | H6: 0 : 3 | I6: 16:20 | J6: 2520:2596
C7: 6 | D7: 10:00 | E7: SK Kleve 3 | F7: - | G7: SKV Rees 4 | H7: 2 : 1 | I7: 20:16 | J7: 2697:2674
C8: 7 | D8: 13:00 | E8: SK 54/59 Essen-Borbeck 2 | F8: - | G8: ESV Oberhausen 2 | H8: 3 : 0 | I8: 26:10 | J8: 2814:2385
C9: 8 | D9: 10:00 | E9: SKC Vesalia Wesel | F9: - | G9: SK Kamp-Lintfort 6 | H9: 0 : 3 | I9: 13:23 | J9: 2611:2906
A10: 02.10.2011 | B10: 3 | C10: 9 | D10: 13:00 | E10: BW 61 Mülheim 4 | F10: - | G10: SKV Rees 4 | H10: 2 : 1 | I10: 17:19 | J10: 2677:2662
C11: 10 | D11: 10:00 | E11: ESV Oberhausen 2 | F11: - | G11: SKC Vesalia Wesel | H11: 2 : 1 | I11: 18:18 | J11: 2399:2388
C12: 11 | D12: 13:00 | E12: SK Kamp-Lintfort 6 | F12: - | G12: SKC Kapellen 2 | H12: 3 : 0 | I12: 26:10 | J12: 2885:2568
C13: 12 | D13: 10:00 | E13: SK Kleve 3 | F13: - | G13: SK 54/59 Essen-Borbeck 2 | H13: 0 : 3 | I13: 16:20 | J13: 2667:2733
A14: 16.10.2011 | B14: 4 | C14: 13 | D14: 10:00 | E14: SKC Vesalia Wesel | F14: - | G14: SK Kleve 3
C15: 14 | D15: 13:00 | E15: SKV Rees 4 | F15: - | G15: SK 54/59 Essen-Borbeck 2
C16: 15 | D16: 10:00 | E16: BW 61 Mülheim 4 | F16: - | G16: SK Kamp-Lintfort 6
C17: 26 | D17: 11:00 | E17: SKC Kapellen 2 | F17: - | G17: ESV Oberhausen 2
A18: 23.10.2011 | B18: 5 | C18: 17 | D18: 10:00 | E18: SK Kamp-Lintfort 6 | F18: - | G18: SKV Rees 4
C19: 18 | D19: 13:00 | E19: SK Kleve 3 | F19: - | G19: SKC Kapellen 2
C20: 19 | D20: 13:00 | E20: SK 54/59 Essen-Borbeck 2 | F20: - | G20: SKC Vesalia Wesel
C21: 20 | D21: 10:00 | E21: ESV Oberhausen 2 | F21: - | G21: BW 61 Mülheim 4
A22: 06.11.2011 | B22: 6 | C22: 21 | D22: 11:00 | E22: SKC Kapellen 2 | F22: - | G22: SK 54/59 Essen-Borbeck 2
C23: 22 | D23: 13:00 | E23: SK Kamp-Lintfort 6 | F23: - | G23: ESV Oberhausen 2
C24: 23 | D24: 16:00 | E24: BW 61 Mülheim 4 | F24: - | G24: SK Kleve 3
C25: 24 | D25: 13:00 | E25: SKV Rees 4 | F25: - | G25: SKC Vesalia Wesel
A26: 13.11.2011 | B26: 7 | C26: 25 | D26: 16:00 | E26: SKC Vesalia Wesel | F26: - | G26: SKC Kapellen 2
C27: 26 | D27: 13:00 | E27: SK 54/59 Essen-Borbeck 2 | F27: - | G27: BW 61 Mülheim 4
C28: 27 | D28: 10:00 | E28: ESV Oberhausen 2 | F28: - | G28: SKV Rees 4
C29: 28 | D29: 16:00 | E29: SK Kleve 3 | F29: - | G29: SK Kamp-Lintfort 6

A1: Datum | B1: Spieltag | C1: Nr. | D1: Uhrzeit | E1: Heim | G1: Gast | H1: Punkte | I1: ZW | J1: Holz
A2: 27.11.2011 | B2: 8 | C2: 29 | D2: 10:00 | E2: SK Kleve 3 | F2: - | G2: ESV Oberhausen 2
C3: 30 | D3: 13:00 | E3: SK 54/59 Essen-Borbeck 2 | F3: - | G3: SK Kamp-Lintfort 6
C4: 31 | D4: 10:00 | E4: SKC Vesalia Wesel | F4: - | G4: BW 61 Mülheim 4
C5: 32 | D5: 13:00 | E5: SKC Kapellen 2 | F5: - | G5: SKV Rees 4
A6: 11.12.2011 | B6: 9 | C6: 33 | D6: 13:00 | E6: BW 61 Mülheim 4 | F6: - | G6: SKC Kapellen 2
C7: 34 | D7: 13:00 | E7: SKV Rees 4 | F7: - | G7: SK Kleve 3
C8: 35 | D8: 10:00 | E8: ESV Oberhausen 2 | F8: - | G8: SK 54/59 Essen-Borbeck 2
C9: 36 | D9: 13:00 | E9: SK Kamp-Lintfort 6 | F9: - | G9: SKC Vesalia Wesel
A10: 15.01.2012 | B10: 10 | C10: 37 | D10: 18:00 | E10: SKV Rees 4 | F10: - | G10: BW 61 Mülheim 4
C11: 38 | D11: 10:00 | E11: SKC Vesalia Wesel | F11: - | G11: ESV Oberhausen 2
C12: 39 | D12: 11:00 | E12: SKC Kapellen 2 | F12: - | G12: SK Kamp-Lintfort 6
C13: 40 | D13: 16:00 | E13: SK 54/59 Essen-Borbeck 2 | F13: - | G13: SK Kleve 3
A14: 12.02.2012 | B14: 11 | C14: 41 | D14: 16:00 | E14: SK Kleve 3 | F14: - | G14: SKC Vesalia Wesel
C15: 42 | D15: 17:00 | E15: SK 54/59 Essen-Borbeck 2 | F15: - | G15: SKV Rees 4
C16: 43 | D16: 10:00 | E16: SK Kamp-Lintfort 6 | F16: - | G16: BW 61 Mülheim 4
C17: 44 | D17: 10:00 | E17: ESV Oberhausen 2 | F17: - | G17: SKC Kapellen 2
A18: 26.02.2012 | B18: 12 | C18: 45 | D18: 13:00 | E18: SKV Rees 4 | F18: - | G18: SK Kamp-Lintfort 6
C19: 46 | D19: 11:00 | E19: SKC Kapellen 2 | F19: - | G19: SK Kleve 3
C20: 47 | D20: 10:00 | E20: SKC Vesalia Wesel | F20: - | G20: SK 54/59 Essen-Borbeck 2
C21: 48 | D21: 13:00 | E21: BW 61 Mülheim 4 | F21: - | G21: ESV Oberhausen 2
A22: 04.03.2012 | B22: 13 | C22: 49 | D22: 16:00 | E22: SK 54/59 Essen-Borbeck 2 | F22: - | G22: SKC Kapellen 2
C23: 50 | D23: 10:00 | E23: ESV Oberhausen 2 | F23: - | G23: SK Kamp-Lintfort 6
C24: 51 | D24: 10:00 | E24: SK Kleve 3 | F24: - | G24: BW 61 Mülheim 4
C25: 52 | D25: 16:00 | E25: SKC Vesalia Wesel | F25: - | G25: SKV Rees 4
A26: 25.03.2012 | B26: 14 | C26: 53 | D26: 11:00 | E26: SKC Kapellen 2 | F26: - | G26: SKC Vesalia Wesel
C27: 54 | D27: 13:00 | E27: BW 61 Mülheim 4 | F27: - | G27: SK 54/59 Essen-Borbeck 2
C28: 55 | D28: 13:00 | E28: SKV Rees 4 | F28: - | G28: ESV Oberhausen 2
C29: 56 | D29: 13:00 | E29: SK Kamp-Lintfort 6 | F29: - | G29: SK Kleve 3